title,link,post_time,post_text,comments
Paul N. Hilfinger :,https://www.reddit.com/r/berkeley/comments/fnc5zs/paul_n_hilfinger/,2020-03-22 19:17:16,"""At this time, we have not decided within the department how we will deal with the GPA cutoff for admission to the major"".

&#x200B;

&#x200B;

&#x200B;

3.3 -> 4.0

RIP intended CS","He was referring to the PNP for CS prerequisites, not increasing the cap for the major.
Please understand, not decided does not mean that there are not discussions. Everyone is trying to find the most fair policy to accept and allow P/NP grades, we just have not decided what is best.
""At this time, we have not decided within the department how we will deal with the GPA cutoff for admission to the major.  However, I will keep all information needed to reconstruct letter grades, so as to be ready for any decision.""

Context clues my dude. He's referring to the P/NP news, not raising the cap.
I don’t think they can change anything for anyone pre-cs rn, prob class of 2024 is screwed
Not like it matters anymore the cs job market is fucked. Internships are being cancelled right now, and companies are laying off hundreds of senior devs.
i mean by how he said ""GPA cutoff for admission to the major"" sounds more like changing the cap for the major to me.
What's your opinion on 61b's grade bins being moved?

I assume they were originally moved because the department can't raise the GPA requirement post-admission without push back.

I personally believe the cap should just be raised (though, I think that's a bad idea). The deflation is harmful to students. Sure, it may be half of a letter grade, but it hurts for jobs, grad schools, etc. 

It's not the students fault. I don't think anyone's grad school or career chances should be affected because the CS is more over-enrolled this year compared to the last few.
lmao this spread of false information is why our generation is fucked not the job market
Source?
https://twitter.com/ngruending/status/1241074768691879936?s=19
He was referring to how to incorporate Ps in the class with the cutoff. You have never been allowed to PNP major requirement before, so this is something we have to consider.

Also the reason he raised the bins in the first place was to limit admission into the major so the cap would not have to be raised, seems odd to lower the bins given that
I don't really know anything about how the bins have been moved. Though, I also try not to tell my colleagues how to do their jobs. :) 

I assume you mean raising both the requirement and average grade target? Yeah, I see that view. I think there's general push back against grade inflation, but I personally don't have strong feelings... My strong feelings are that grades are harmful writ large and so I'm kind 🤷 about many other things grade related.
An anecdotal tweet is not really a source for your statement
i'm pretty sure he lowered the bins due to the pandemic lol
The fed is projecting 30% unemployment, and all the market indices are plummeting right now. You honestly don't think that this tweet, which is a personal account of a senior dev in a medium sized software company is indicative of what's to come? Take a look at the cscareers subredit. There are a lot of people that are losing their internships with companies also doing hiring freezes.
lowkey thought it was going to happen anyway but hey whatever works"
Prof. Hilfinger’s Contacts?,https://www.reddit.com/r/berkeley/comments/17llr2o/prof_hilfingers_contacts/,2023-11-01 13:42:53,Hey everyone! I graduated in 2022 but am planning on applying to masters programs this cycle. I want to reach out to Prof. Paul Hilfinger to ask for his LOR but realized that he’s retired - does anyone have his contacts by chance? Thanks sm!!,"We’re you a TA for him or something?

You should have contacted him before, professors hate it when they get asked about favors during sabbatical and retirement"
CS or EECS for unit ceiling at Cal,https://www.reddit.com/r/berkeley/comments/16haesd/cs_or_eecs_for_unit_ceiling_at_cal/,2023-09-12 19:08:13,"Hello, 

I'm considering transferring to Cal from a CCC for EECS or CS and I'm curious about the experiences of others in managing the 5-semester timeframe set by the CoE. 

Has anyone found this time limit restrictive, especially when aiming to enroll in a series of highly rated courses such as: 

\- CS70: Discrete Math and Probability Theory (offered by Satish Rao or Anant Sahai)

\- CS170: Efficient Algorithms and Intractable Problems (by Christos Papadimitriou)

\- CS188: Introduction to Artificial Intelligence (taught by a team including Anca Dragan, Pieter Abbeel, and Dan Klein)

\- CS189: Introduction to Machine Learning (with Johnathon Shewchuk)

\- CS161: Computer Security (Nick Weaver)

\- CS168: Networking (Scott Shenker)

\- CS186: Databases (Joe Hellerstein)

\- CS164: Programming Languages and Compilers (Paul Hilfinger)

\- CS162: Operating Systems (Ion Stoica)

\- CS184: Computer Graphics (Ren Ng)

Would it be better to apply for CS in the College of Letters since I received most of my credits through AP or dual enrollment during HS?

I would love to take all of these courses if feasible. Would it be better to consider taking some of them (if possible) or their equivalents during graduate school instead?

Thank you!","I don’t think it matters since CS is direct admit now. It seems doable in 5 semesters.
Typically you’ll want to take 2 techs a semester and transfers usually redo cs61a and Cs61C, many do 61b as well. Also, eecs16a and 16b are mandatory for EECS, so basically junior year is for lower divs. Then with three semesters left you can take 6 techs comfortably or 8/9 very uncomfortably (or using summers). There are two CCCs that can give you credit for 61C and 61B I think.
So does that mean that CS also must be completed in 5 semesters? Is it not in the College of Letters and Science?
The 5 semester ceiling is only for CoE transfer students in EECS. 

For L&S CS, you can go as many semesters as you want as long as you are under 130 units (for a single major).  In reality, it would be extremely difficult to go over say 6 semesters without going over 130 units.
No CS has a unit ceiling policy where you can keep extending if you have <= 130 units."
"EECS 101 Piazza: EECS professor Paul Hilfinger's programming content. ""This year's contest is scheduled for Saturday, 14 October 2017. The contest will start at 10:30 and end at 15:30. Meet in 306 Soda at 10:00.""",https://www.reddit.com/r/berkeley/comments/750khr/eecs_101_piazza_eecs_professor_paul_hilfingers/,2017-10-08 01:14:20,"EECS 101 Piazza post: [https://piazza.com/class/hyq0br1u3kx7dg?cid=5109](https://piazza.com/class/hyq0br1u3kx7dg?cid=5109)

## **Instructor's Piazza post**

> **Berkeley Programming Contest on 10/14/17**  
  
> **Announcements**

> - This year's contest is scheduled for Saturday, 14 October 2017. The contest will start at 10:30 and end at 15:30. Meet in 306 Soda at 10:00. 
> - You can now [register for this year's contest.](https://inst.eecs.berkeley.edu/~ctest/contest/register)
> - Here is the [full contest announcement](http://inst.eecs.berkeley.edu/~ctest/contest/announcement.pdf). Here are the [contest rules and procedures](http://inst.eecs.berkeley.edu/~ctest/contest/rules.pdf) (PDF format). You can also find some history and past results [on this web page.](http://www.eecs.berkeley.edu/~hilfingr/programming-contest/)
> - **Remote people:** Problems will become available at 1030 on the day of the contest. Professor Hilfinger suggests log into a campus machine before then to get set up for submission.",
"Sanil Rajput: A copy editor on computer science. ""'The Infamous Paul Hilfinger' frequently receives UCBMFET recognition for the overwhelming difficulty of his projects. As a CS 61B student, I've had the privilege of being Hil-fingered by a project requiring students to build their own SQL database.""",http://www.dailycal.org/2017/10/15/pro-grammar-copy-editor-computer-science/,2017-10-15 23:40:47,,">  Anyone can type a bunch of variables and functions onto a page and print “Hello World.” The difficult part is figuring out if the code is broken and, if so, how to fix it... Copy editing has also provided me with a sharper sense of what to look for and increased my reading speed, which is important in trying to complete projects in great time, or should I say, Big O(1).

lmao when [posts satirizing cs majors](https://i.imgur.com/4tFyX8Z.png) who think that they're smarter than they actually are become indistinguishable from dailycal writers 

gj /u/notkmbabua /u/berkeley-throw-away
Lol Hugs project last semester was harder than this one 
I aspire to be the best!
Apparently they have to do Git though.
It was a partner project though
Eh not for me "
old CS61A recordings for Spring 2021?,https://www.reddit.com/r/berkeley/comments/kpfk3k/old_cs61a_recordings_for_spring_2021/,2021-01-02 22:36:50,I'm taking CS61A next semester with Paul Hilfinger. I've heard that Denero is an amazing professor but sadly he won't be teaching the class Spring 2021 :( Would I be able to watch Denero's recorded lectures for previous semesters and still be on the right track for the course?,"You should be fine
denero lectures here: https://www.youtube.com/user/papajohnno"
Youngest picture of hilfinger?,https://www.reddit.com/r/berkeley/comments/5ukme3/youngest_picture_of_hilfinger/,2017-02-16 22:08:29,can anyone find a younger picture of hilfinger than this? http://vcresearch.berkeley.edu/sites/default/files/styles/faculty_node/public/legacy/paul_hilfinger.gif?itok=09QDVHY6 ,"Here you go:
http://imgur.com/a/5e5WV

What a hottie

It wasn't very hard to find Paul Hilfinger's senior photo. Apparently, he graduated from Groves High School in 1969.

(Source: http://www.classmates.com/siteui/yearbooks/199760?page=217)
Fun fact: His caffeinated beverage of choice is an extra hot latte without foam. 

Source: I used to make extra hot lattes without foam for him at a cafe. 
Besides being super lucky that someone uploaded that yearbook! I dare you to get that lucky again with other professors.
no^seriously^I^dare^you
Brewed Awakening no doubt
Is that website behind paywall? I can't see the yearbook.
not paywall, but registration wall
Yeah just used a fake email. "
Exciting new Cal experience!,https://www.reddit.com/r/berkeley/comments/farany/exciting_new_cal_experience/,2020-02-27 23:50:39,"Today marks the first time I ever cried in the Moffitt bathroom! I've heard from a lot of people that it's a uniquely essential part of the Cal experience, and that apparently everyone goes through it. I really didn't want to miss out on such an integral part of being a Bear, so when I joined Cal I knew that I just had to take this famous ""Hilfinger's 61B"" that had everyone so hyped up! I mean, literally everyone talks about it... This Hilfinger guy is also super popular--he's got nearly 2,000 students in just one class! But anyways, since I've already achieved my goal to cry in the Moffitt bathroom, I feel like I won't need to stay at Cal any longer, so I will be dropping out. I thought I'd have to stay longer to hit my goal, but it looks like now I get to save 6 whole semesters of tuition, woot wooooot. Huge thank you shout-out to Paul and his super fun midterm for helping me achieve my goal!","I’m sorry for what you’ve gone through, if it helps, Hilfinger’s 61B 2nd midterm is notoriously hard (my semester the avg dipped below 50%), so, it is likely you didn’t do as bad as you might think....

On a lighthearted note, if you go to Moffitt 4th floor, and enter from the left side door while facing the bathroom, the long stall right next to the handicapped stall has an interesting record written on the wall, you should update it for future bears...
Its 8% of ur final grade, ur chillen
Also the one thing I like about Hilfinger is that he puts much more weight on the projects and hw rather than exams. If you’re a student like me, who’s always been “meh” on cs exams bc I was never clever enough to come up with the function solution, if you just do “meh” on the exams but focus on getting as many points as possible on the assignments, you’ll do fine! 

Good luck!
As someone absolute not in the know, can someone explain what 61B is?
[deleted]
Yeh but to get an A- i gotta get a 90% so goodbye
If you don't mind me asking, what'd you end up with in cs61a?
[removed]
Required course for all CS/EECS many other majors
Data structures
lol
Yikes..... I guess OP should also study hard for the 2nd midterm.... I’m sorry, but you got this!!
Id worry abt the projects more, enigma boutta stretch some assholes.
Reevaluate your situation! Don't drop out of college just because you didn't ace a class!! I know it *seems* like your entire life's fate depends on the CS 3.3, but even if you dont declare, you'll still have plenty of options. So many people go on to have happy, successful careers despite struggling in college. Adversity can be a good thing, because it makes us stronger in the long term.
An A-, even after bombing the second midterm. Hilfinger in 61a loved those “rearrange a linked questions” and I could never figure them out 🙃
Hey, the other two parts may be true, but I am NOT EECS smh.
Hilfinger said it's overall not as difficult as signpost? Like longer maybe but not too difficult"
"The first ""real"" jobs of UC Berkeley's esteemed faculty. Alex Filippenko: gift shop salesperson. Darren Zook: bagging groceries in Texas. Laura Stoker: McDonalds. Joshua Hug: intern at at Lockheed Martin. Martha Olney: babysitter. Paul Hilfinger: Summer job with Chevrolet Engineering Division of GM.",http://www.dailycal.org/2017/09/11/uc-berkeley-professors-talk-first-jobs/,2017-09-11 23:16:12,,"I can definitely see Filippenko as a gift shop salesperson. He's exactly the kind of person I'd want to buy my souvenir shot glasses from.
The thought of Josh Hug working at Lockheed Martin makes me chuckle, even if he didn't do anything."
Who is the Most Fun Professor You've Had Here?,https://www.reddit.com/r/berkeley/comments/17w0z4l/who_is_the_most_fun_professor_youve_had_here/,2023-11-15 11:04:15,I'm trying to find a professor who seems like they understand fun. Someone you may have run into at a bar or who generally seems to support student engagement and entertainment. This is for an interview hopefully so please let me know if anyone comes to mind.,"Professor Darren Zook!!!
Filippenko in the astronomy department (seriously an intellectual and comedic powerhouse) and Landreth in the English department (he’s so funny and his interpretations of literature are so beautiful and entertaining to hear)
Professor Lowhorn
[deleted]
I really loved Professor Beatty (he was my professor for MCB 50 and 55). He was really energetic and sassy. I also loved Professor Gibbs (she taught the second third of Bio 1A - she does it in the spring). She was teaching challenging material, but she was practically jumping around Pimentel Hall at 8 am.
For me it’s Professor Lowman he’s just so sassy in class and laughs at the chat’s chaos lmao
unpopular opinion but Shobhana Stoyanov in stats was hilarious lol, she also cared way more about her students than most professors I had during my time at Cal.
James Campbell!! Literally ran into him at a bar during dead week!!
Pete Marsden for sure
\[Disclaimer: 20 years ago, but I think he might still be around\]

Prof. Wenk in Geology.

Back in my day he organized week-long field trips out to the desert. The trip was a whole upper div course. Hiking and sightseeing all day. Every night camping with steaks and things on the campfire.

I can't recall if there was beer, but it was 20 years ago so probably.

Best class I ever took. Awesome dude.

I think we all got an A too.
Josh Hug. He has a really cool taste in music (Aphex Twin, Melt Banana).
Prof. Adhikari fs 8)
djordje popovic!!!!
Daniel Neumark 

He’s like…cranky AF and salty to the core.  He has the sense of humor you might expect from the captain of a crab fishing ship during a snow storm in the Arctic circle.  He’s constantly on the edge of being really pissed off but he’s just polite enough to make wry jokes at nobody’s expense.  

Also Udi Isacoff is a real treat if you’re ever taking any neuro courses.
John Arnold for gen chem!
Professor Hilfinger 🌚
Lynn Huntsinger. Rangeland Ecology professor. She came to UC Forestry camp and at the end of her guest lecture week took out all the of-age students to the local dive bar. She is seriously a hoot.
Norman Sheu
Dan Garcia for sure
[deleted]
I love Bill White’s classes in Anthro but I’m not sure if he is teaching next semester
Norman Sheu, his lectures are great and he is a very fun person once you get to know him.
darren zook!
professor lawerence cohen, he teaches medical anthropology
Charles briggs anthro
prof firestone & prof ball!
Davina Chan she’s the best prof I’ve ever had in my life she really changed my outlook on life, besides all the academic stuff she taught me how to live life outside of school, she taught me things that I apply in my life daily. Will forever have such respect and appreciation for her.
Jim Campbell, Jean Ahn, Peter Bartou
Alex Craghead
Dan Garcia so far
61C with Garcia
my goat anant sahai
Shawn Chi
Mark Hellerstein
anant sahai
Professor Landreth in the English dept. That guy's a hoot!
Jerome Baggett, Sociology dept
Paul Fine
Mickey
jrs, man of duality
Jean Ahn
Ryan Edwards
might be a niche class but Professor Ben Hammed for COMLIT 100A
Either Dr. Mardsen, Dr. Lowhorn, or Professor Ball
Prof. John Kaiser, Sociology is awesome! Definitely seems like he knows how to have fun and how to chill
I'm a such a stan for Zook!!!
was gonna say this but i knew someone would have already commented lmao
He’s the best!
I'm with you there! He's so energetic and goofy!
Fr
lowhorn makes physics tolerable <3
Big ups to the 61c legend
yes yes yes
Also, I can't forget Dr. Shusterman from Chem 1A! She was absolutely legendary!
Loved Beatty omg
Agree ^^
I was going to say him as well. I’d love to get a beer with him. He was always fun in lecture, and seemed to really care about his students. I’m sure he would be amazing to hang out with outside of the school setting. Also, Jeremy Sanchez who is in the Stats department. He always seemed down to earth and like he’d be cool to hang out with. I hated Stat 20, but loved him as a teacher!
is that the philosophy one?
I second this. I had 2 classes with him and he was so fun!
duuuude he’s so chill
The goat himself
Spot on description! I like Neumark a lot- some of us can appreciate the curmudgeonly among us for their honesty and refusal to put on airs, if nothing else.
This has to be a joke
I love how he teaches he’s such an amazing prof
I took his folklore class to fulfill a req and it was one of my favorite classes I took at Cal!
which Lyapunov function u used to show convergence?
Best guy to get a beer with. 

(But wait until you’ve graduated! ;))
Econ 100A
Sameeee
ohh nvm lol i was thinking of john joseph campbell who is also a very fun professor :)"
