title,link,post_time,post_text,comments
Cogsci 1b final davina chan,https://www.reddit.com/r/berkeley/comments/1ckfv3l/cogsci_1b_final_davina_chan/,2024-05-04 18:24:22,"If you memorize the slides for her exams, is it doable? I heard that its really hard..
",
COGSCI 1B midterm w Davina Chan,https://www.reddit.com/r/berkeley/comments/1b2k8ae/cogsci_1b_midterm_w_davina_chan/,2024-02-28 14:55:01,"Hey there 

Anyone who took the class w Davina Chan? what does the midterm look like and what resources should I use while studying - kinda lost here;)

appreciate the help!!
",Literally everything from the slides. Know it inside and out. I made flashcards and practiced active recall which worked well for me. During the actual exam make sure to read the questions carefully as sometimes they are worded really weird. But overall her midterms are easier than she says they are.
cogsci 1b w davina chan,https://www.reddit.com/r/berkeley/comments/17bbn8z/cogsci_1b_w_davina_chan/,2023-10-18 22:30:49,"has anyone taken this class and knows how/what to study for her exams? i've heard they're really hard with a pretty good curve, but i literally have no idea what i should attempt to study to prepare for the exam

pls help!!","Ur cooked ☠️☠️☠️
hi! I’m looking to take her class next sem, is it really that difficult?
her curves are really not that good, at most 4 points.
Hella cooked
As upperhomework4987 mentioned in the other comments I did get a 43/200 on the midterm pre curve. However with the curve I got 194/200 sooooooo do with that info what you will
I heard someone got like 43/200 on that exam ☠️💀☠️💀☠️☠️💀☠️☠️💀☠️💀
i heard that someone got 71/100 on math 55 mt 1 which is lowk way worse☠️💀☠️💀☠️☠️💀☠️☠️💀☠️💀"
Psych C120/COGSCI C100,https://www.reddit.com/r/berkeley/comments/163cksm/psych_c120cogsci_c100/,2023-08-27 21:52:09,"Has anyone taken this class with Davina Chan? I’m a psych major and have a background in this type of material, so I’m wondering if doing the readings in the textbook is actually necessary to do well on the weekly quizzes/in the class. Thanks!","I only read her slides when I was taking it. Should usually be fine.
Did you get an A? 🥹
Follow up question: do you have to go to lecture or can you just study the slides?
I would say the slides + short videos have pretty much everything you need. Lectures are just she actively presenting them. Not sure if anything changes this year though.
Short videos?? Like are those included in the slides or? You just mean looking things up on the slides that need more explanation?"
Questions about COGSCI 115 - Neuropsychology of Happiness,https://www.reddit.com/r/berkeley/comments/15t65yz/questions_about_cogsci_115_neuropsychology_of/,2023-08-16 16:42:09,"Hello I had a couple questions about this course for anyone that has already taken it, I will keep them concise:

1. Difficulty (is it brute memorization?)
2. Time Commitment (how much time would you say is needed per week?)
3. Attendance (how much attendance is necessary to pass the course from the standpoint of the amount you learn in class vs textbook/independently?)

If anyone has their lecture notes / a syllabus that they are willing to share, I would appreciate it very much as there isn't a whole lot of information available online currently. I am trying to front load some self-study before the semester starts.

For anyone who is taking it Fall '23 w/ Davina Chan feel free to reach out either now or during the semester, I'd be happy to chat / start study or review groups. 

Thank you!","[deleted]
Thank you for the detailed response! I guess taking MCB W61 this summer was a plus right before this course, all that memorization is actually going to come in handy..."
could anyone help with some psych upper div questions?,https://www.reddit.com/r/berkeley/comments/12mnhj2/could_anyone_help_with_some_psych_upper_div/,2023-04-14 19:55:34,"hey! i'm a junior planning to take a bunch of my upper divs next semester and i'm wondering about how some of the classes operate. if you have recently taken any of the classes below could you tell me if they upload lecture material online (like ppts, study guides, etc)? i have some pretty big sleep issues and don't know if i'll be able to make all lectures since these classes are relatively early. it would be so so helpful if anyone here could shed some light on any of these classes for me, thanks so much!!

Basic Issues in Cognition (PSYCH C120, Davina Chan)

Psychology of Personality (PSYCH 150, Oliver P John)

Developmental Psychology (PSYCH 140,  Jan Engelmann)

Developmental Psychopathology (PSYCH 131, Qing Zhou)

Social Psychology (SOCIOL 150, John W Kaiser)

Leading People (UGBA 105, Brandi Pearce)","I took Personality with Oliver, it’s still my favorite class I’ve taken. I had an 8am, but he records lectures and posts the slides so I’d skip and watch the recordings in the afternoon
i took 131 w zhou! she recorded all lectures, posted all readings and slides ahead of time, and tests were based purely on lecture, so it was fairly easy!
I agree with the two comments about 150 & 131! I also took 140 with Jan and he does upload slides but they are very plain. He does not record lectures but even though I did not attend lecture I passed the class with an A by downloading the textbook and going to sections.
thats super great to hear! thanks for the info!!
love! tysm!
r the tests online?"
philos 3 vs. cogsci 180,https://www.reddit.com/r/berkeley/comments/u7g7jv/philos_3_vs_cogsci_180/,2022-04-19 14:37:24,"i'm trying to decide between philos 3 (the nature of mind) and cogsci 180 (mind, brain, identity) to fulfill the cogsci upper division philosophy requirement

philos 3 is with prof geoffrey lee and cogsci 180 is with prof davina chan

any advice?",
Prof. Issac or Prof. Chan for COG SCI 1?,https://www.reddit.com/r/berkeley/comments/gx8a7i/prof_issac_or_prof_chan_for_cog_sci_1/,2020-06-05 09:54:10,"I’m looking to take COG SCI 1 in the fall and was wondering about whether I should take the course with Professor Linda Issac or Professor Davina Chan.

Thanks in advance!","From what I’ve heard both are really good.
Chang
I see, thank you!
Assuming you mean Chan, what would be your reasoning?"
Any advice about the psych department at Cal?,https://www.reddit.com/r/berkeley/comments/j3lsyv/any_advice_about_the_psych_department_at_cal/,2020-10-01 18:44:47,"I am an intended cog sci major but I have to say...it's the pysch that keeps drawing me in. Davina Chan is such an amazing professor, hands down my favorite this year, and I literally want to be like her.

I know there's some stigma against psych majors in the general world...but Berkeley's psych department does seem very Bio based and there pre-reqs that require technical skills.

I can envision myself doing grad school in clinical psych but is that foreseeable for the future we have now? I guess I kind of planned to get a tech job after graduation like everyone else despite my total lack of confidence in my programming skills (bc I have none)

Anyways, to psych or not to psych?","i LOVE professor chan too!!! she’s such an awesome lecturer!! also ur username is amazing
If you really want to do it then go for it. From what I hear from my friends, psych isn’t a super demanding majors since a lot of them graduated a year early. So you can even go for a double major if you’re really unsure about landing a job or the stigma.
I’m a second year declared psych major and love it. I want to go into developmental neuro. I’ve only had good interactions with people and staff in the department. You can always double in psych and cog sci. Or major in one and minor in the other. And for the whole psych majors aren’t respected. Yeah fuck that, who cares? Psych majors are one of the most applicable/employable majors in the workforce. The one downside I do need to tell you is that you can’t really advance in career without getting a grad degree. You say you want to go into clinical, you can get a masters, psyD, or PhD to go into clinical. Check out r/academicpsychology and feel free to dm me if you have any questions
The psych dept at Berkeley is absolutely amazing. David Presti, Dacher Keltner, Jack Gallant, Alison Gopnik to name just a few of the profs who are either really good profs or doing cool research.

I'm biased being a Cogsci major but you can do a lot of psych stuff while still being cogsci and reap some of the benefits of having datasci/CS skills. I did a stint in a clinical psych lab (golden bear sleep and mood research clinic) and the PI Allison Harvey kept emphasizing how she looks for grad students with a strong stats/datasci background. A lot of psych research has become heavily dependent on using datasci tools (for good reason given the replicability crisis) so if you're thinking of grad school, CogSci could be a plus in that sense.

Besides, the only programming stuff CogSci requires is 61A, Data 8 and CogSci133/188. 61A will be challenging(take it with Garcia if you can), Data 8 is super chill and I've heard good things about CogSci133 (I'm currently working in Steven Piantadosi's lab who teaches the class in the spring and he's super chill).

One last fun thing, Berkeley recently announced the opening of a psychedelic research center under the psych dept which is insanely cool. The future of clinical psych is psychedelics imo and there's a lot of money rolling in already, so that's something you might want to keep in mind.

Feel free to hmu if you have more questions, I love everything about the CogSci dept :)
[deleted]
ur energy makes me happy and gosh yeah I love her :)
How are they faring post undergrad graduation?
Good advice but 'minor' correction, you can't minor in either psych or cogsci
Oh okay...uhm who is that guy!
ones doing a internship for the city and the others at a t10 for a masters in psychology
Oops about cogsci but there is a psych minor! It’s an over the summer program
[deleted]
oh oof this hurt bc sleep research (what davina talked about in her lectures) is what got me thinking into taking the cogpsych route
I’m a psych alum :) I’m not a grad student but I ended up working in two sleep research labs. One with Dr. Roth who is pretty much the father  of sleep in Detroit Michigan and now I’m at UW Madison as a research coordinator. I think UW Madison has a pretty solid group of researchers that emphasize cog sci.

I knew a few people who did grad school in psych and ended up working at a tech job where they were able to utilize their research skills.

I think you should double major! It’ll be helpful to have both cog sci and psych.

Also, take Matt walkers class despite the shady things he’s done. He’s a great lecturer. And you will learn a lot about sleep."
Psych 4 (Emotional Intelligence) over the summer?,https://www.reddit.com/r/berkeley/comments/goxrjl/psych_4_emotional_intelligence_over_the_summer/,2020-05-22 20:18:15,"Has anyone taken Psych 4 (Emotional Intelligence) with Davina Chan over the summer? I was thinking of taking it, and would like to know the workload and level of difficulty. This is because I would be taking it along with a 4 unit tech course,",have u taken it?
Is taking 7 units this summer doable?,https://www.reddit.com/r/berkeley/comments/gr9k0d/is_taking_7_units_this_summer_doable/,2020-05-26 17:52:02,"I’m thinking to take Psych 110 (with Davina Chan) and Philos 12A (with Wesley Holliday). They’re 7 units in total. I plan on majoring in Psych with most likely a double major in Data Science, but the thing is that I’ve never taking a CS or Data Science course in my life so I don’t think I would like to take one this summer (especially such a fast paced course). Thoughts?","If you don't have other commitments, two classes over the summer is manageable.
I’m taking 9. So far I’m chillin with time for Netflix and porn.
The two essentials."
Recommended Psych courses to take as an incoming freshman this summer?,https://www.reddit.com/r/berkeley/comments/gr752k/recommended_psych_courses_to_take_as_an_incoming/,2020-05-26 15:27:44,"I was considering Psych 110 (Introduction to Biological Psychology with Davina Chan) and/or Philo W12A (Introduction to Logic with Wesley Holliday). 

Does anyone have any recommendations for an easy course to transition into college material? Looking for something that’s pretty easy to get an A in; I also have AP Psych under my belt. I might be doing a Psych and Data Science double major though so I’d prefer a course that overlaps with the general requirements.",
Is it weird to send a thank you email to a professor?,https://www.reddit.com/r/berkeley/comments/18mpuac/is_it_weird_to_send_a_thank_you_email_to_a/,2023-12-20 00:32:15,"She has already uploaded our final grade on canvas so I’m not doing it to be a kiss ass for a grade, her class genuinely changed my life/perspective for good and I just wanted to express my gratitude so would it be weird to send an email? Should I just keep it to myself?","Nothing wrong with showing gratitude
There is nothing wrong with this. Also you said that grades have been uploaded, so everything should be over for this class. I think professors will also appreciate it when students thank them for a class, so this should definitely make her day :)
Absolutely not weird! Professors are human too, they are passionate about the subjects they teach and they’d probably appreciate hearing that their class had such an impact on you.
What class? I’m curious and looking for some perspective widening classes too. ( I saw you plan to thank her - have my vote )
Do it! I’m sure your professor will appreciate it!
Was it taken by Adam croom?
Sir Adam croom?
I’ll send it then thank you!(:
Cog sci 115 - it really teaches you life and what true happiness is
Nah it was Davina Chan
Bookmarked 😊 Is the grading ok?
Yeah it was with Davina Chan I think she’s very fair with grading and super understanding she also did a huge curve for both midterm and final
😊that’s super cool, thanks"
