title,link,post_time,post_text,comments
Sona Kang URAP,https://www.reddit.com/r/berkeley/comments/10r6ajq/sona_kang_urap/,2023-02-01 13:11:11,Has anyone who applied to the URAP and gotten a response? Board hasn't been updated or anything,
mandatory attendances,https://www.reddit.com/r/berkeley/comments/za18kn/mandatory_attendances/,2022-12-01 13:57:33,"Is **NUSCTX 11 attendance mandatory**? ( taught by Sona Kang, Dan Nomura, Jen Chywan Wang) 

Is **math 1b attendance** mandatory? ( Zvezdelina Stankova**)**   
If I have discussion on Tuesday, Thursday,  what **day would the quizzes** be?      
Do you have any GSI recs?","Attendance is mandatory with Stankova. As for the quizzes, probably Thursday but don't hold me to it.
bruh why was I unaware there were quizzes??? math 1a doesn't have quizzes"
