title,link,post_time,post_text,comments
SOCIOL 167 with Edwin K Lin,https://www.reddit.com/r/berkeley/comments/1buxipp/sociol_167_with_edwin_k_lin/,2024-04-03 09:48:20,Has anyone taken this course? Seems pretty interesting. Would love some input on grading/workload/exams from any previous or current students.,"sociology major or not, everyone should take a course with lin. awesome professor, really easy to understand his lectures and extremely approachable as well
Great course, really loved it! You get to do lots of creative assignments too and he’s a good lecturer
he changed the course of my academic interests! this was my favorite class at cal by far, highly recommend!!
I'm not a sociology major and the prerequisites say that I should have taken either 1, 3, or 3ac or get instructor consent. I haven't taken any of those or reached out to the prof before but I would like to take it for media studies. Can I still enroll?
Awesome - the course seems really interesting! How was the grading and workload?
super easy workload, felt more like a 3 unit class than a 4 unit class (though may be biased since i enjoyed all the readings). the grading is very lenient, there are two quizzes that are really straightforward and the essays aren't bad at all! people in the class are really helpful also!
this is super helpful; thank you!"
How to study for Lin Lin's Math 54 midterm,https://www.reddit.com/r/berkeley/comments/xkn7hx/how_to_study_for_lin_lins_math_54_midterm/,2022-09-21 18:18:52,Hi! Any advice for how to study for the first Math 54 midterm coming up? Specifically for Lin Lin's? Thank you so much!,
Should I take math 54 with Professor Lin Lin or Serganova?,https://www.reddit.com/r/berkeley/comments/w3u04u/should_i_take_math_54_with_professor_lin_lin_or/,2022-07-20 11:41:41,,"Serganova is thorough and enjoyable.  

She’s also in charge of Math 110 aka Intermediate Linear Algebra to Math 54’s Introductory Linear Algebra"
"Which Professor would you guys pick for math 54, Vera Serganova, or Lin Lin?",https://www.reddit.com/r/berkeley/comments/vhyqh4/which_professor_would_you_guys_pick_for_math_54/,2022-06-21 23:47:02,"I'm trying to pick the better professor for this upcoming Fall, I was wondering about your guys' experience with these two professors. 

Worst comes to worst, if they are both awful, do you guys recommend just taking Honors Linear Algebra with Peng Zhou? Thanks in advance","Math 91 David Nadler, the newest linear algebra class, this is the classes just added this semester and it is an acceptable alternative to Data Science Major Requirement for Math 54, Nadler is by far the goat of mathdepartment (second to Paulin).
I'm wondering the same as well. Currently enrolled in Serganova but having second thoughts...
This class will not fulfill the CS requirement."
Lin Alg Review for EECS 127,https://www.reddit.com/r/berkeley/comments/199xqu7/lin_alg_review_for_eecs_127/,2024-01-18 11:00:08,"Hi I'm trying to brush up my linear algebra foundations for EECS 127 this semester. Is it better to look at Math 54 notes or EECS 16a/16b notes? 

[https://math.berkeley.edu/\~arash/54/notes/](https://math.berkeley.edu/~arash/54/notes/)

\+ Is this the best notes for Math 54 or is there a different resource? Thanks!","https://math.berkeley.edu/~apaulin/56%20(Fall%202023).html

This is the same linear algebra content as 54 done in more depth.  There are videos for every topic. For a quick review look at the review video/notes in week 16.
The course reader has the needed review"
Best Math 54 teacher - srivastava or lin lin?,https://www.reddit.com/r/berkeley/comments/erkqx8/best_math_54_teacher_srivastava_or_lin_lin/,2020-01-20 14:19:35,,"srivastava
Anything’s better than Fa19

But Lin Lin has better vibes
Srivastava has better grades
According to Berkeleytime it looks like Lin has better grades"
Sociology 127 with Lin,https://www.reddit.com/r/berkeley/comments/131azh8/sociology_127_with_lin/,2023-04-27 16:25:55,If anyone has taken this class or is in this class with Lin and you want to help me out and do my final I’ll pay you 🥹,
Math 54 with Lin Lin?,https://www.reddit.com/r/berkeley/comments/6j2b1t/math_54_with_lin_lin/,2017-06-23 09:31:21,"Not many reviews of Lin anywhere, wondering if anyone has any experience in being in his 54 or even any other class of.","I took 54 with Lin Lin last fall. He has a bit of an accent, but it's not too bad at all. I thought he was a pretty straightforward lecturer, and he posts all his lecture notes online. I wasn't ever surprised by anything on his midterms or finals. I managed to get a B+ only going to discussion and reading the book, so if you're diligent about going to class I'm sure you'll do fine.
I had Lin Lin for 54 last fall. I felt like his lectures were pretty good for the most part, even though I couldn't wake up in time for most of them. The exams were pretty good, questions weren't anything that I wasn't expecting and it ended up having a decent curve. Lin Lin covered surprisingly little, though, it seems, especially out of the diffeq side
Between Nadler and Lin, would you strongly recommend one over the other or is either a good option?
Thank you!
Some of my friends took 54 with Nadler at the same time, and more or less the only difference was that Nadler's class covered more material than we did in Lin's lectures. Pick whichever one suits your schedule better, they're both good professors.
Thank you so much!
I must say - at the end of 54 is where things usually get difficult (differential equation part). In Lin's Fall 2016 class we barely skimmed the surface of DEs, so our final wasn't too hard in that respect. That said, the DE part isn't really conceptually difficult, and he probably will learn from his mistakes from last fall and cover more (or not, idk). To be honest, 54 is a class that you can just learn from the textbook, so it is pretty professor independent unless you get a professor who curves to a C (or doesn't curve)."
Math 54 - Lin Alg 15th in waitlist,https://www.reddit.com/r/berkeley/comments/14yrxd0/math_54_lin_alg_15th_in_waitlist/,2023-07-13 11:07:13,Do I still have a chance? thank you for your input!,"FWIW, the 2pm afternoon Math 54 class has plenty of seats open.  You might want to consider signing up for that one instead.
i think yes, but expect to wait some time
Yes but your discussion waitlist position is the most important"
lin lin math 54 final,https://www.reddit.com/r/berkeley/comments/5ifl4a/lin_lin_math_54_final/,2016-12-14 20:47:17,"anyone who took it, how did you do? idk if I'm going to pass","I thought I did pretty well; the last question was tough but I got an answer that at least seemed reasonable, but it could be wrong. Are you worried about not passing the class or just final? 
not passing the class, what's the likelihood that there will be a curve?
I'm pretty sure grades will be scaled according to what percentage of students Lin wants to get an A, B, C, etc.

So I'm pretty sure there's a high chance there's a curve -- how much it will help you will be determined by the overall raw grade distribution, though."
Is Math 54 enough for the lin alg requirement of spring version of CS 189?,https://www.reddit.com/r/berkeley/comments/17d8yzn/is_math_54_enough_for_the_lin_alg_requirement_of/,2023-10-21 11:25:33,"I'm currently taking data 140 for the probability portion, I've never taken math 53, and was wondering if math 54 is enough for CS 189? I took math 54 a while ago and did okay in it. I've heard data 100 helps and was wondering if taking it as a corequisite rather than a prerequisite would suffice.","You should be good, spring isn’t too bad and you’ve taken probability as well. M54 should suffice and you can read some prerequisite knowledge on the site
Do you need math 53?
If you’re comfortable with derivatives/gradients then you should be fine without it
I've never done gradients, and gradient derivative portion of HW1 for CS 189 looks very confusing. Do I need to take math 53 or can I self study this portion?
You can self study
Math 53 doesn't really teach Jacobians anyway."
Is Soc 167 easy? With Edwin Lin?,https://www.reddit.com/r/berkeley/comments/wl64p1/is_soc_167_easy_with_edwin_lin/,2022-08-10 12:18:25,,"Edwin Lin is great! Had SOC5 with him, and heard good things about 167.
Yup, pm me for more info.
Awesome! How is he?
100%"
"Any insight on these professors?: Lin Lin, Ming Gu, Nikhil Srivastava",https://www.reddit.com/r/berkeley/comments/4ls1nu/any_insight_on_these_professors_lin_lin_ming_gu/,2016-05-30 15:42:22,"I'm planning on taking Math 54 in the fall, and it looks like Lin Lin, Ming Gu, and Nikhil Srivastava are the only available professors. Has anyone taken these professors before? If so, how would you rate them? I have found Gu & Srivastava on RateMyProfessor, but have yet to find any ratings for Lin Lin.","this was asked [a week ago](https://www.reddit.com/r/berkeley/comments/4kj67g/best_math_54_professor/)
Ming Gu is an awful lecturer and you will probably need to learn the material from the textbook if you take him. He does curve pretty generously though, or at least he did in Math 128A when I took him.
Really? I had him and thought he was delightful. The only thing I can think of that might be a turn off is he has a Chinese accent, but if you're an EECS major and can't understand Chinese/Indian/Eastern European accents, then RIP."
Lin Algebra and CS70,https://www.reddit.com/r/berkeley/comments/iaogvq/lin_algebra_and_cs70/,2020-08-16 00:44:50,How much linear algebra knowledge is needed for cs70? because i currently know nothing,"nothing lol don't let the course staff fool you with their bullshit
pretty much only basic matrix manipulations for markov chains. for calculus, you should know  how to calculate derivatives, integrals, and integral by parts
I know there was some extra linalg in Sp20, but I just finished over summer and there was only basic matrix operations for Markov chains for linear algebra.
just finished summer cs70. you need to know row reduction for polynomials and, as others have mentioned, basic matrix manipulations (e.g. matrix multiplication) for markov chains. knowledge of eigenvalues might help with understanding markov chains but imo not necessary. I didn't take linear algebra before cs70 either, watched the series on linear from 3Blue1Brown and skimmed through some EE16A notes, and did well in the class, so you should be fine! Take a look at HW0 on the cs70 website if you want; there are two sections on linear algebra and calculus.
also how much calculus as well lol
Okay thanks a lot.
Not a lot for summer 2020. Just needa know basic differentiation and integration techniques. The hardest calculus of wot you’d encounter would prob be integration by parts.
There is a minor amount of multivariable calculus as well, for continuous probability. However it is fairly trivial and can be self-learned quickly since the areas of integration you work with in 70 are always fairly simple.
Additionally and optionally (meaning not totally required), surface-Level basic definitions understanding of Calculus 2 Convergence, Divergence, Taylor Series, and similar stuff is good to understand some stuff in the notes of CS 70 Probability"
Time management tips for Math w54/lin. algebra summer course?,https://www.reddit.com/r/berkeley/comments/vd4z88/time_management_tips_for_math_w54lin_algebra/,2022-06-15 14:18:47,I’m getting a little early start on the math w54 summer course but there’s a lot to go through! Many hours of lecture and a fair amount of homework. Has anyone taken this course during the summer and can offer some time management tips?,"Hey, I took a math course over the summer (discrete math, not linear algebra) and it was pretty chill. My main rec is more linear algebra related than time management related: start thinking in terms of transformations. Really get the fundamentals down, and look ahead to the next chapters to inform yourself on WHY you're learning what you're learning. Enjoy and don't stress - linear algebra is among the easiest of math courses and also very interesting!"
Sociology 169C With Edwin Lin?,https://www.reddit.com/r/berkeley/comments/ojulnh/sociology_169c_with_edwin_lin/,2021-07-13 19:13:11,"Has anyone taken this class with him? I signed up for the 3 unit, and I’m nervous about the outside/club meeting requirement. I don’t know if that part is only for the 4 unit version, but if anyone has any info, it would be appreciated!",
lin alg in 70,https://www.reddit.com/r/berkeley/comments/es989s/lin_alg_in_70/,2020-01-22 00:37:55,How much lin alg do I need to know for 70? I haven't taken math 54 yet but I'm currently taking 16a right now. Will I be okay taking 70?,"You’ll be fine
there's no linalg in CS70
When I took it there wasn’t any but you do need to know how to work (very basically) with matrices at the very end of the semester because Markov chains uses state matrices and whatnot. It’s not emphasized at all though. Although sahai always stresses mathematical maturity so he might emphasize linear algebra in proofs somehow?
The first hw has a matrices problem and it caught me off guard ://
what the fuck

that wasn't there when I took the class (SP18)

then again i didn't take it with sahai

i doubt much linalg knowledge is needed tho"
"Lin Lin, an assistant professor of mathematics, and Eric Neuscamman, an assistant professor of chemistry, received 2017 Early Career Research Program awards from the Department of Energy to further their work. Lin joined the math department in 2014. Neuscamman joined the College of Chemistry in 2015",http://news.berkeley.edu/story_jump/young-math-professor-receives-early-career-award-from-doe/,2017-08-11 23:57:49,,"Lin Lin is the man
Are they working on similar subjects? Looks like they both work with DFT
"
Math 110 with EE16A + CS70 + some prior lin alg experience?,https://www.reddit.com/r/berkeley/comments/ec8dpg/math_110_with_ee16a_cs70_some_prior_lin_alg/,2019-12-17 21:36:38,Is Math 110 doable with this kind of math background? I'm pretty solid on proofs and have done more linear algebra than what 16A has taught (a little heavier on proofs). Do I need to cover much more for Math 110? How much does this course expect you to understand with respect to complex numbers in lin alg? Do we also need a strong diff eq background too?,"There’s no diff eqs in the class iirc and it doesn’t really assume any outside knowledge (other than basic properties of complex numbers, I guess). If you’re comfortable with proofs then you’ll do fine imo.
Yea you're good
Have a friend who had the same schedule last year in addition to Hug’s 61B and he seemed fine. There aren’t much diff eqs and it is mostly an I upgrade from 54
Dude you'll kill it and 110 is fun so enjoy it
I meant I have already taken 16A and 70. I will be doing 127, 61b, and 170 along with this though.
Ohhhhh shoot I can’t read. Out of these four I’d say 110 is definitely on the easier end. Also that’s quite a few techs, if it gets stressful do understand that you can always  drop some classes :)
tbh 110 will probably be your easiest class. (61b has a nicer grade distribution but is a pain workload-wise.)"
Questions about Sociol C167 with Edwin Lin,https://www.reddit.com/r/berkeley/comments/6pb6qw/questions_about_sociol_c167_with_edwin_lin/,2017-07-24 13:34:51,"I'm registered for Sociol C167 and I was wondering how rigorous is the course. I'm taking a total of 15 units including this class, but based on the syllabi I found online (fall 2015 and spring 2016) it seems doable. What do you think? What advice do you have about succeeding in the class? Do you know of any resources that I can access now so I can get a head start with the readings and possibly papers? Does anyone have the Fall 2016 syllabus? 

Thanks","I took this class. I think I did four readings. I went to class about half the time. Passed with an A. It depends I guess if you're a sociology major, but most students find this class to be somewhat interesting, but mostly easy. The only thing he is strict about is deadlines. Do your papers, turn them in on time, and make a decent effort. You'll do fine. 
I honestly have no idea, I most likely did MLA everything, but I would ask Lin. 
I didn't take it with Lin, but the class was pretty easy and relatively low effort. Really interesting topics though
I took Soc C167 with Lin and it was a VERY easy class. There's one two page paper, a short answer take-home midterm, a ten-page project, and an eight-page take-home final. These four writing assignments are your entire grade in the class. I went to half the lectures and only read the readings that were relevant to the questions asked on the exams and writing assignments and I got an A. I even BS-ed the ethnography project and still got a 100% on it. This is all in light of the fact that I am a poor writer. If you choose to take this class, there is no need to be worried about grades whatsoever. Also, form a google doc for the exams (which he lets you do) and use the quizlet for finding concise explanations of the theory. As long as you put in a little effort for each assignment, you can easily get an A.
Awesome. Thanks for the response. Do you still have the reading material, notes, or any other useful information for this class? 
I might. I don't have notes for sure but I may have some of the power points and some readings. I'll take a look, can you pm me your edu email? 
did you do the virtual communities paper with MLA format heading and ASA citations?
"
Math 54 Professors,https://www.reddit.com/r/berkeley/comments/w9ywdn/math_54_professors/,2022-07-27 20:35:57,"Is it worth it to switch professors in Math 54? Currently I'm signed up with Serganova, and I'm wondering if I should enroll with Lin Lin instead. I heard bad things about Serganova's class, mainly that she has an accent while she lectures and her exams are considerably harder.

Lin Lin, on the other hand, I heard he was more relaxed with grading and has a higher A average on BerkeleyTime. Thoughts?","[deleted]
idk if Paulin is an option, if so, you should def take his class
yes
The only problem is I'm also signed up for 61A, which is also MWF. Is it manageable to have both of my tech classes on the same days?"
Math 54,https://www.reddit.com/r/berkeley/comments/wlxp46/math_54/,2022-08-11 10:54:29,"Does anyone know if Professor Lin Lin’s lectures are recorded? I want to take his class however, one of the days I can not go to. Previous students please let me know.","just watch the paulin lectures, you’ll be better off tbh
Yeah but do you know if lectures are mandatory? Ik typically they’re not but I just want to make sure"
Math 54 next semester,https://www.reddit.com/r/berkeley/comments/doz3j1/math_54_next_semester/,2019-10-29 17:31:07,"Anyone who’s had either teacher do you have advice on which is better for this course, Lin Lin or Srivastava. Berkeley time shows a better grade distribution for Lin Lin but I’ve heard mixed. Also anyone take 54 b4 53?","I don't know anything about Lin Lin, but I'm taking a class with Srivastava right now and it's pretty great. He's a very clear lecturer, is quite helpful at OH, and posts good online notes. He's definitely one of my favorite professors here. Would recommend
I'm currently in 54, will be taking 53 next semester.
You can take 54 before 53. Not sure about the profs, but my friend had Srivastava in Fall 2018 and apparently the curve was good and he had midterm clobbering.
54 before 53 is actually the intended order, or at least used to be. They used to be called Math 50AB, and guess which one was 50A.
His grade distribution looked a little lower then Lin Lin for math 54, do you have him for 54?
Hi currently in 54, will be taking 53 next semester., I'm dad.
Curve wasn’t that good? It was about average lmao. I think ur friend was just above average overall
I'm taking Math 224A with him, so I can't really comment on the curve or exam difficulty, sorry.
Bad bot"
Is it Advisable to take Math-104 and Math-126 as a freshman ,https://www.reddit.com/r/berkeley/comments/1cdg1vt/is_it_advisable_to_take_math104_and_math126_as_a/,2024-04-26 01:19:40,"I will be an incoming freshman at Berkeley for 2024-2025. I’m an applied math major, and am completely invested in PDE analysis. I have read PDE textbooks and couple other books, however I’m worried if this might be too much for a freshman. I’ve done calc 3, DE, lin alg, however I’m curious if these classes will be intensive for a freshman.","If you love math then go for it, there are many that took math upper divs freshman year so it is feasible if you are smart and motivated. Make sure to be very familiar with analysis before math 126 though, you probably already are, but if there is any doubt, i would wait to take 126 later.
Consider h104 if you'll already know analysis going in. You should be able to take 222a/b sophomore year.
If you’ve read multiple good undergraduate textbooks and can do the exercises in those textbooks you should be good. You can also look at the textbooks for the class and skim it / try the problems.
Every year, there’s always a couple of 15 year olds (or younger) geniuses who matriculate to Berkeley who are Math majors.  So no worries, if you’re ready, you’re ready.
Epic!!  Tysm for the advice!!"
"Quick Question About Attending Math 54 Lecture, or Self Study.",https://www.reddit.com/r/berkeley/comments/wmpy1l/quick_question_about_attending_math_54_lecture_or/,2022-08-12 09:45:10,"Hi guys,

In the Fall, I'll be taking Math 54 with Lin Lin. For those who've taken Math 54, I was wondering, is it really worth it to attend the lecture? or would you say it's more efficient to self-study via watching [youtube lectures](https://math.berkeley.edu/~apaulin/54%20(Spring%202022).html) and reading the textbook or whatever method you recommend?   


The reason I'm asking this is that the lecture time is at a time that's not really ideal for me, but if you guys highly suggest attending lectures, I can definitely make it work. Thank you in advance :)","I have self control, impulse control, and discipline issues, so I stick with lecture since my self study skills are trash.  

You can ask questions in lecture and see how the professor goes through the problems.  Perhaps they have tricks or something.
You can watch Paulin’s lectures https://math.berkeley.edu/~apaulin/54%20(Spring%202022).html click on schedule, videos…"
Jeremy Lin being told that he should've went to Stanford,https://swirl.xyz/s/4a0e94cf71,2015-09-23 16:29:32,,ok
eecs 127 ranade tips,https://www.reddit.com/r/berkeley/comments/18pe4xv/eecs_127_ranade_tips/,2023-12-23 12:21:46,"title\^ going in having taken Math 54, Data 100, Data 140. any tips on anything to do before school starts? i know lin alg is a hard pre req and to review that but what specifically and any tips on what to focus on?","You do a decent amount of linalg review for the first two-ish weeks, so I'd say start from the 127 course website. You can work through hw problems, disc problems, read the course reader etc.
i think a lot of people struggle with the matrix calculus (taking gradients, calculating jacobians, etc). maybe look into that?"
Do I need to phrase 1 math 54?,https://www.reddit.com/r/berkeley/comments/donavi/do_i_need_to_phrase_1_math_54/,2019-10-29 02:16:53,Also does anyone have any insights on whether Lin Lin or Srivastava is better? Can I get into whichever prof safely during phrase 2?,"I haven't had Lin Lin, but I'm taking Math 224A with Srivastava right now. He's an excellent lecturer and is pretty fantastic overall. He posts online notes which are pretty useful. The problem sets are extremely difficult but I think it's because of the class rather than the professor.
How about the exams? Would you say the exams are harder or easier than problem sets?
isn't 224A a graduate course? please tell me the '22 tag doesn't mean you're a sophomore
The class has no exams, which is probably why the psets are so tough
wait so you're only graded on the final and problem sets?
No final, no midterms, just problem sets. It's awesome
damn that sounds nice haha. thanks for sharing!
is this for math 224A only or does Srivastava do that with his other math courses? (if he has any)
It’s only this course, I don’t think professors are even allowed to not give exams in lower div courses"
