title,link,post_time,post_text,comments
Should I try to take CS 189 Spring Semester freshman year?,https://www.reddit.com/r/berkeley/comments/1c53psv/should_i_try_to_take_cs_189_spring_semester/,2024-04-15 18:28:27,"I'm going to be entering Cal this fall as an EECS major. Since CS 189 is important for getting roles in ML labs at Berkeley and a prereq for a lot of other ML classes (CS 182, CS 285, CS 280) that I'd like to take at some point, I'd like to take it as soon as reasonably possible. I've heard it's easier in the Spring Semester, so I'm considering trying to take it either Freshman or Sophomore spring semester. Ideally, I'd like to take it Freshman Spring because I'd want to be able to start doing some research and/or ML internships sophomore year. However, I know this would probably be a pain since most people say CS189 is crazy hard.

If I wanted to do this, what courses should I take fall semester before taking CS189? On Berkeleytime it lists Math 53, Math 54, and CS 70 as the prereqs, but I've also heard that Berkeley doesn't really enforce prereqs too much and that people have taken CS189 without all 3 of these, and that it's more important to know the general concepts (which you can sometimes pick up from other classes). I've considered just doing Math 53, Math 54, and CS 70 my first semester, but that seems like a very weird first semester lineup and I'd guess that it'd be better to do some of the other lower div CS courses like 61A.

For context, I got a 5 on the Calc BC exam (so should be able to skip Math 1AB) and I have experience with ML from HS. I did Andrew Ng's Machine Learning course on Coursera (I don't think it exists anymore tho cause he just has a ML Specialization there now) and Ng's Deep Learning Specialization (technically I didn't finish the last 1/3 of course 5 because school, but I watched the videos and I feel comfortable with those topics), and I've also done projects/ECs/internships doing ML stuff with TF, Torch, and JAX. My junior year CS course also covered ML, but it was mostly the basics. I don't know how well most of this would translate to CS 189 though (and to be clear, I'm not expecting to do well in the class just because I have some past ML experience, I'm expecting it to be incredibly hard based on what everyone else has said and that it probably uses more advanced math than I currently know). I also have English AP credit (5 on AP Lang) so I'm pretty sure I can just skip R&C A and do R&C B next year (don't need to worry about fitting in R&C A this year, at least I think so). I'm also trying to graduate in 3 years and do a 3+1 master's (mainly to start working earlier, and also to save money cause OOS is murder), which is part of the reason why I'm trynna do CS 189 so early (I want to start doing research early so I'll be set up well to apply for the masters). I could end up just doing the normal 4 years, but I'm planning for 3 years because if I can graduate in 3 years then great, but if it ends up being too much I can just drop a few courses and graduate in 4 years (at least that's how I'm thinking about it). 

Do you think I should work towards taking CS 189 spring 2025, or should I wait to do it later? If you think it would be doable to do CS 189 in spring 2025, what courses would you recommend for my fall semester?

If there's also anything else I'm forgetting to consider (other requirements and what not) please let me know, I've only just started planning everything out so I'm bound it miss something.

PS: I'm pretty jet-lagged rn so sorry if this sounds like it was written by a crazy person who skins live chimpanzees","Yeah do it lol it’ll really help everyone else’s curve /s

Maybe take a CS class at Berkeley before making such plans lmao
I don't think you will be able to enroll CS189 in freshman. There is probably a long waitlist
I think 189 isn’t super important in order to do ML work, if you have done ML projects before u should be able to get a role in some ML lab with some basic networking. I joined a lab first semester just by reaching out to grad students, they are happy to help if you have experience with projects
Yeah it would be a breeze, make sure to take it with 162 and 170
Doesn’t hurt to try, you can always drop if it’s too much, and dropping it Freshman year is chill cause you can always try again
If you're not regents or DSP or at least a junior your odds of enrolling are slim, classes full up really fast especially desirable ones. 

That said if you can enroll sure go for it.
Before the high demand policy it used to work like this:

Summer: 61A + 70, then Fall: 61B + eecs126 + math 54, then Spring: eecs 127 + cs189 + math 110  
Then your sophmore year you can take stat210a/b stat c205a/b cs285, cs182, cs288, cs c281a/b
The course materials are public, so I recommend going through the lecture notes and homeworks over the summer: [189sp23](https://people.eecs.berkeley.edu/~jrs/189s23/) [189sp24](https://people.eecs.berkeley.edu/~jrs/189s24/). If you feel comfortable with the material, I don't see any reason why you shouldn't take it as soon as possible.

You can find any course webpages [here](https://inst.eecs.berkeley.edu/classes-eecs.html) (in case you also wanted to look ahead at cs61a or cs70).
I doubt that you can’t even get in as a non senior
How is your linear algebra and probability skills? Honestly just google cs189, click hw2 and see if you can complete it, should be the best indicator if you’re ready for the class or not
You should first learn about how registration works at Berkeley before venturing into this.  

Spring CS 189 with our esteemed and now famous Professor Shewchuk is one of the most in-demand classes on campus, and unless you have priority registration, you won’t get in as a freshman.  Possibly not as a sophomore either.
bros actually cracked af
I’m definitely planning on cold emailing some profs (heard Abbeel and Levine take a lot of undergrads) and grad students.
I don’t know, wouldn’t that be a kind of light semester? I wanna have easy coursework but I still want a little bit of challenge. /s
Would I need to have done the pre reqs to be able to do that? And if I want to get a feel for the class, would you recommend just auditing it fall semester?
How can you take courses over the summer before your freshman year starts? I didn’t know that was a thing
wtf I know someone who had pretty much the exact schedule like this
Lin Alg experience isn’t great, I’d probably need to take a Lin alg class fall semester or do the khan academy lin alg course
Would you recommend just doing it in fall sophomore year then (assuming the fall one is less in demand)?
lmao abbeel wants tons of A+’s in classes
It might have change, but usually you don't need the pre reqs. I think auditing it in the Fall doesn't hurt. Really just depends how much time you have.
freshman edge/summer bridge. should be able to opt in to either of those programs through calcentral
It's just a small circle here at berkeley.
Make sure when you take linear you dont just learn how to do it but also learn the intuition behind it. Suggest u watch 3blue1brown videos before you take linear so when you do take it, it makes more sense.
Only if you’re cracked in probability and linear algebra. And throw in MVC too I suppose.
Thank you, I’ll probably try that then."
Math Course to take after AP Calc BC,https://www.reddit.com/r/berkeley/comments/uwfop4/math_course_to_take_after_ap_calc_bc/,2022-05-23 18:37:32,Thoughts on taking MATH W54 (lin alg/diff eqns) this summer? How hard is this course and how much time will be spent (hrs/week to get an A) if I have not taking Multivar yet.,"Linear algebra is not related to calculus. So if you’re good at math and picking up new things you could spend like 5-10 hours a week. If you’re bad at math you could spend 40. Difficulty is really based on your math ability and work ethic. 

Math w53 was an absolute breeze for me over the summer and only had a final and weekly hws and quizzes. I would bet summer 54 would be easier than in the semester since you just focus on a single subject
Did you do ww53 with Scanlon last summer? is it alright if I ask you a few questions?"
Math 54 textbook,https://www.reddit.com/r/berkeley/comments/eprnnr/math_54_textbook/,2020-01-16 15:29:10,I understand that the textbook for Math 54 is a combination of two separate textbooks. What are they both individually called and what is their edition? I'm trying to hunt for PDFs,"The lin alg one is linear algebra and its applications by David lay and the diff eq one is fundamentals of differential equations by nagle
PM me your email I have both PDFs
Thanks. Do you know which editions?
I have the fifth for lin alg and ninth for diff eq, but it could be different now"
Taking eecs16a after taking 54,https://www.reddit.com/r/berkeley/comments/u8ie17/taking_eecs16a_after_taking_54/,2022-04-21 01:02:06,I’m thinking of taking 16a even after 54 just to learn about the circuits portion and to prepare for 54. Is this a good idea? I’m also hoping that the class will be fairly easier since I’ve already learned the Lin alg portion.,"Waste of time, just self study circuits.
You can PNP 16A if you want since you’ve take 54.
How would I go about doing this?
Don’t I miss out on the labs?"
i feel like I haven't covered some math concepts in hw2 cs 189...,https://www.reddit.com/r/berkeley/comments/10w5b3h/i_feel_like_i_havent_covered_some_math_concepts/,2023-02-07 07:57:52,"I'm scared that I don't know quite a few of the maths concepts popping up here and there in the CS 189 hw2 right now.

like I literally had to look up how to get the expected value of normal distribution / continuous random variable, or the density function of normal distribution, or was stuck for a long time bc I didn't even know about erf for eg. I've already taken CS 70, and when I took it at least over one summer, I'm pretty I never dealt with these.

I'm more ok with LinAlg I guess, but still need to brush up on these topics.

I'm taking data 140 rn and it does kinda help with the more probabilities/statistics-related parts, but I'm quite scared that despite meeting the prereqs (EE16AB / CS70 etc) I might not actually be adequately prepared. Should I drop the course, or stay on?","I’m taking it too, and I’m struggling with HW2 but I think that I would have been struggling way way more without Data 140. You might wanna wait until you’re done with Data 140 because if you pay any attention at all, a lot of the probability stuff will start coming to you instinctively - that being said, HW2 is a weeder after all and idk how the rest of the class is going to proceed. Also, I feel like a lot of the ideas in this class are building off what I learned in Data 100 so you could look into that if you decide to hold off on this one. My personal demon in this class is vector calculus lol
Drop
Talk to course staff
I'd say that if you struggled to compute the expected value of random variables, then the course will be very hard moving forward.

HW2 is meant as a weeder in that it should take a lot of time to complete, but you should already know most, if not all, the concepts tested on the homework when you come into the class.
I've already taken data 100...
hmm I think it's moreso the Gaussian random variables specifically that I had trouble with rather than the general expected values of random variable -- would that still be a problem? I'm trying to catch up to to the Gaussian part rn.
Oh that's probably fine then. Just make sure you know the pdf of Gaussian RV and some of its properties.
oh okay, thanks for the insight.

could you also let me know what probabilities concepts this course covers/expects you to know coming in? 

I used to hear that this course focuses more on LinAlg but how important is probability in this course?
The most important probability concepts you should know are conditional probability, conditional expectation, random vectors, and basically everything to do with Gaussians.

Probability is pretty important in this course, and in ML in general."
CS189 Tutor?,https://www.reddit.com/r/berkeley/comments/x7wwcm/cs189_tutor/,2022-09-06 22:39:53,"Hi there, I was wondering if there's anyone who can help me with 189 this semester(pretty mathy and I'm super rusty on the lin-alg prereq, but it should get better since I'm also concurrently taking math110)? I hope to find someone who can help me through the more basic concepts and intuition(and ideally have taken the fall iteration of this class), it will be paid :) 

Thanks alot!",
Simu Liu We Were Dreamers book tour @ UC Theatre this Friday?,https://www.reddit.com/r/berkeley/comments/vaegky/simu_liu_we_were_dreamers_book_tour_uc_theatre/,2022-06-11 21:43:19,"Hey guys, is anyone (or anyone you know) going to Simu Liu's We Were Dreamers book tour at UC Theatre this coming Friday, 6/17? I have a 7PM ticket and would love to connect with anyone else who might be going (or wants to go)! A friend and I are coming up from South Bay if anyone wants to carpool too.

Event link is here for reference: [https://weweredreamers.pgtb.me/zSgXTv](https://weweredreamers.pgtb.me/zSgXTv)

Apparently Jeremy Lin is going to be the moderator too!","wait that sounds like fun
ALL THE COOL THINGS HAPPEN WHEN I AM NOT IN TOWN
I was planning on going alone, but if you’d like to connect then I’m totally down (:"
Getting Ahead During Break,https://www.reddit.com/r/berkeley/comments/egqbt7/getting_ahead_during_break/,2019-12-28 04:40:49,"I didn’t do too great this semester so I wanted to get a head start during the break, could anyone give me any insight on the work load for the following classes? Or maybe point me to a resource that can?

French 1 w/ Daniel Hoffman
Sociol 1 w/ Robert Braun (?) 
Sociol 127 w/ Edwin Lin
Sociol 169C w/ Edwin Lin
Spanish 135 w/ Nasser Meerkhan

I’m obviously not planning on taking them all but I wanted to gauge the work load to decide. Thank you!","Preface: I've never taken any of those classes, so take this comment with a grain of salt. 

In my opinion, the best thing that you can do to get ahead is to take the break to relax and destress. Play some video games, read a book, try a psychadelic or two....whatever suits you. 

Trying to ""get ahead"" over the break will just leave you burnt out when the semester starts.
I took 135 with Meerkhan.
Stay on top of the readings with him...don’t slack...review your Spanish grammar over break (especially formal essay writing vocab and grammar) since that affects your grade more than you think...generally it’s a chill class though compared to some other classes I’ve taken
Hey! Recently graduated from Berkeley (Fall 2019). For context, I took SOCIOL 169C (Cross Cultural Communications) for Fall 2019 (A) for three units so I can attest to the character of Professor Lin and the workload of the specific class for a three-unit student. There are a little more assignments for that class if you are taking it for 4 units.

In regards to the workload of 169C, there really isn't much that you're graded on. In fact, I don't think I've batted an eye at the readings until the final paper came around (I only used three sources for that paper and just skimmed them). At the beginning weeks of class, you will do your proposal for a cultural sub group project. The class, in my opinion, is centered around the project for you have two assignments based on that project: a headstart for your final paper aptly named ""Deep Description of Cultural Sub Group"" (4-5 pages, double spaced)and the final paper for the project. (8-10 pages, double spaced).

There is also a cultural self-analysis paper (4-5 pages, double spaced) in the early stages of the class. As long as you start on the papers a week to a week and a half before they're due, you'll be solid. 

Everything else such as participation, a group presentation, and a presentation within a small group during the latter weeks of class is pretty easy to get. Just be sure to engage with your peers and professor and you'll be fine on that front.

Professor Lin is pretty chill. Very talkative but tries his best to get the class engaged with others and with him.

**TL:DR 169C is a pretty easy class provided that you get a headstart on the papers and be engaged with your peers and professors. Lin is a nice guy, you'll find him cool.** 

PS: I suggest you don't get ahead during break because burning out before the beginning of the semester is pretty bad. Don't know about the other classes and the other one that you may potentially take with Lin (SOCIOL 127) but I wish you the best of luck.  


Feel free to PM with questions! Go Bears!
I’ll be sure to review my grammar for sure, thanks for the advice!
Thank you for such a detailed comment !! I really appreciate it :) you’re though I shouldn’t get ahead"
Stats134 + math54 doable?,https://www.reddit.com/r/berkeley/comments/wy3ak8/stats134_math54_doable/,2022-08-26 01:09:35,"Schedule currently consists of stats134, geog10ac, cogsci131, and datasci104.

Thinking of taking math54 instead of geog10ac (and taking the international studies class over the winter + finding a major elective that covers the AC req as well)

Would stats134, math54, cogsci131, and datasci104 be doable if i have some lin alg exp but not much stats/probability exp (was planning to focus on 134 this sem)? Or should I just stick with my current schedule and take 54 and data 100 together?","I took neither, but I heard math 54 and stats 134 are both difficult.
I mean, it’s definitely doable. Stat 134 is conceptually very unintuitive, in my experience, but if you stay on schedule you should be alright. 54 varies in difficulty depending on professor, but if you have some linear algebra experience it shouldn’t be too challenging. 

I do think that Data 100 makes a little more sense if you take 54 before hand rather than concurrently."
How helpful is the math 54 adjunct?,https://www.reddit.com/r/berkeley/comments/e6pk8u/how_helpful_is_the_math_54_adjunct/,2019-12-05 15:19:36,I’m currently enrolled in math 54 for the professor without an adjunct because he has easier tests but I’ve heard that the adjuncts are super useful. I’m considering switching but I’m not sure how helpful the adjunct will really be. Overall I’m decent at math but I’m not really a fan of it.,"Which prof is that??
Adjunct helps (people in Serganova say it’s good.) you’re not gonna die without it but I’m in Teleman right now and I wish an adjunct existed for him :/
I'm in Wehrheim's Adjunct with Branden Saenz and it's super helpful. I highly recommend!
Nikhil Srivastava is the one with the adjunct and Lin Lin is the other professor"
