title,link,post_time,post_text,comments
CS 70 Alistair Sinclair and Yun S. Song lectures,https://www.reddit.com/r/berkeley/comments/c5julu/cs_70_alistair_sinclair_and_yun_s_song_lectures/,2019-06-25 19:39:08,Why were they taken down? and did anyone download them?,"My guess is that they took it down to encourage people to go to live lectures this semester.
but I heard that other professors wanted them to be taken down.. asking since next sem I have the same profs so idk if there'll be webcast lol
When I took 70 with Song/Sinclair, they originally did not want to webcast. They only ended up webcasting so that more people can be enrolled in the class.
Because restricting access to information/education always turns out [so great](https://www.washingtonpost.com/local/education/why-uc-berkeley-is-restricting-access-to-thousands-of-online-lecture-videos/2017/03/15/074e382a-08c0-11e7-a15f-a58d4a988474_story.html?utm_term=.7d12bfa83ab8) . Sigh.. I hate humanity sometimes
ohh I see huh that's odd, thank you!
After reading the article it seems Berkeley didn't have much of a choice or am I wrong.
Yeah they were forced to by the court, I was more making a statement about how Berkeley already had a problem and had to restrict lecture access from nonstudents, and how it was disappointing that professors want to restrict it from students as well.
thank you for the information! that's really annoying :/"
Anyone have a recording of today’s Campanille songs?,https://www.reddit.com/r/berkeley/comments/158ujbh/anyone_have_a_recording_of_todays_campanille_songs/,2023-07-24 19:06:42,"I will take any and all recordings from today; Phantom, Sugar Plum Fairy, they absolutely popped off today. 

Also if you were up there and waved to someone in a purple shirt, that was me! Hi!",
Is this schedule suicide?,https://www.reddit.com/r/berkeley/comments/gpys8m/is_this_schedule_suicide/,2020-05-24 15:26:06,"I'm going to take STAT 135 (Yun Song), STAT 140 (Adhikari), CS 61B (Hug), UGBA 105, UGBA 137 this Fall, and I wonder if the schedule is doable.","That seems pretty chill. Why not add CS70 and CS 61C?
depends on the person, but if you're asking this question I'm assuming you're a consistent A/A+ student. if you're not, don't take this.

if you are that kind of student and have at least some familiarity with data structures, Hug's 61b is not time consuming at all, probably ~5 hours a week or so. the projects are pretty short except the last one. 135 with lucas was low workload and pretty easy but a stupid, useless class. 140's workload should be pretty typical cs/stats stuff. I have no idea what the business classes are like but I'd imagine they're easy. So I'd say this is probably doable, but not fun.
lol don't do it
How come youre taking 140 and 135 concurrently?
i did 140 and 61b concurrently (plus the same amount of units as you) and it was manageable but not fun tbh.
It's hard to judge your capabilities without understanding the courseloads you've taken before. Would you be willing to share your previous semesters' schedules?
I don't think doing 135 and 140 concurrently is recommended. 61B and 134 were a lot for me this semester. U gonna die bro, unless you are a god.
I’m sure you will have your hands busy with any 2 out of the 3 technicals. Yun Song’s 135 is no joke.
Is UGBA 137 with Etter? I took UGBA 131 with him and I thought it was a lot of work for a 3 unit class. It probably won’t be too bad but don’t underestimate it. I ended up spending more effort on UGBA 131 than another 4 unit CS class.
If you haven't took any probability at all DO NOT TAKE STAT 135. I don't know your major, but consider taking Data 100 / Stat 33B or Stat 133 as a replacement. I did fairly well with 4 techs this semester (CS 61b, Stat 135, Math 110, Data 100). Depending on your background, you might find Data 100's assignments trivial and easy to do; in addition it's a good complement to 140 (?).
I went ""uh-oh"" 3 times while reading this. Lol don't do it but if you do, good luck!
[deleted]
Last semester i took 61a math 54 and 4 ugba classes. I’ve been taking 18-19 units in my previous semesters.
Pretty late here lol, but is 61B + stat140 + breadth + decal-or-seminar-1-unit-thingy doable?
Who r u and why r u here
If you found that courseload challenging, then this might not be very doable. It's hard to say whether you will find this doable if you found your previous coursework easy. Stat 140 is no joke and neither is stat 135. Maybe drop one of the two stat classes and you have a good schedule.
I'd say so. I did that, but with Data 100 instead of a breadth and Stat 134. You'll be working super hard, unless you are naturally great at stats or cs. Stat 140 takes a lot of studying and 61B can be grinded out. I've never taken a Berkeley breadth before, so no comment there, but I assume it can't be that bad. I remember you're an incoming freshman right? Is that your Fall semester? If so, wow, you are very ahead of the curve.
I'm an incoming freshman, and that's my spring 2021 semester. I was gonna do 61B  + 2 breadths this Fall, but 61B filled up wayyy to fast :/. Doing Math 53 +16A + 2 breadths.
61B always expands. If you sign up, you will get in this Fall for sure. I recommend adding it during phase 2 if you can. Even if that's you're Spring sem, taking Stat 140 your freshman year makes you very ahead of the curve. Congrats!
Thank you! I'm pretty set on taking Math 53 (wanna declare Stats also). Given that I'm taking Math 54 this summer (it's hard lmao), would 61B + EECS 16A + Math 53 be very hard (considering online format 😶)?

I'll be done w/ 61A, Data 8 since I did them as a high schooler through the pre-college program; testing out of Math 1A/1B.
You'll be working hard the whole time, but it sounds doable. I never took it, but I know 16A is super annoying. I highly suggest taking an adjunct class for 53, unless you are super good at math/disciplined. Even then, it doesn't hurt to have extra practice/resources for such an important class in the declaration process.
Yes I'm definitely taking an adjunct for 53 regardless of 61B. I'm leaning away from doing Math 53 + 61B this semester because I need A's or close to A's on both of them, and both are not-so-easy classes haha.

If I do take 61B this Fall, I'll take Data 100 + STAT 140 Spring 2021 --> CS 70 + STAT 135 + (maybe course staff??) in Fall 2021. 

Otherwise, I'll just do 61B + stat140 --> CS 70 + Data 100; followed by 61C + Stat 135. Would I be taking important classes like 61C, 135, DS 100, etc. later than avg if I go with taking 61B next spring?
Nah, looks normal to me. I'm not entirely sure when most people take 61C, but I don't think Spring sophomore year is late. 

I'll just say that it's harder to get into ds100 as a freshman. Idk if online means they'll make way more spots.
>I'll just say that it's harder to get into ds100 as a freshman.

You were right lol. I'm on the waitlist - position 205 🤡. Got into STAT 133 so I have the min. units required but oops XD
Lol rip, it's okay, you can try again next sem! Good luck bro!"
Chances of getting into CS 174,https://www.reddit.com/r/berkeley/comments/s4cq7p/chances_of_getting_into_cs_174/,2022-01-14 21:19:51,"I’m on position 5 for a 35 person class. It‘a weird I saw somewhere it was 40 ppl big. What if I emailed yun song and begged him to let me in? 

Thanks",
Lana Del Rey Student Club?,https://www.reddit.com/r/berkeley/comments/1915z9b/lana_del_rey_student_club/,2024-01-07 15:24:12,"Does anyone wanna start a Lana Del Rey cult/religious club with me at Berkeley? For the club meetings, I was thinking we can roam the Berkeley campus at nighttime in gothic clothing on marijuana while singing Lana songs...

Anyone? I'm serious!

\#Edit

A fellow Lana sister also suggests that we can put some ""intellectual spin"" to the club, in addition to the main events, like intellectual discussion of how Lana's song lyrics also incorporate feminist messages like body positivity, sexual autonomy, gender diversity, sisterhood, solidarity, sexual confidence, emotion self-expression...etc. Everyone can be a sister! OMG it's coming together!! Let's build a community!

\#Edit 2 SHARE YOUR FAVOURITE LYRICS!!!

\#Edit 3 Let me work out this thing over the next couple of days. Will drop the discord link once it’s ready. Organization is a lot of troubles so I’m gonna need some help. DM me if you’re interested in joining the board. We (the board members) will probably meet once before the semester begins. Right now I’m hoping that we can at least get one main event in the Spring semester.","I need a coffee that tastes like Lana Del Rey
Need😍 Lmk if it happens, I’m there
All I wanna do is get high by the beach
I know this is a joke but just as a heads up DNA lounge is hosting a listening party for one of her older albums you may want to check out
Omg I love this :>
Unironically yeah
😋😋
please
When I was a waitress...
i’ll join
Yes 🙏
Yes
actually so down I hope this is real
This is what MAKES US GIRLSSS
Does anyone have one for mitski
Pls pls let me know if this happens. IM BEGGING!! I’m the ultimate Lana fan, I even have one of her songs tatted on me 🙏🏾
Lana decal, now.
Need this but Frank ocean
NEED...
Keep me updated on further developments pls lol. Off to the races, xoxo.
Please do so, so that i can join when i return this fall
Slayyyy yesss pls
memememememememememe
sex heroin and lana del rey
Yah who needs Taylor Swift Decal when you have Lana Del Rey Club!!
Immediately yes
Omg yes please. Let's discuss the meaning and symbolism behind the National Anthem music video
Just Dm'd you! Also open to helping out with the registration process!!
Apparently, Pepsi already does.
cinnamon flavored too
literally listening to a&w rn
I’d total join it if there’s one, but I only have enough energy to start one cult lol.
I’m still really interested :)"
CS61B/Stat 133/135 +breadth doable?,https://www.reddit.com/r/berkeley/comments/g29qyw/cs61bstat_133135_breadth_doable/,2020-04-15 23:39:44,"I'm planning on taking these next semester probably with some breadth class but i'm not very sure about the workload. Anyone have any thoughts? Professors are Yun Song for 135, Trujillo for 133 and Hug for 61b

Unfortunately the finals for these 3 classes are all on the same day, but I need them as prereqs for either stat upper divs/cs70. I could possibly push 133 a semester if that's any better?","133 essentially exists to teach stats majors how to code. there is literally zero reason for you to take it aside from the stat major's stupid requirements. I don't think the department enforces prereqs either.

otoh, 133 will probably be very easy for you. I think the workload of 133/135/61b is completely manageable, but 3 finals on the same day sounds rough.
Second this! The only challenge you'll face taking 133 is getting used to R's syntax (I'm taking the class atm and it's the only challenge I have, as well as many others, have faced). 

As an aside, I'm also taking 135 next sem so OP if you want to study together feel free to PM me"
The Ultimate List of Berkeley References in Movies!,https://www.reddit.com/r/berkeley/comments/kpyw9f/the_ultimate_list_of_berkeley_references_in_movies/,2021-01-03 18:19:09,"Here’s a list of movies that reference Berkeley!Let me know if I’m missing any big ones!

Antman and the Wasp, Soul, Monsters University, High School Musical 3, 21 Jump Street, The Graduate, Magnolia, Arrival, A Simple Favor, Transcendence, Zombieland 2, The Hulk, Iron Man, Lady Bird, Mona Lisa Smile,
Legally Blonde 

Bonus Round: Actors who went to Berkeley!

Chris Pine (Wonder Woman), Brenda Song (The Suite Life of Zack and Cody), John Cho (Harold and Kumar), Gregory Peck (To Kill a Mockingbird), Yahya Abdul-Mateen (Aquaman), Ki Hong Li (The Maze Runner), George Takei (Star Trek), Adam Lamberg (Lizzie Maguire), Paula Patton (Mission Impossible)","movie reference: catch me if you can
Rick and Morty also mentioned Berkeley in their most recent season
You should also include 22 Jump Street, as Eric reiterates that “he was supposed to go to Berkeley” in the [jail scene](https://youtu.be/P78J9C2OLT0).
GORDO WENT TO CAL 😮
You’re missing a huge one. The kissing booth 2.
Doc Brown from Back To The Future is also a Cal grad
In Searching (2018) a girl says that she's trying to get into Berkeley! Coincidentally John Cho is the main actor.
Book reference spoiler for Percy Jackson series: >!Annabeth goes to Berkeley!<
not a movie but the show “Weeds” mentions Berkeley quite a few times!
Grey's Anatomy, Christiana Yang (Sandra Oh) gets her PhD from Berkeley :')

in another Grey's episode a patient gets into Cal
If we’re going outside of movies, I was really surprised to see a brief reference to (a future) Berkeley in Cyberpunk 2077!
TV show: In House MD, Dr Kutner (Kal Penn) went to Berkeley for his undergrad. Irl Kal Penn went to UCLA but is good friends with John Cho who did go to Cal


Another TV show: in Monk, Adrian Monk is a Cal grad
Pixar's Soul
10 Things I Hate about You. The Stiles character is obsessed with getting into Berkeley.
If your list includes any reference to Berkeley at all then you can add United 93. Mark Bingham was a passenger on that flight and was a Cal alum. They portray him in the film wearing a Cal hat.

Good Will Hunting - they mention Ted Kaczynski teaching at Berkeley
Gregory Peck went to Berkeley!

He was one of the biggest actors of his time and was in To Kill a Mockingbird as Atticus.
The tailor's store in Soul is based on Advanced European Tailors in Berkeley
The Perks of being a wallflower book mentioned Berkeley. I’m not sure if the movie did tho
Sopranos too
Princess Diaries 2 mentions Lily Moscovitz attends Berkeley
Good will hunting. in one of the scenes they were sitting down having lunch and referenced berkeley

Rise of the planet of the apes. I think there was a Cal shirt in there and the main character either went to or works at berkeley.
George takei?! Ohhhhhh myyyyy didn’t know that
Also, forgot that Korean actress Choi Hee-Seo (최희서 ) was also a Berkeley student (Performing Arts).
Monsters University, what a reference to Berkeley lol
The Graduate?
If you wanted to include famous HK actors, you could include veteran actor Kenneth Tsang Kong(曾江)(School of Architecture), most noted for his role in A Better Tomorrow and his many numerous appearances in Jackie Chan movies.  Also Terence Yin Chi-Wai (尹子維) (Philosophy), also a HK veteran actor, most noted for having a famous actress mother.
Chunk from The Goonies (Jeff Cohen) went

Basic Instinct has a mention too
Ian Malcolm in Jurassic Park is a visiting biology lecturer at Berkeley!
Boys and Girls, a late 90s rom com that is pretty pedestrian, but is notable that it actually is almost entirely shot on location on campus and in SF, and not at UCLA with b-roll and establishing shots. I think this is the most I've ever seen of campus in a studio movie. Use of geography is very wacky though, the main characters hang out in SF and the Marin headlands all the time.

Also, kind of cheating, but the legendary documentarian Frederick Wiseman has a 4 hour documentary called ""At Berkeley"", detailing student life and the administration over one academic year.
If you guys are trying to brag about Berkeley entirely and all the ""smartness"" in the movie ""Arrival"" with Amy Adams when the aliens arrive and the U.S secret services don’t know what else to do they go for Americas most smart linguist (Amy Adams) to decode the alien's speech sounds and what they want to communicate, Amy Adams declines, and secret services leave for their 2nd option... and she says when you go to Berkeley ask professor (can’t remember the name) what does (can’t remember) means in (can’t remember). Still, they go back to her for the answer which was cow shit, proving she was better than the linguist Berkeley professor for the job.

The movie is not trying to put in 2nd place Berkeley. Still, they go with her first because I believe she was working with the government before but lost her child or something and they wanted to know if she was ready, but she wasn’t, but then after some days she was and a helicopter lands on her patio to take her to the alien's site.

The director is Denis Villeneuve who did Blade Runner! the movie made over 200million in the box office, and it has high scores on rotten tomatoes, meta critic, imbd etc... it’s a must-watch IMO
Agent Lindsay in T-Men (Dir. Anthony Mann, 1947) graduated from Berkeley.
[*Star Trek IV: The Voyage Home*
](https://www.youtube.com/watch?v=pgHxFNFWlZc)

Spock apparently spent too much time with the Mormons during the Free Speech Movement ;)
Not sure if someone already said this one but Basic Instinct !!
Kissing Booth 2
Junior (lol) [https://www.imdb.com/title/tt0110216/locations](https://www.imdb.com/title/tt0110216/locations)
Not a movie but two and a half men guest character, friend of alan
Another movie reference: [Walk Hard](https://en.wikipedia.org/wiki/Walk_Hard:_The_Dewey_Cox_Story)
Colossus: The Forbin Project supposedly takes place on campus. They use the Lawrence Hall of Science exterior as the main lab where they house Colossus
One of my favorite dramatic series of the past few years, Halt and Catch Fire, features two brilliant hardware engineers from Berkeley that settled in Texas and 😑
Kevin Kwan’s (Crazy Rich Asians author) new book Sex and Vanity has had its movie rights picked up.  The main male character attends Berkeley as an Environmental Architecture major.

https://asamnews.com/2020/07/19/kevin-kwans-sex-and-vanity-features-a-chinese-biracial-character-struggling-with-her-love-and-identity/
Not a Berkeley reference in a movie but here's a [list of movies filmed on location at UC Berkeley :)](https://www.imdb.com/search/title/?locations=University%20of%20California,%20Berkeley,%20California,%20USA&ref_=ttloc_loc_13)

[Finals (a 2019 short film) - Filmed at UC Berkeley](https://www.imdb.com/title/tt11492858/?ref_=rvi_tt)

In The Age of Adeline (2015) Ellis mentions his sister goes to Berkeley.
[https://www.youtube.com/watch?v=zvAFPHLFMa0&ab\_channel=YouTubeMovies](https://www.youtube.com/watch?v=zvAFPHLFMa0&ab_channel=YouTubeMovies)

Inequality for all. I recommend watching this movie/documentary. Great stuff. Romers are in it too! :)
r
[""At Berkeley""](https://www.imdb.com/title/tt3091552/) is a documentary from 2013 about the University.  I realize it's pretty on the nose as a ""reference"", but would include it because if you haven't seen it, it's neat, and it's got a decent IMDB score (for a 4 hour long documentary) and [won a few awards](https://www.imdb.com/title/tt3091552/awards?ref_=tt_awd)
Never seen this, but it was filmed during my tenure on campus:

[Boys and Girls](https://en.wikipedia.org/wiki/Boys_and_Girls_(2000_film))
If we are doing TV shows, there was an episode of Quantum Leap set on campus.

Showing my age but a great show!
""Fear the Walking Dead"" - The girl was supposed to go to Berkeley before the zombie apocalypse hit lol
The Umbrella Academy season 2. The girl Ben liked (who was in Klaus’ cult) wanted to go to Berkeley
I feel like it's more interesting to know which movies are set at Berkeley. For example, both ""Antman and the Wasp"" and ""The Graduate"" have Berkeley as a setting. In ""The Graduate"", [you can see old Sproul Plaza, old Moe's Books, and old AC Transit](https://www.youtube.com/watch?v=YY5_Gu_mLfM).
if we're going any reference to Berkeley, no matter how trivial- 

minor Bond-villain Henry Gupta (Tomorrow Never Dies*) is a ""techno terrorist"" who was a student at Berkeley in the 60s
Tim Kang, a character actor mostly in films, but played a big part as Kimball in the TV show The Mentalist, was a Political Science grad.
Where exactly in Antman and the Wasp, Hulk, Iron Man, and Legally blonde? do you’ve clips links? So I don’t have to watch the whole thing hahah I saw antman but can’t remember but makes sense since the history is developed in SF
Omg Atticus went to Berkeley
The Umbrella Academy. When Ben was in Klause's body and was obsessed with that girl that left Berkeley to join his cult
Mare of Eastwood has mention of Berkeley's media studies.
Can’t believe I forgot that one, it’s one of Spielberg’s best!
Movies including Silicon Valley, mention Berkeley at least once

\-0x1F84481C7625E543
Haha this might be the funniest Berkeley reference in a movie!
“You guys need to get me the fuck outta here”
And the princess diaries 2
Very cool!
It fits her so well!
The West Wing does too! CJ says she went to Berkeley
To add, Parenthood is set in the city of Berkeley, and I believe a few of the characters went to Cal. In The O.C., a few characters also go to/studied at Cal.
Awesome! I need to make another list just with all the TV show references!
Damn they really need to fix the game so I can play it
I might need to make another list with all the TV show references!
Another TV show: in Halt and Catch Fire its mentioned that Gordon and Donna went to Berkeley.
It’s there! Already one of my favorite Pixar films!
I thought she wanted to go to Sarah Lawrence?
Awesome! It’s such a fun rom com!
He’s in there! It’s so crazy he went here!
Oh shit! He went to my high school too, I didn't even realize he went to Cal.
So cool! It’s amazing how many Berkeley/Bay Area references are hidden in Pixar films
He ended up transferring to UCLA :( so people don’t talk about it too much, but yeah he was here for a while!
It’s there! It’s so fun to watch it and see buildings that look just like campus! They have almost exact replicas of Sather Gate and the Campanile in MU.
It’s in there, but yes, it’s the quintessential Berkeley movie!
Arrival is on the list! It’s an absolute masterpiece, probably my favorite Villeneuve film! I’m so excited for Dune!
YESSSSSSSSSSSS I was about to say this one, this is the classic one!!! literally, the whole history unfolds surrounding UC Berkeley the movie made Sharon Stone a movie star and the film made 352million usd on a 40mill usd budget which for the early 90s that would be the avenger's box office of today, i would say this movie put on the radar the school for millions of people to know across the world

I would also say this is the biggest movie reference for the school ever, but no one from junior year to senior at the moment would want to watch an old movie from the early 90s
Hey they don’t all have to be masterpieces!
Yes he mentions Klauss that she left a full bright scolarship to go to Berkeley just to join Klau's stupid cult 😂😂also, Klaus starts the whole cult movement in Berkeley and then starts traveling in the bus with all the other groupies followers of his
I tried to include those too, so both those movies are on the list! The graduate in particular is like the essential Berkeley movie, I love it! Antman and the wasp is awesome too, it’s crazy to see Berkeley play a key role in a modern blockbuster! I wonder if there’s any other notable movies set in Berkeley that I missed.
Kevin Costner's character in Field of Dreams was a Berkeley grad.
> Wing does too! CJ says she went to Berk

best show ever
Also in the newsroom. Sloan sabbith. Another sorkin show
I’m bad at reading
Filmed at USC
USC, UCLA, and Berkeley"
"Let’s Paint TV with John Kilduff (2012) Watch as he paints, blends drinks, sings songs, all while running on a treadmill at Rasputin Music in Berkeley, CA",https://youtu.be/akcmo46tdIE,2020-01-10 14:01:19,,
