title,link,post_time,post_text,comments
Advice on Berkeley choirs?,https://www.reddit.com/r/berkeley/comments/6c9ie4/advice_on_berkeley_choirs/,2017-05-20 02:22:35,"Hello, I will be moving from Sweden to Berkeley this fall for an exchange and I’m an avid choral singer. 

Does anyone here sing in a choir and give me some pointers to which choirs are good in the Berkeley area? 

I’ve mostly sung in men’s chorus but I’d be willing to sing in a mixed choir as well. I primarily like choral music and is not as big a fan of pop songs arranged for choir.

How’s the choir life in the US/Berkeley overall?","I've been in the Chamber Chorus for a semester now, and have really enjoyed it! We don't get as much publicity as some of the a capella groups, but if you're looking for a more traditional choral experience then Chamber Chorus or University Chorus is for you :) UChorus has more undergrads and non-music majors, while Chamber has more music majors and a fair number of grad students (in the sciences). I'm a chemistry undergrad for reference.  
Both chorus meet twice a week each for 1.5 hours at a time (total of 3 hours per week), in the evening, so it's a pretty low time commitment.
Hey man! Berkeley has a stellar Men's Octet you should look into auditioning for! I also know they have a couple of a capella groups on campus that are pretty solid. As far as classical choral music, though, Berkeley's really not the place to be. I mean, yes, Berkeley has a Chamber Chorus, but I dont know if they're anything special. However, I'm sure they're still a solid group and I don't doubt you'll be able to find a choir that you'll enjoy while you're here :)
Hello, I was a member of the uc chamber ensemble (UCCE) as part of an a cappella group. I had a choral background as well so you might enjoy the a Capella community. There are so many  groups on campus and the variety of the groups are crazy diverse. Most of them perform weekly on Sproul plaza next to the gate. It's quite the commitment but worth if you enjoy singing.


On an unrelated note, if you are a bass Noteworthy will gladly audition you. Go bears
https://ucchoral.berkeley.edu/ is the website for UCCE. It's the parent group of Noteworthy and UC Men's Octet as mentioned above. The full list of groups is available on the website.

I would also recommend the UC Men's Chorale, since it's fun and has a low time commitment.
The GSE choir is super low key, if you're looking for something a little more relaxed! My boss runs it and he's a very talented choral leader. They really need men too! Message me if you're interested in getting involved with them!
Hi /u/resainos! Chamber Chorus sounds interesting! How does it differ from University Chorus? How many people are in the choir and what kind of music have you sung during your semester?
Glad you're interested /u/Coedwig! Chamber Chorus is about 35 people, while UChorus has (more) people, can't remember exactly how many. Here's the website for the Chamber Chorus (the University Chorus link is on the left hand side) http://music.berkeley.edu/performance-opportunities/university-chamber-chorus/
The main difference between UChorus and Chamber that I've heard about is that Chamber moves at a much faster pace through the music, and that there are higher expectations on the musical ability of Chamber singers. Honestly if you're interested I would recommend trying out for both (since they're under different directors) and seeing which one you like better. 
I'm not sure about UChorus but this semester Chamber sung 18 pieces in 8 different languages with the theme of Love and Longing. We had Brahms, Schumann, Rautavaara, and Randall Thompson, just to name a few.
Thanks! I’m a bigger fan of smaller choirs so I might apply for Chamber Chorus when I move there, it sounds pretty similar to what I’ve sung in my home country. Thanks for your input!"
Meeting people/social life at berkeley,https://www.reddit.com/r/berkeley/comments/tkwcj5/meeting_peoplesocial_life_at_berkeley/,2022-03-23 08:22:12,"This is pretty much just a vent. 

I’m currently a senior at Berkeley studying architecture. Majoring in architecture is nice because of the tight knit community, but it also kinda has a downside. Because all of my classes are only at wurster and I see the same 50-100 people everyday that are in my class, it makes it difficult to branch out and meet jew people.

I’m part of an athletic club on campus, but not many people are part of it (5-10 people). So while it’s nice to hang out with them, like architecture, it’s so few people (and the same ones everyday) that I feel like I’m not branching out. 

I am honestly really happy/content with my “circle.” I am really, really close to my housemates, I have other acquaintance friends, and I’m never necessarily lonely (which I’m grateful about). But I feel like I’m not taking advantage of being at such a big campus with the opportunity to meet lots of people.

I think a lot of this worry/stress was brought on by the fact that my boyfriend of 3ish years and I broke up recently. That happening made me think about how I feel like I was just so content/settled with my routine before that I didn’t force myself to branch out. 

With that said, I was wondering if anyone has advice on where to meet people (not just romantically, just in general?) on campus? I honestly don’t know. I feel like clubs are such a commitment and I have class with the same people in my major and would like to meet people from other departments

I saw a few other people on this sub post about themselves, so I’ll do the same and if anyone is interested in hanging out I’m down to meet new people! 

- I like to run, hike, and bike. If anyone wants to run together I’d be down! My pace is around 8 minutes on average 
- I enjoy reading and talking about psychology 
- indie music (can talk about different songs forever. I always like comparing and showing fellow indie lovers music I like and vise versa)
- I like art and design 
- cooking  
- walking around pretty neighborhoods in Berkeley 
- plants? Idk if this is an interest, more like I just have a lot 
- making videos 
- himym and Gilmore girls lol","Every week people make posts on Reddit asking to meet up and every week people make low effort responses like “PM me! I’m down!” and nothing every happens.

Nobody wants to meet strangers that they don’t know from online. 

Go out and meet real people on your own - it requires real effort
8 mile pace is pretty nuts; that's like top 5% for females of your age band.
up coming freshman here. have you been able to branch out and meet new people since the time of this post? If so how did you meet these people?
Agreed! I exchanged messages with a few people last year and nothing came of it.
Lol I made a post about asking for a girl to go on a date with me (I’ve never been on one as they usually ghost me last minute haha) and well yeah nothing came of it"
Any Non-competitive Acapella Clubs On Campus?,https://www.reddit.com/r/berkeley/comments/bszmm6/any_noncompetitive_acapella_clubs_on_campus/,2019-05-25 14:07:17,See title; the only experience I have with singing is of the in-the-shower variety--so I know full well how little skill I have--but I enjoy it a lot and would like to get more involved.  Are there any acapella groups on campus that take all auditioners/which groups are less competitive than others?,"Unfortunately, I’d say that all acapella groups on campus are pretty competitive simply because a comparatively high volume of students are auditioning for a small amount of spots in each group. Your best bet is probably to put yourself out there and try your best! There are also two UCCE chorale groups- Men’s Chorale and Women’s Chorale- that aren’t necessarily always singing acapella, but accept all levels of vocal talent and are a great bunch of people. Even if this doesn’t sound like your cup of tea, it’s a good place to start if you want to get some training and audition for other groups later on. I’d advise attending the Welcome Back to Acapella event in the first week of fall semester and researching online to pick out groups you like/want to audition for! Good luck!!
[deleted]
Consider joining University Chorus, Music 144.
As someone who was part of an a cappella group, I support everything in this comment. The Chorales are terrific and great for beginners and experienced singers alike. I would also recommend just auditioning for a bunch of groups and seeing what the experience is like so that you can gauge if/how much/where you need to improve to make the cut next time around.
I’ve never done acapella before but I’m really really interested in joining a group, do you have any advice?
Thank you for the advice!  I think I'll look into the Men's Chorale and talk to the post below.
That's awesome!  Will you guys be operating over summer?  I'll be here anyways, so I figure the sooner I can get started, the better.
I’d never done acapella before coming to college either, so don’t let that discourage you! Everything I said above is good, but here’s some additional advice:
- The more groups you audition for, the higher chance you have of getting into one. The auditions are usually the second/third week of the semester for every group.
- Every group has a different style and personality. Make sure you audition for the ones you think are the best fit for you, because you’re going to spend a lot of time with the people in your group!
- You’ll need a good audition song, obviously, but make sure you also plan ahead for callbacks. That second and third song needs to be just as impressive as your initial audition song, but hopefully shows off another aspect of your range or style as a singer. 
- The audition process is going to be nerve wracking and probably very long, but make sure not to let that stop you from being friendly. If you come across as conceited, aggressive, etc. you have less of a chance of impressing the people you’re auditioning for. Acapella groups are performance based groups as well, so make sure to at least pretend like you have confidence in your singing abilities! 
- If you get cut from callbacks, most groups will tell you that you can email them for feedback on your audition. Make sure to follow up on that, because they can offer valuable advice that could help you in other auditions.
Summer acapella is a thing, but I don’t really know how it works, I’d have to ask people who stay in Berkeley during the summer (I haven’t so far). If you just want to get singing, you can absolutely do it in any form! I wouldn’t worry about doing organized stuff from a competitive standpoint though, that’s too much stress and IMO unnecessary
Heyo I’m in the summer group that Robo mentioned — it’s usually just something thrown together by a few friends from each a cappella group. The community is phenomenal and every group gets along with one another so it’s almost like you’re in one big group sometimes.

Unfortunately not enough people are in town for each individual group to function over the summer. If you have any questions, feel free to DM me and I’ll be here if any of your concerns needs a meetup!
Thank you so much for the advice!! Where can I see a list of acapella groups that Berkeley has?
I don’t believe there’s a full list anywhere because different groups are either affiliated with UCCE or independent.

The UCCE groups are UC Men’s Octet (all men), Noteworthy (all men), The California Golden Overtones (all women), Cal Jazz Choir, and Perfect Fifth. There are more groups within UCCE, such as the two chorales and BareStage, but they aren’t strictly acapella groups. 

The independent groups are Dil Se (mainly Indian cultural group), Artists in Resonance (AiR), Drawn to Scale (DtS), Nikkei Choral Ensemble (NICE; mainly Japanese cultural group), For Christ’s Sake (FCS; mainly religious group), and DeCadence. 

Each group has their own website and YouTube page to check out!"
"Hey Reddit, please help local band Mad Noise get voted into SXSW 2012!",https://www.reddit.com/r/berkeley/comments/qar30/hey_reddit_please_help_local_band_mad_noise_get/,2012-02-28 19:27:17,"I don't normally do things like this [seriously, check my post history, I mostly lurk], but my friend is the bassist for Mad Noise, and they need your help to get voted to SXSW this year!

Reddit is the most powerful internet force I know, so I wanted to do my part to help make his dream come true. [Also, he goes to Berkeley, so you actually may have heard of him/their music. They played at Yoshi's very recently, and are scheduled for Saturn Cafe in a couple weeks.]

It's all very easy -

1) CLICK this link! http://www.topblip.com/w/9056

2) RATE the video by clicking the little music notes!

3) LIKE the video! (click ""like"" and sign into facebook blah blah blah)

4) TWEET it! (this is also worth something, apparently.)

If he makes it, maybe I can get him to write a song about Reddit, or something. If not, well, thanks for your votes/views/looking at this thread anyway. :)

P.S. They're not some P.O.S. garage band, either - they were voted SF Bay and Guardian's Best Local Band in 2011
",Upvote!  The lead singer was my English GSI and easily the best instructor I've ever had at Cal.  Mad Noise rules.
Can I get free counseling/therapy on short notice (or also scheduled) without health insurance?,https://www.reddit.com/r/berkeley/comments/79nyna/can_i_get_free_counselingtherapy_on_short_notice/,2017-10-30 07:13:42,"I have no justification to my parents for why I’d be getting therapy, if they knew I was bi I’d be disowned. I’m already in a weird spot by them calling me out for a hospital bill when I was transported for slitting my wrist and my story didn’t add up monetarily, can’t risk using their insurance more. Plus, they don’t have money either and that bill already was $400 and broke the bank. 

If anyone knows some way I can get free counseling that won’t show up anywhere, please, tell me. It’s 7am right now and I type this on this throwaway account because I realize that it’s probably more likely that I kill myself in the next 24 hours than it is that I can flip flop my sleep schedule for me to wake up at 6am for an 8am 61c midterm when I sleep at 7am (hopefully) the night before, and that in this day of having to flip flop sleep, I somehow manage to catch up from being weeks behind in this class and succeed. I missed an essay due at midnight for cs195 bc I woke up at 2, stayed in bed til 5, railed adderall until my drug dependent brain was fed and distracted, ate breakfast at 6, sat in moffitt doing nothing til 11:15 and then tried to start the essay then. I then fucked around for the rest of the night and did nothing else, left moffitt at 4am, laid in bed for 3 hours thinking, and now am writing this post. 

I literally cannot work anymore, I can’t take this fucking school or the stress. I sell my adderall to afford food but then I can’t work because I don’t have my adderall. But hey I came out as bi last week, at least to the greek system here, so maybe I’ll have a shot at the “sucking dick for drug money” meme. 

I just need the stress to stop. I feel no motivation to do anything except to write, cause when I’m writing I just lose myself in the words and can get away from real feelings. All the time I did “nothing” at moffitt I was literally just writing, not writing for class, but just writing. I wrote a 20 page (6200 word) review for a show I saw earlier this month (hip hop group called brockhampton). The other day I had my friend find me two of the most meaningless lines from the most meaningless recent trap song he could find as a challenge to myself to write something absurd and then try to argue it, and I wrote a 3 chapter, 8700 word essay about the practice of analyzing music, the “truths” or accepted musical canon, and how to use literary philosophy and stuff from Kant and Freud to establish an explicit analytical framework for reviewing and analyzing music, and contrasted that with the implicit framework that is just accepted and used by all reviewers, and then finally after these chapters of preposition I finally analyzed two dumb lines to absurdity. 

The most frustrating thing about this is that I fucking missed the deadline for the essay due at midnight but then I still wrote it afterwards from 12-2 and finished it because it was about using moral philosophy and it’s components to analyze the morality of voting to do things like raising minimum wage which will make people lose their jobs and be replaced with automated solutions, and it was a really interesting paper, but late submissions weren’t accepted, so I submitted the paragraphs establishing this sort of ethical framework of analysis and then I just cut the paper before getting to any point and submitted it cause I ran out of time, then finished after, and it ended up really good, but went way over word limit. All of this is a good example of why I’m stressed and why I fucking hate this school right now — do I really learn more as a student here if I submit by 12 and not by 2? Is my paper really a failing paper if I double the word count? I understand there are limitations to how much they can grade but for people like me who can’t deal with the stress already, knowing that you have a lot to say and have to limit it to a tiny word count of 1000 at max is terrifying and kept me from even wanting to start. 

I don’t know where this love for writing is coming from because I’ve never had it before, but now that I have no will to live, all I want to do is write essays long-form. Word limits terrify me, I’m only interested in music and philosophy, CS sucks, this school sucks, and the only reason it’s not worth us all killing ourselves is because we’d hurt other people and deprive them from opportunity cost happiness, which is p ironic cause if everyone killed themselves then it’d work out anyways. 

I’m tired as shit so I rambled, sorry. The point is, I need help, desperately, and I don’t know what to do, but I’ll probably die if I don’t get it. 

Thanks for reading 💞","[deleted]
[deleted]
You've got a lot going on right now, but know that you don't have to take it on by yourself. You've got lots of options available to you and plenty of people who are willing to help.


First, I would ask that you make your way to the third floor of the Tang Center to visit [Counseling and Psychological Services (CPS)](https://uhs.berkeley.edu/counseling). If you let the person at the desk there know that you're [currently having an emergency](https://uhs.berkeley.edu/emergency), they'll help you out.


[If, however, you feel as though you can't make it to the Tang Center, please call 911](https://uhs.berkeley.edu/counseling/prevention-education-outreach/suicide-prevention).

You can also give the [National Suicide Prevention Lifeline](https://suicidepreventionlifeline.org/) a call at 1-800-273-8255.

Your life matters. 


After that, know that the Tang Center offers [individual counseling](https://uhs.berkeley.edu/counseling/individual) to all students. The first five sessions are free, regardless of your insurance coverage, and students are allowed to make up to eight appointments a semester.


And when it comes to food, I might suggest checking out the [UC Berkeley Food Pantry](https://pantry.berkeley.edu/about/), located in the Student Union building. You can visit twice a month to receive food for up to 10 days.


In regards to your school work, I would consider getting in touch with your professors or GSIs and letting them know what's going on. They're people too, and if you explain what's going on, even just a bit, they'll understand. It might also be worth considering [taking a break](https://uhs.berkeley.edu/counseling/social-services/academic-adjustments-and-medical-withdrawals) from your studies. College, especially here at Berkeley, can be stressful for any number of reasons. I know that when I was going through a hard time, I found it easier to take a break from school so that I could figure out how best to take care of my own needs first.


I hope you get the help you need, and I hope you know that we're here for you if you need it.
I think Tang Center is best for emergency situations, but if that proves to be a problem for whatever reason, the engineering department has [their own personal counselor, Christine Zhou](http://engineering.berkeley.edu/student-services/advising-counseling).

She's got walk-in hours, although I don't remember what they are now. If you walk through ESS into the hallway behind it, you'll see her office, and there are usually fliers with the times around it. I went to her a few times when I was at Berkeley; your mileage may vary, but it's another option open to you.

I'm at work right now, so can't comment too much - but feel free to message if you need someone to listen. Wish you the best, man. This place is stressful as hell, but I think you can get through it. :')
Every student has access to free counseling with our without SHIP.

https://uhs.berkeley.edu/counseling/fees

> Students do not need to have purchased the Student Health Insurance Plan to see a counselor. Initial phone and in-person consultations, urgent visits, and initial counseling visits (up to 5th session) are all free. Minimal fees apply to other services.
Thank you, I appreciate the support. I’m gonna go in tomorrow, this helps a lot to hear.💞
Thank you for the kind words 💞

Other commenters said this too so I’ll check out the ability to cover my payment and if not you’re totally right, a discord server or something anonymous to vent might be the right choice, I think I only came here because I figure people here can know what it’s like to be a student here more than anywhere else, obviously. 

I super appreciate the offer to meet up, i think I’d be a little uncomfortable with that because of the precedent I’ve set for myself and everything but it’s incredibly kind of you to offer. My social life here is objectively quite fine; I’m next in line for social chair of social fraternity, and things look very fine from the surface, so I have people to talk to. Unfortunately it also makes the fact that I feel so alone something that’s hard to talk about, depression is a bitch and hard for other people to empathize with when it seems like it’s coming from nowhere. 

I emailed the professor so we’ll see how that goes. Hoping for the best. 

Also, yes, I’m considering picking up a double major in philosophy or something, just already feel like I’m pressed for time and don’t know if I necessarily want to add more to my plate. I really do feel passionate about CS, but this semester I’m not taking classes that have enjoyable work for me as I finish off all my lower divs. Hopefully it gets better!"
