title,link,post_time,post_text,comments
Math course suggestions for cs+physics major,https://www.reddit.com/r/berkeley/comments/ommfor/math_course_suggestions_for_csphysics_major/,2021-07-18 01:11:29,"Since phase 2 is coming, I wanted to ask for some beautiful/useful math upper divs for a physics + cs double major to take. Since I don't really have anymore formal math prereqs to fulfill, I'm not sure if it's worth taking all the math major upper div reqs. I do plan to take 113 and 104 in the fall and spring, but I think I might skip on 110 and 128a (unless someone convince me otherwise-- I liked math 54 a lot but I see a lot of lin alg in my classes that I'm not sure if 110 is a must-take). I also just want to hear about interesting ones other than the core upper divs.

I would appreciate any course recommendations, thank you in advance!","I definitely think math 110 is worth taking or at the very least, you should take a course that introduces you to more proof-based, formal linear algebra. I would recommend Math 110, but you can also take a more applied upper div linear algebra course like EECS 127. Linear algebra is going to show up in upper div cs and physics courses in some way no matter what area you are interested in. Technically, you will be fine not taking math 110 or EECS 127, but if you take either course (or both), you will be able to learn the upper div cs/physics material at a much deeper level. Depending on your interests, some other math courses that might be worth considering are math 126 (partial differential equations), math 123 (ordinary differential equations), and EE 120/123 or math 118 (Fourier Analysis,  Wavelets, and Signal Processing). Also, definitely take a probability course (EECS 126, stat 140, or stat 134). 

As for math 128A, I think the concepts are very important for anyone interested in applied areas of research (physics, engineering, etc.). That being said, the course was just constant busy work. It was just lots of drawn out calculations over and over and over again. The material was interesting, but the way it’s taught at Berkeley, made me hate it. I’m sure there are some who loved that course, but ughhh I wish I had just self-taught myself the material….since I would probably enjoy the concepts more if I had.
Math 110 is a must-take in my opinion. Abstract linear algebra is one of the most useful things you can learn for both physics and CS. 113 is pretty important for physics and CS, but it isn't necessarily a ""must-take"" depending on what you want to do. If you like cryptography, for example, 113 would be extremely useful. 104 isn't useless as it will improve your general understanding of functions (e.g. what assumptions are you making when you do some derivation), but it is much less important than 110 and 113 in my opinion. I would honestly suggest taking 185 over 104 (it lists 104 as a prereq but it isn't actually necessary), as branches and contour integration are useful in certain physics disciplines. However, like 104 it isn't a necessary class and its uses are more specific than 110 and 113.

If you are ever going to do numerical work (which you probably will), 128A covers very important material. However, the class is slow and tedious, and its not too difficult to learn what you need to know on your own. Also, many important numerical algorithms are part of widely-used coding libraries, so even without 128A knowledge you can easily get by.

For non-core math classes, it is probably better to wait and see which subfields you are most interested in. If you want to get more into relativity, for example, math 140 is the way to go. It is worth noting, however, that once you take enough proof-based math and gained ""mathematical maturity,"" you can stop taking full math classes and instead learn the specific parts you need on your own. You don't have to do this, of course, but often the topics you want to learn are a series of graduate courses away and involve learning a lot of material mathematicians are interested in, but you might not be. Also, your courses in physics and CS will cover some of the math you need as well, and taking more math might end up replacing electives you find more interesting.
As others have said, abstract linear algebra like 110 is a must-have in my opinion. If you feel like you won't get much out of it, you could try H110, which would be quite a ride.

Besides that, I can share some of my own biases w.r.t. being a CS major.  I honestly wouldn't spend time on the core upper divs unless you plan to major in Math since I don't think they are really as interesting as the electives. If you find Logic interesting then I highly recommend Math 136 or Math 125A. I think 136 is a little more bang-for-your-buck since the first half of 125A (Sentential Logic) is kinda boring, but the end gets cool as you talk about the Metamathematics. 136 is all about Computability and if you have time at the end you cover Goedel's Incompleteness Theorem(s) in some detail. As a Math + CompSci major whose always had some interest in Logic and had some exposure to Computability in CS 70, this course was definitely my favorite that I've taken and I cannot wait to see more Recursion Theory. Besides these, if you still like Logic, you can check out Math 135, which is eye-opening for any Math major and is my second favorite course at Cal so far. This would feel like more of the Countability unit in CS 70 and VERY axiomatic (I mean, you are essentially developing a basis for all of math!)

On the more applied side of things, I second the comment about 128A because I see it as useful for any CS major, but not sure it's a class most people ""enjoy."" You can also check out Math 116, which is being taught by the same instructor I had last Fall- this is an S tier class and perfect for CS majors who want to do some pure math/abstract algebra. It was wonderfully prepared and every assignment was super deep. MY EECS friends found this class to be a blast.

I can't comment about the topology courses because I haven't taken any yet (next sem!) but I would bet they are pretty solid. Almost all of my pure math friends in MUSA claim 142 to be a must-take and I hear great reviews about 141/143. 140 seems more like vector calculus from 53, but that's still pretty interesting imo. Sorry for the long reply! Haha
Thank you for such a detailed response! What are your thoughts/experience on topology courses (I think those are the math 140s)? Also omg you're a triple major that is so cool, do you mind me asking how many techs you average per semester haha
It depends on what your interested in. I really liked differential geometry  and I found it to be helpful for my interests. I also took 202A which depending on the professor gives an intro to general topology. I didn’t take algebraic or differential topology though, so can’t help ya there. 

I’m technically triple majoring, but I plan to drop the physics major (and just minor in physics). Next semester is my last semester and I want to prioritize taking courses that align with my interests/goals rather than finish up the physics major. 

I generally take 3 techs a semester. I’ve taken 4 techs once and I managed to survive, but I do not recommend it. I also always take summer courses. I generally take one tech course in the Summer along with some sort of research or internship experience. Generally, I spend all of late May and early June, working through the Summer course…that way I can prioritize interning/research.
If you want to do qft, string theory, or general relativity you will need to know a lot of geometry/topology for certain aspects. It really depends what your interests and goals are"
EECS127 or Math110,https://www.reddit.com/r/berkeley/comments/n06yaj/eecs127_or_math110/,2021-04-27 21:33:19,"I'm basically looking to strengthen my understanding of linear algebra before I eventually take 189. For people in 127, what do you think about the prof? Should I take Math 110 instead or is taking 127 more important for 189? Thanks","I would argue it's better to think of 110 as a soft prereq for 127, which is itself a soft prereq for 189. 110 is worth taking if you feel like the 16 series was super confusing.
I think 110 is taught much, much better but I tried taking 189 with 110 only and found it really difficult. El ghaoui is not a good prof imo, but the material in 127 will be taught in a way that is more applicable to 189 from what I've heard - some of the problems on the homeworks are even straight from 127 (at least early hw's)
thx! how did you find 110 in terms of workload and would you say that it somewhat helped for 189? i might take the class regardless since I still feel pretty weak on linear algebra despite taking 16a and 16b. in that case, would you recommend self-studying 127 instead? again, thx for the help!
how is 110 in terms of difficulty/workload compared to CS classes?
Workload was reasonable, not super heavy but definitely not light either. It helped somewhat with the Lin alg but definitely not as much as 127 would have; it focused more on the theoretical aspects which 189 doesn't use as much. 16ab definitely suck for Lin alg so i feel you there, but 127 would probably help enough with that too i think. idk how self study able it is since i haven't taken it so idk about that, sorry :/
Less difficult, about the same workload as a medium workload CS class. Probably on par with cs170 with difficulty (if not a bit easier) and slightly more work than it but it's less conceptually difficult, more grindy work"
"Mumu Lin: ""I cannot actually escape my real life, however. That's a mistake I made last year: relying on video games to cope, rather than facing my academic failures head on. Gaming is by no means a replacement for mental health treatment, which is why I did seek treatment at Tang.""",http://www.dailycal.org/2017/10/16/console-consolation-gaming-as-self-care/,2017-10-16 23:34:09,,
"CS 61A, EE 16A, CS 70",https://www.reddit.com/r/berkeley/comments/cggsyj/cs_61a_ee_16a_cs_70/,2019-07-22 11:14:45,"I'm a transfer student starting this coming semester. I'm thinking taking CS 61A, EE 16A, CS 70. I do have prior programming experience, even before community college, so CS 61A is not my concern.

  

What I do worry is EE 16A and CS 70. I have no idea what EE 16A is about, and have seen people saying CS 70 is hard. Would this be too difficult schedule?","Quick question, do transfers have to meet the 3.3 requirement? If yes, I recommend sticking to 61A and EE16A first semester to understand the rigor of EECS courses here. If you feel comfortable, take 61B and 70 the following semester.
Difficult but doable, depending your background. Try it out and drop if it's too rough.

Ee16a is 2/3 linear algebra and 1/3 circuits. If you've done lin alg before it should be a very easy class, it's not particularly hard even without any lin alg experience. 70 difficulty varies widely by person but I thought it was in the same tier of hardness as 61a."
Cafe 3 Rant,https://www.reddit.com/r/berkeley/comments/xeb6hw/cafe_3_rant/,2022-09-14 12:40:22,"I’m sure those of us who frequent Cafe 3 have heard some variation of the following phrase repeated ad nauseam: “Just go to the other line; it’s shorter and it has the same thing!”

So then what compels students to stay in the first line??!! Is it because they are dumb?!?! Incapable of seeing that the other line is shorter?!!! Or do they genuinely enjoy waiting in line longer?!?!?!(“Hehe look at me! I’m waiting in line; so kewl!!!🤓🤓🤓🤪🤪🤪” *posts it to TikTok*)


NO!!!! NO!!!! NO!!!!🤬🤬🥶🤯 It is BECAUSE…BECAUSE….BECAUSE the first line gives students ACCESS 😩😤 to the ESSENCE of all life and humanity’s MAGNUM OPUS 🥸🤩👀, PIZZZZZAAAA!!!! 😧😧😧 LIFE-SUSTAINING PIZZA🥶 THAT STUDENTS🤓🤓🤓 WOULD BE DEPRIVED OF SHOULD THEU CHOOSE TO WAIT IN THE SECOND LINE 💔😔😔💔🤬

PIZZA😧PIZZA😧PIZZA😧

WHAT WOUDL WE DO WITJOIT IT?!?!?!

The Krusty Krab PIZZA🥶 is the PIZZA🥶 for you and me


The Krusty Krab PIZZA🥶 is the PIZZA🥶 free

de-li-ver-yyyyyy 🤩🤯


The Krusty Krab PIZZA🥶 is the PIZZA🥶, VERY TA-STYYYYYY 😎😎🥹🥰

THE KRUSTY KRAB PIZZA🤬🤬🤬. IS THE PIZZA🤬🤬🤬. FOR YOU AND MEEEEEE🤬🤬🤬🤬.

Not “tHe kRUstY KrAb pIzzA is ThE piZzA FoR StUDENTs wHo cHoOsE To cOnTiNUE WaiTing In tHe FIrSt LInE DEspIte PREsSuRE NOt tOoOoOo”

Checkm8 librels 🤬🤬😎😎","And this is only the third week of classes...
what 👁👄👁
Wtf is happening
[deleted]
Damn Cafe 3 didn't even have pizza last year, I got scammed fr
![gif](giphy|3og0IwkzpPcS28h572)
People who went to high school during covid.  Brains are underdeveloped bc of lack of social stimulation during formative years of life."
Missing ee16a midterm from flu,https://www.reddit.com/r/berkeley/comments/au1lgb/missing_ee16a_midterm_from_flu/,2019-02-23 15:32:27,"I emailed the head gsi, and I could replace the grade from the final portion with a doctors note. I'm worried that the final part of lin alg (module 1 and 3) is going to be harder than the midterm. Is the final usually harder than midterm 1? ","Usually the final exam’s portion of module 1,3 seem to be harder. It’s mostly due to the learned materials being integrated together.

A question on the final assumes that you know all the materials for the semester, so you won’t get compartmentalized questions where it’s easy to see what concept/technique they want you to use.

Also, the final doesn’t put too much emphasis on module 1 materials, so if you miss even a couple parts you might end up worse off (since basically you’re being double counted for module 1,3 stuff in the final)

My advice is to take time to go through past finals rigorously! They try to have novel questions, but almost always the problems are some slight variations of past problems!

Sorry to hear about your flu! Remember to take good care of yourself
if you remember the syllabus, your lowest midterm can be replaced with a portion of your final if you qualify for clobbering. You should double check the syllabus
I'd recommend you to just struggle through the midterm. Failing it won't be any worse than not taking it with regards to the clobber if you do poorly. 

The final is usually significantly harder than the midterms, and since they never release averages or distributions or anything, I'm inclined to believe they clobber by raw score instead of by performance relative to the class (which is very unfair honestly). They never tell you anything other than your final letter grade though, so no one knows exactly how they clobber lol. I could be totally wrong. 

Studying while sick definitely sucks, but I'd recommend you try your best. Good luck!
[deleted]
[deleted]
Lol your post history
Are you kidding me?  I have never missed a midterm for the freaking flu.  I had my face clawed open by a cat and spent the night in the ER before a thermodynamics midterm and still went to it. It's not bird flu.
This guy had a mid life crisis or something "
"Failing a class, what can I do at this point?",https://www.reddit.com/r/berkeley/comments/78tv8e/failing_a_class_what_can_i_do_at_this_point/,2017-10-25 23:51:22,This is my first semester at Berkeley (Junior) so I'm a bit unsure of what to do. I'm currently taking Math 54 with Lin and did really bad on both the midterms (D average). Should I drop? Wait till final? Any advice?,"Well barring some unusual circumstances I don't think you can drop anymore, we're well past the deadline (although I thought I heard about some new policy that gives you one late drop in your Berkeley career, not sure).  If you don't need this course for your major you can change to pass/fail until Friday. You may still fail, but then it at least won't affect your GPA. 

Someone else can chime in but if you do need this course to count for a letter grade, at this point I think you only have two choices. 

1) Study your ass off for the final which may give you a good enough final score to pull your grade up to a C. Make sure you're doing any homeworks or other credit you can. Talk to the professor about the final and your grade, there may be some leniency to at least help you pass if you do well on the final. Historically, I've had math classes that offered to use the final to clobber one (and in one case *both*) of the midterms. If that's the case, then you can use a good grade on the final to also replace one of your midterm grades, which would help a ton.  You might even wind up with an A. 

2) Give up on Math 54, focus on your other classes, and allow yourself to fail. You can then retake Math 54 next semester and hopefully do better. Both the original failure and the new grade will show on your transcript, but only the new (passing) grade will be factored into your GPA. 
[removed]
OP can drop:

Effective this semester, Fall 2017, L&S has changed their policy for requests to make late changes to student schedules. Students are now allowed to request for late changes (adds/drops/change units in variable courses/grading options) once in their entire career at Berkeley. Studen

1) Students are now allowed to request for late changes (adds/drops/change units in variable courses/grading options) once in their entire career at Berkeley. 

2) Students can request up to 2 changes

Basically, if this is your first request, this will be granted. However, you should plan carefully because since this is only allowed once in your undergrad career, future requests will not be reviewed. (Previous exceptions granted does not affect your possibilities to do late drops this semester, everyone starts fresh.) 
Unironically this. Although you don't have to be so dramatic. I think they have to write the note as long as you say that, like you can have a straight face and be puffin on a cigar when you say it.
Yup that was the thing I was thinking about, I couldn't find it when I went to look though.

I don't think they specified what happens if you drop below the unit minimum after doing a late drop though.  If OP doesn't have enough units, it may wind up affecting their financial aid.  Something to ask an adviser about.
I don't have any financial aid but I would go under the minimum unit count. Does Cal offer some kind of 1 time exception?
I'm not sure. You should probably go ask the advisors since this is a new policy. 
Will do, I'll update with what they say. Thank you so much!"
RIP Grade release,https://i.redd.it/sroa6zmf0cba1.png,2023-01-10 19:16:09,,"At least Lin Lin has been vocal, Serganova has been radio silent since after the final...
This is what happens when professors wait and hope that GSI strike would end before starting to grade shit. The strike ended right on the last day of appointment so all GSIs went on winter break and will start working for a new class next week.
Class?
Not a great push to choose UC over privates. Good luck.
I've heard people talk positively of Serganova once, and negatively maybe three times. This is worrysome since I have her next semester.
One of my professors gave everyone NG’s “in solidarity” with the strikers. I had to beg him to give me a grade because financial aid told me they wouldn’t fund my Spring ‘23 semester if I didn’t have full-time units for Fall…
>This is what happens when professors wait and hope that GSI strike would end before starting to grade shit. 

Hard to solely blame the professors here. GSI’s were actively demanding that professors *don’t* grade finals, claiming that it harms the strike to do their work.
math 54
she is definitely one of the professors of all time
did they end up giving you a grade? i hope you got that sorted out 🥺
among others
*cries from chem3bl *"
Thoughts on Chinese 1A/ Arabic 1a,https://www.reddit.com/r/berkeley/comments/17fh9b4/thoughts_on_chinese_1a_arabic_1a/,2023-10-24 09:45:47,I'd be taking one of them with another hard CS class - but they would be my only 2 hard classes. Is Chinese 1A better taught then Arabic 1a is one relatively easier than another? Any experiences you can share would be greatly appreciated!,"I’ve taken Arabic 1A. If you’re with Elsa, you’ll develop a strong foundation in the language. There’s homework everyday but the class is very manageable with STEM classes.
i took chinese 1a with Lin, and it was really fun! there may be a steep learning curve since it’s a tonal language that utilizes a character-based system, making it difficult to grasp at first. In general, both languages are hard to learn, so choose the one that you’d be more passionate and motivated to learn/put the work in"
"Eight-year-old Stephane Lin had a cough that she couldn’t quite seem to kick and was diagnosed with asthma. The doctor warned attacks such as this would only get worse, unless Stephane adopted some sort of physical activity. A five-star, top-100 recruit, Stephane is now a Cal varsity tennis player.",http://www.dailycal.org/2016/03/11/348276/,2016-03-11 20:36:21,,"Great writing
Great legs
Dem calves tho"
Concurrent enrollment at community college during the semester,https://www.reddit.com/r/berkeley/comments/hazhps/concurrent_enrollment_at_community_college_during/,2020-06-17 13:31:17,"Is it possible to take a community college class while still being enrolled full time at Berkeley? I wanted to do Lin alg/diff EQ class at CC to satisfy Math 54 since everything is going to be online anyway during the fall semester. Is this possible or do you have to take everything at Berkeley only?

Thanks!

I'm an incoming freshman in case that affects anything.","You would need to fill out the concurrent enrollment form and have it approved by a college advisor (eg L&S) before you can take the class.  You also need to have a valid reason why you are taking the class elsewhere.  Valid reasons includes time conflict, or the class is not offered at Berkeley during that semester.

If you don’t want to go thru this approval hassle, I would take it this summer or the following summer.  Approval is not needed in the summers."
Math 110 while taking EE16B? (Math+CS),https://www.reddit.com/r/berkeley/comments/i670bv/math_110_while_taking_ee16b_mathcs/,2020-08-08 14:17:05,"This is looking a bit further into the year, but I am considering to do CS major and minor in math. I'm going to take EE16A and 53 this semester and 16B and Math 110 in spring. However it seems like 110 states lin alg as prereq (which 16A + 16B is needed to satisfy). But I am scared that pushing 110 off to next fall and having a semester without a math course is going to weaken my math knowledge. Anyone have any idea or advices on what to do?","Just 16A is probably fine, 110 is a rather self-contained course
Just 16A doesn't really cover all of linear algebra ... you would probably need 16B as well to get a good enough background for the class (unless you feel confident enough to  self-learn whatever parts you would have learned in 16B before the spring semester starts)
110 isn’t helpful at all for 16B. Especially if you use Axler for 110"
Taking CS88 and Data 100 Concurrently,https://www.reddit.com/r/berkeley/comments/ekynha/taking_cs88_and_data_100_concurrently/,2020-01-06 11:11:24,"I'm enrolled in both cs88 and data 100 right now, and I was wondering if that's advisable? I've gotten conflicting reports about whether doing cs88 before data 100 is even that helpful. For context, I took data 8 last semester and took lin alg at UCSB (I'm a transfer). Would really appreciate any advice, thank you!","imo 88 isn't that useful especially if you already have some python experience. 100 isn't too programming or linalg heavy and they do a decent job of teaching you important concepts from scratch (at least with hug this sem)
I took data 100 and stat 140 last semester and it was fine if you kept up with lecture. The material is very much a continuation of Data 8 and you learn more about visualization and learning tools such as pandas, scikitearn, and matplotlib, and get some (but not a lot) of the math background to some of the models. The coding in Data 100 is pretty free form so I think if you just make an effort to have enough time to finish your assignments you'll be fine.

 I haven't taken CS 88 but I have taken CS 61A, and I think that while the material somewhat overlaps, it would probably be better to take them both together to just get more Python practice. I have heard that CS 88 is a lot of work however, and again, if you have enough time to do the work I think you'll be fine."
"Karen Lin: ""For the past four years, whenever I told other adults what I was majoring in, I braced for the disapproving look that scorned me for wasting precious time and tuition money on such frivolous humanities degrees (comparative literature, music)."" She took CS61A and worshipped John DeNero.",http://www.dailycal.org/2016/05/05/exploring-the-intellectual-playground/,2016-05-05 22:13:48,,Well that was one way to make me feel bad for not doing shit for four years. I was in symphony with her for one year but I did nothing afterwards. :(
"Advice on regrets. Graduating senior Kyeihong Kim: ""I wish I could have went out of my bubble and dated more people. 'After I get this job, then I’ll start dating.' But there's always something new that pops up."" Nelly Lin: ""Love will come when it will, but my career takes precedence.""",http://www.dailycal.org/2017/04/30/regrets-advice-graduating-students/,2017-04-30 19:33:25,,
