title,link,post_time,post_text,comments
CS164 with Koushik Sen,https://www.reddit.com/r/berkeley/comments/b2cjc4/cs164_with_koushik_sen/,2019-03-17 18:10:44,"The schedule for CS courses in the next semester is recently released. As a rising sophomore who is really interested in programming languages and compiler, I definitely will take CS 164. But I'm a little bit disappointed that the professor is Koushik Sen instead of Paul Hilfinger, whose ""legendary"" stories teaching this course is well-known. I found few information about Koushik via internet (ratemyprofessor and etc.) . Had anyone ever taken his CS164 or any other courses? How's his teaching style and workload? A lot of thanks!","here we see a man sad about not getting hilfinger'd 
Just as a side note: I'm taking 164 with Hilfinger right now, and it seems like he's just using the same projects that Sen used last semester (ChocoPy) so I don't think you're missing out on much by taking it with Sen instead of Hilfinger
Anecdotally, I had Hilfinger for 164 and it was great. The projects were super hard, but I still enjoyed them. If you can wait, I'd recommend it.
You're taking 164 as a first-semester Sophomore? I'm sending my thoughts and prayers."
Workload,https://www.reddit.com/r/berkeley/comments/nnqxe9/workload/,2021-05-29 09:25:17,"I’m a rising sophmore and am an intending to double CS/ DS and Econ/ Haas. I was thinking of taking 61B (Hilfinger), 100B (Hawkins), Stat20 (Andrew Paul), and Philos12A. Hows the workload for this? Should I replace Stat20 with Anthro2AC? Should I take Stat88 this summer instead with a GSI? Thanks!",Seems like a pretty easy workload for a double. I’m just data science and I took 61b and 100 at the same time and 140 and it wasn’t that bad
How would you rate the CS undergrad program?,https://www.reddit.com/r/berkeley/comments/13wx22y/how_would_you_rate_the_cs_undergrad_program/,2023-05-31 13:28:13,"Is the EDUCATION overrated? Better than you expected?

Worthy of being T3 programs? 

Specifically talking about CS undergrad.","Every resource I wanted was available to me. We have the typical big school gripes but the education was much better than I expected.
Why do you ask? Is this another comparison post with Central Michigan University or something?
Pretty amazing so far. The CS classes and even the EECS classes have been a lot of fun but required hard work. The speed of learning is exhilarating and I have not a single issue with the quality of classes.
Amazing, had an interview today where one of the questions was about something covered on literal the first or second day of 61a. Yeah prob an anomaly but should give you an indication of how well structured the classes are that you’re learning useful content from day 1
Paul Hilfinger
How theoretical vs practical is the curriculum?
what classes have you taken so far
what was the interview question if u don’t mind
You can go either direction you want. They don’t hold your hand and teach you languages and frameworks as entire classes like other schools. Classes like 162 are like all practical whereas 170 is a theory class. Taking a handful of classes prepares you for any type of SWE job. The ML classes have a good balance of theory and practicality. Things probably lean more theory heavy as it’s a premier research university but I’ve found practical uses in almost all classes
The core CS curriculum (61 series and 70) is a good balance of everything imo.  After those classes, you get to choose so it’s as theoretical/ practical as you want.

I wish I could have skipped the 16 series and done 56 instead (I applied to EECS when both majors had to take the 16 series ; this is no longer the case, only EECS does now).  16A and 16B are the only classes which feel overly theoretical imo.  Even then, they aren’t too bad and I’ve learned a lot of practical skills as well.
61AB, 16AB. Taking 70 in the fall."
Questions about CS courses from visiting students for 2019fall,https://www.reddit.com/r/berkeley/comments/cbplyu/questions_about_cs_courses_from_visiting_students/,2019-07-10 18:42:01,"Hi,

I am a visiting student and is about to spend my first junior semester in UC Berkeley this fall. I am looking for some suggestions about how to do well in the following CS courses(People keep telling me that Berkeley CS courses are challenging). Because I would only stay in Berkeley for one semester, the grades really matter for me for my future application.

So I have read some of the posts about CS61B, CS188. And I am really into robotics so maybe take EECS106A into my consideration, among these three courses, how can I do and in what aspects specifically should I really put my effort in order to get high grades(>=A)?

Specifically, here is some information about these courses in 19fall:

1. 61B by Prof. Paul N Hilfinger
2. CS188 by Prof. Anca Dragan
3. EECS106A by Prof.Sosale Shankar Sastry

I found the information on Berkeley Acedamic Guide and hopefully I got the information correct.

If you have taken some of the courses above or know the professors quite well, I would really appreciated if you can offer some specific suggestions on how to success/get a decent scores on these courses.

Also, you are welcome to give other suggestions on my schedule or anything else(Whether it's too much load or anything else)!","Taking 188 or 106A will be really dependent on your college math background. If you tell us what maths you've been exposed to it would help us help you make a better decision.
Hilfinger's 61B is known for it's extremely difficult and large scale projects (dozens of hours per project even though it's a lower division class). Also his projects are all solo, so don't expect to only write the parts of the project you feel most comfortable with. Having taken it last year, even with decent programming background the class is a huge time sink so be ready for that if you take it.
All that being said, if you can succeed in the projects the grade distribution ends up being very favorable at the end of the semester.
I have taken mathematical analysis, calculus and linear algebra during my freshman year. And signals and systems and probabilities on my sophomore year. Though I got fair good grades on most of the courses, I wouldn't say that I am super good at math...Actually, I heard that 189 is really math consuming and requires deep understnading of the intuition behind math so I kind of give up on that one...

Not sure if this helps?
You should be fine then. The main prereq needed for 106A is signals/systems, and for 188 is probability. 189 does desire a much higher understanding of probability theory and linear algebra beforehand which is why it has that reputation, but some people take it without that much prior experience and do fine.
Thanks for your advice."
CS61B GRADE BINS ARE BACK TO NORMAL,https://www.reddit.com/r/berkeley/comments/fn8fdw/cs61b_grade_bins_are_back_to_normal/,2020-03-22 15:17:02,"https://image.prntscr.com/image/ktc-w-uoRJ2338EteX-0TA.png

Hilfinger swapped them back to last semesters save for the A+ bin being shifted upwards. So relieved :D","For real? This is insane how am I supposed to get an A+??
granddaddy hilfinger
YES YES YES YES YES
God Bless papa Paul 🙏🏻
A+ was 194 this semester before this shift. It's 191 now. So three points lower. I don't know how much it was to get an A+ last semester though
Was 182
I think it was around 186.
181."
YEE HAW TO RETIREMENT,https://i.redd.it/ymlmfzouost81.jpg,2022-04-15 18:37:37,,"Goats
Whoaaa this is such a golden shot!
godspeed my man
Hopefully both of them aren’t retiring
I know Hug, who’s the other one?
Paul!!!!
Hey! That's my neighbor
mario kart double dash be like:
😔🫡🫡🫡🫡🫡
o7 Gonna miss you Hilfinger.
New lock screen background 🥲
But why is this spoiler tagged?
paul hilfinger himself
Damn, I instantly recognized Hilfinger and was about to ask who the guy in the cart was, but then I saw this comment and realized I’m the boomer now.
Bc Hilfinger’s retiring at the end of the sem
That doesn't answer the question.
Yes it does.
LMAO"
Any fun facts about professor Hilfinger?,https://www.reddit.com/r/berkeley/comments/r4lhy2/any_fun_facts_about_professor_hilfinger/,2021-11-28 18:49:40,I am truly curious and would like to learn more about the legend himself before my semester with him ends :),"From [quora.](https://www.quora.com/University-of-California-Berkeley-What-are-some-instances-of-Paul-Hilfingers-notoriety?share=1)

>At the very end of the last day of class, Hilfinger asked us if we had any questions. One student asked what he did in his spare time. He chuckled and said, ""well if you walk by my house at night you might here some whips and screaming.""
He was very proud of getting this review on his evaluation from a student: ""After my ass stopped bleeding, I realized I had learned something"".

Obviously today he can't publicly praise such a review.
He sings in a [choir](https://choranova.org)
he used to coach the berkeley team for some international cs competititon
https://imgur.com/gallery/5e5WV

Groves High, Birmingham MI, class of 1969.
Don't know any but if they are they're in scope for the exam
Set the wayback machine for 1990, when Soda Hall was just a decommissioned atomic power plant, there were more women in the computer science program than there are today, and most students didn’t have computers at home, certainly not computers running Unix. 

So everyone did their project assignments in on-campus labs, mostly in Evans 260 or basement. The night before a big project was due for 60C (data structures and algorithms), Hilfinger walked through the lab saying “Look at them all! My children, all suffering!”

One student had the temerity to ask him for help with something - not understanding the assignment, but understanding what a compiler error message meant. Honest to god, Hilfinger sat down at the keyboard and helped that student fix his code.

You could also find him in his office at all hours - weekends, late at night, etc - and he’d be happy to help you then, too.
I once dropped a massive F-bomb in front of him between the Etch / Soda breezeway. I apologized because I internally thought “oh yikes shouldn’t swear in front of an old person like that.” He brushed it off and said “don’t do it again.”

Only later would I learn that he was Paul Hilfinger.

A story for the history books, I know.
Fun fact: there are no fun facts about Hilfinger. *Only pain*
He taught Sahai 61c
https://peal.io/soundboards/paul-hilfinger
He likes big butts and he cannot lie
I had a question in 164 about how to parse something in Bison that wasn't possible with the normal LR parser (I don't remember the exact details). He walked me through how GLR mode works (effectively forking the parser for all possible options like a tree and returning the one that satisfies the grammar). He then casually dropped the bomb that he actually programmed it himself...

Also it's fun to go through the extra credit problems: https://people.eecs.berkeley.edu/~hilfingr/collected-problems.pdf
Picture from the lab in Cory Hall (340 Cory?) where we did lab work for CS 164 with Paul Hilfinger in Fall 1988.  That class taught me (probably incorrectly) that pulling late nights in the lab or workplace was a Good Thing. 

&#x200B;

https://www.flickr.com/photos/47871268@N02/51356815280/in/album-72157719644288962/
The fuck
…in which the artistic director and accompanist are both men *also* named Paul.
Wow this is honestly so cool!
>there were more women in the computer science program than there are today

Why?
*halt*
wait is this from Sp2020? The ""Blah Blah blah"" audio clip rang way too familiar!
🗿
I had Rowe. You learned more.
Chill he’s just educating his kids
Do you like big butts?

DON'T LIE!!!"
