title,link,post_time,post_text,comments
How hard is math 110 compared to ee16b or other cs lower divs,https://www.reddit.com/r/berkeley/comments/9nhw17/how_hard_is_math_110_compared_to_ee16b_or_other/,2018-10-11 23:27:31,"So I'm a CS freshman and I'm pretty set on taking 61b and 70 next semester.  I also want to try adding either ee16b or math 110 and dropping it if it becomes too much. 

I thought math 110 would be much harder because it's an upper div class with a stricter curve, especially since my only experience with linear algebra is ee16a. But I've heard mixed opinions, with several people saying it's easier and at the very least less time-consuming than ee16b. I also did well on the lin alg component of 16a. 

Which of these would you guys recommend, if any, as a third tech? ","Math 110 is very different from lower division courses as it's your first venture into a proof based mathematics course.

In terms of upper division math classes, it's one of the easier ones. I don't know how familiar you are with proofs so that'll be a big factor
Unless you feel at least a little comfortable with abstract math and have proved something before, I would not take 110 until you've taken 70 (and know how to write a proof).  110 is totally proof based and very abstract.  It's the type of thing I suggest you try out and drop if you don't love the first bit.  
Keep in mind that Holtz, the 110 professor for next semester, is one of the more notoriously tough math professors.  I love her to death but she can be a little disorganized and she expects a lot from you.  Hard exams, very hard homeworks.  110 with her will almost definitely be significantly more difficult than 16b, but it will also be a great experience if you enjoy the theory and come in with the idea of growing your problem solving skills trememdously.  If your incentive is ""which class is easiest for me to get an A,"" then 110 with Holtz is really not something I'd recommend.
You should consider searching the EECS 101 Piazza for what the community has suggested in the past.
Why not take 54?
110 is very abstract. You need to be able to write proofs
Ignoring difficulties of particular instructors, there are two main deciding factors that make math 110 easy or hard for someone: Comfort with proofs and abstract math, and amount of linear algebra intuition. ee16a scratches the surface for these these things, but is not even close to being sufficient. I would recommend taking 110 only after you have finished cs 70 and ee 16b. Math 54 is a waste of time which only makes sense if you learn nothing after taking ee16b"
Linear Algebra at CC credits will transfer over? Math 54 for EECS?,https://www.reddit.com/r/berkeley/comments/8clhh4/linear_algebra_at_cc_credits_will_transfer_over/,2018-04-15 23:15:38,"I am an incoming EECS freshmen and am currently taking a Linear Algebra course at my community college. I found that Math 54 at Berkeley is Linear Algebra AND Differential Equations (which I am not taking). On Assist.org, it says linear algebra credits at my CC transfer over, but since Math 54 is lin Alg and Diff eq what exactly does that mean? 

Is it worth to try to also take Diff eq over summer so I can skip Math 54? Does taking only linear algebra help anything because the schedule of my class right now has a little interference with some of my other activities? How important is Math 54 for an EECS major.

Thank you for your help. ","[deleted]
As others said CS and EECS majors shouldn't take Math 54 since linear algebra in EE16A + EE16B is a superset of linear algebra in Math 54. You can take Math 110 or CS 189 if you wanna learn more linear algebra.
[deleted]
Hahah lol thanks dude!
Actually, this is not true. assist.org lists Math 54 as a major required course for CCC transfers; meaning if you don't take it *you'll be flagged for instant rejection.* It will save you time as well, as Berkeley does allow people who have taken 54 + a circuits course to skip out of EE16A (albeit unofficially).

op, if it says ONLY your linear algebra class transfers over to 54 specifically, you're fine. Otherwise, it would not articulate in the first place.

Differential equations is covered in EE 16B, so don't worry about that.
thank you for clarifying!
Well, it depends on assist, which is poorly maintained. 

For example, West Valley College has a C++ course that fully articulates with 61B - even without teaching any 61B concepts. It's not even a data structures course.

If the assist course says linear algebra is all that's needed to waive 54, then you don't need to take diff eq. 

Specifically for EECS though, linear algebra + circuits (any course in CC) can unofficially waive you out of EE 16A.
ok, thank you so much for sharing!
[deleted]
ok I see. THANKS for taking the time to explain these courses, it's very overwhelming at first.
In that case, ignore everything I said.
yeah, imma be a freshman, but thanks for taking the time to reply!"
Data 140 + Data 100,https://www.reddit.com/r/berkeley/comments/106t132/data_140_data_100/,2023-01-08 12:16:29,"For context, I have no prior stats experience other than Data 8. Is this the right move or death? should I replace it with some other class?","This is generally an awful idea. Unless you know yourself and know you’re insanely good at learning things, you really should get all the precursor classes to 140 done before you try it. 

140 is hard enough already no need to do challenge mode. On the other hand 100 is generally not that and as far as techs are concerned, so you can feel free to replace 140 with just a not super duper hard class and be fine
140 is TOUGH, for real. I took 140 last Fall with Data8, AP Stats, CS 61A, and Math 54 in my mind, but it still almost ruined my work-life balance. The pace is so fast and some of the content is complicated and obscure that you really need to spend a huge bunch of time outside the class to catch up. If you would like a more gentle DS-focused Stats class alongside Data 100, try Data C88S (the former Stat 88)
I finished CS70 and got a pretty good grade in it before Data 140 and I took Data 140 as my only tech in the semester. It was still very difficult and was probably the hardest class I’ve taken at Cal other than CS162. I’d recommend not taking data 140 without more rigorous math and stats experience or it may be a struggle to do much more than barely pass the course with a lot of effort. I don’t mean to scare you just giving my personal experience.

I took data 100 a few years back and it really wasn’t bad. Heard rumors it’s gotten harder so might want to ask about that one first.
personally i think this is ok. Data 100 isnt nothing but its a consistent predictable workload. Data 140 is tough as others have said. just dont throw in another time consuming tech and i think youre ok.
I have all the precursors (lin alg, calc, data 8), I am only missing data 100 which is not a hard prereq. And data 100 and data 140 are my only tech classes."
Are we called Golden Bears?,https://www.reddit.com/r/berkeley/comments/s2kp4x/are_we_called_golden_bears/,2022-01-12 15:49:57,UCLA students are Bruins and USC students are Trojans? What are we?,"gob ears
[deleted]
Go(lden) bears
Yea. Think Golden Bear Orientation.
See the bear on the CA flag?
Go bears
OSKI looks like a retard.
GOB EARS
I laughed at this way too long
Gob Lins?
Bruin means “brown” in Dutch
[deleted]
So we are golden bears
That's a grizzly bear....
so brave yet oh so controversial
Gom Jabbar
Fun fact: the bear on the CA State flag was a real bear named Monarch and his skeleton is in VLSB
California grizzly bear (Ursus arctos californicus) , now extinct, inspired the golden bear mascot. https://theleaflet.org/home-1/grizzly-bears"
"Cal Men's Basketball loses its twelfth straight game, the worst losing streak in program history.",http://www.espn.com/mens-college-basketball/game?gameId=401087071,2019-02-09 16:44:28,,"Someone just fucking take me out back and Old Yeller me already. 
At this point we might as well find the best IM basketball players in the RSF and field them instead.
Letting normal students play really drives home how far Cal Sports is going with this ""The Bench"" branding.
trust the process
If we have to sacrifice a few Cal basketball seasons to get a Big Game victory, so be it. 
Longest streak of quality losses? 
I'm just wondering when they are gonna let that one Asian dude on the team play
How did we go from having Jalen Brown and going undefeated at home for an entire season to this?
Please just hire Jason Kidd as hc.  His name alone will land better recruits.  It’s a talent problem for the most part.
Why is the program so bad this year? You’d think Cal would have a sick squad. Hell, it absolutely should. 

Think about it... it’s cool to play basketball in the Bay Area. The best team on the PLANET (aka the warriors) play around the corner. Silicon Valley and tech money is everywhere, Cali is beautiful with good weather, and UC Berkeley just so happens to be the greatest public school in all the land.

And we are on a 12 game LOSING streak? Wtf is that!?
F
Maybe twenty years ago there would have been a protest by the student body over Jones remaining as coach.
Doing it the CalTech way!
Down to spend my week in the RSF scouting top IM talent if that’s what it takes
I've been saying that for the past year. If you took out Sueing from the Cal side, the best of IM's and RSF pickup games would give them a serious run for their money. 
I feel as though ""The Bench"" sounds so demoralizing. Like we have a student group that are all bonafide bench warmers cheering? Doesn't really elicit confidence from my perspective
might as well keep tanking so we can get a high lottery pick during the draft
He’s the next Jeremy Lin
Our coach is ass, my guy
And if all else fails, he can throw drinks on the court and make a scene. It won’t help us win, but it’ll be entertaining.
Man UCLA gets to be in tight with the Lakers (players come over to play in their practice facilities/gym, meet the college players etc) and we get none of that smh. But then again we don't have Lonzo Ball/Westbrook etc type players either (not since Jason Kidd at least) lmao
Because our head coach is terrible and constantly shits on his athletes. Some have even left the team over how terribly he's run the team. And the athletic director, rather than hire a decent coach, just paid the second in line and told him to take over. Can't believe Cuonzo was bad, this guy really takes the damn cake. I don't regret not buying a student pass to games
tfw coulda played scholarship money basketball for caltech (while drowning academically lmao)
You guys are idiots. I played with a Cal baseball player once at the RSF and he just absolutely ran circles around everyone else on the court. Any Cal basketball player would be 10x better. 

Now if you take a random fan and put him in the coach’s chair...
UCLA is located close to where many superstars have summer homes.. plus UCLA spends a ton of money on their sports/facilities including the brand new $35 million Mo Ostin Basketball Center. 

Meanwhile here at Cal people lose their shit when we rent hotel rooms for players.
Jaylen Brown"
Econ 141,https://www.reddit.com/r/berkeley/comments/z6fs6u/econ_141/,2022-11-27 15:09:55,"Does Econ 141 enforce the prerequisites? 

(in general, but also Jansson in particular?)",It doesn't but you really should have a solid lin alg and stats background before taking the class. I took it without the necessary background and managed but it was really rough
do i ever take math 53,https://www.reddit.com/r/berkeley/comments/bb0no2/do_i_ever_take_math_53/,2019-04-08 16:20:54,"im gonna be a freshman in l&s (intended cs) and was wondering if i would ever need to take math 53 (multi var calc). it isn't a lower div req for cs, but isnt it kinda important? i can clear the 1A/1B with AP credits. should i go straight to 54, or would 53 be good to have for future courses or smth?","Multi variable calc has some application is deep learning so that might be something to consider. You don't need to take it before linear algebra or discrete math at all tho.
you dont need to take it, but its highly reccomended if you want to focus your degree in machine learning (i.e you have an interest in doing well in classes like CS189, EECS 126, EECS 127, etc etc.). If you want to be a software engineer, it might not be worth your time/effort. Keep in mind that Math 53 doesnt have anything to do with linear algebra or discrete mathematics, so it doesn't matter if you take it before or after classes like CS70 and EE16A/Math 54/CS70. 

Also, don't take Math 54. The recommended linear algebra track for CS/EECS majors, according to EECS faculty, is EE16A + EE16B. EE16B is required for the major anyways so you're doing yourself a disservice by taking 54 instead of 16A.
The stuff on multiple integrals can be helpful for probability and optimization/gradients is useful in machine learning.

Most of the things in the latter half are irrelevant to CS(line integrals, green's theorem, stokes' theorem, vector calculus in general...) and in my opinion not at all interesting.

If you plan to stay completely on the software side, you can probably avoid 53. If you go into more theoretical/math-based CS, you should probably take it at some point.
I would argue that it's better taking both if you can. As someone who skipped EE16A with 54 and went straight to EE16B, I am keeping up with the lin alg/diff eq parts of the course a lot easier than someone of my peers who just had 16A lin alg experience. However, it took some time getting used to the quirks of the course (long psets, labs, sahai, etc.) that my 16A peers was just fine with right away. So yeah take both if you can. (PS: If you decide to skip 16A, make sure you self-study the circuits material well! You're expected to pretty much have everything down when you walk into the class, because well they expect everyone to have taken 16A)
\>implying multivariable calculus has nothing to do with linear algebra"
Need to Find a Linear Algebra Class for Fall 2022,https://www.reddit.com/r/berkeley/comments/wn7wak/need_to_find_a_linear_algebra_class_for_fall_2022/,2022-08-12 23:54:32,"Hi, so I want to take a linear algebra class at a CC soon so I could take it for this fall semester. I want it to be asynchronous. Does anyone know of a CC that has linear algebra asynchronous this fall semester? WVC has it but there is a waitlist rn.","[online classes that articulate to Math 54 for Fall](https://search.cvc.edu/search?filter%5Bdisplay_home_school%5D=false&filter%5Bsearch_all_universities%5D=false&filter%5Buniversity_id%5D=17&filter%5Bsearch_type%5D=course&filter%5Bquery%5D=course-258498&commit=Find+Classes)

As the other poster posted, to articulate to Math 54, most CCs split out the classes into Differential Equations and Linear Algebra.  What’s in the link are classes that fully articulate with just the one class, ir it has both Diff Equations and Lin Alg.
Laney College has one open that is asynchronous. The course code is 41518. Search it on https://sa.peralta.edu/psc/PCCDCPRD/EMPLOYEE/SA/c/SSR_STUDENT_FL.SSR_CLSRCH_MAIN_FL.GBL

But it only teaches linear algebra, not differential equations like Berkeley’s MATH 54. So if you wanted it to transfer to Berkeley as MATH 54, you would need to take another class in addition to it

I had the professor before when I took calc 3 and he’s alright"
Sociology Majors?,https://www.reddit.com/r/berkeley/comments/or5hrk/sociology_majors/,2021-07-24 22:09:37,"Hey guys, I am a new transfer student (F22) and I am a sociology major. Just wanted to know if anyone had any advice on what are good classes to take, preferred professors or good opportunities on campus? I'm opening this to anyone too, not just sociology majors! Any tips for transferring to Berkeley would be great I'm moving to an apartment that is a10 min walk to campus next week!","Try and take your theory classes junior year; it’ll open you up for more opportunities in your senior year. I’m also a soc transfer student and was told not to take them junior year, and now my senior year is going to be really rigorous because I’m doing the honors program and theory classes at the same time. Honestly I haven’t heard of a bad soc prof here, they are all amazing so far. Take classes that will feed into your interests!! I really loved soc of Ed, political sociology, and social psyc (from the soc department). Soc of religion in the summer is also a really great class that isn’t difficult at all!
Sociology major here :) I took two really fun soc classes last semester -- soc 167 with prof. Lin and soc 111 AC with prof. Kelsey. Both great classes and professors. Definitely would recommend!
Thanks for the advice the taking theory my junior year has been a huge debate and I do want to do the honors program. Just curious did you do part one of your theory your second half of junior year and are finishing it your first half of senior year or doing it all your senior year? Also I am taking social psyc (from the soc department) in fall and I have heard so many great things!
I'm an exchange student coming to Berkeley this year and thinking of taking Sociology of Psychology this semester (with John Kaiser). I'm taking a few heavy classes so I'm wondering if I will manage the workload of social psyc? I heard that Kaiser is a really great professor and that his exams are doable, so I'm hoping for the best! If you have any insights on the class I would be really glad!
Thank you! I am actually taking soc 167 with professor Lin this summer and I love it:) I will defiantly keep a look out for soc 111 AC with professor Kelsey!
I’m taking all of my theory classes senior year :( but yea if you wanna do the honors program definitely go for theory in your first year!!!!!! I was told “don’t do soc5 and theory together” and it was total BS. If you already have a good grasp on research methods soc5 is a cakewalk (as long as you get a decent GSI), so just do it!!! When I went to the honors meeting they were like “oh you should have already done your theory classes but I guess some students have made it though doing honors and theory at the same time” but they were also the ones who said “oh don’t take theory junior year” bitches🤣🤣if you want to talk about it more dm me!!  I love to help soc majors, some of the advice profs and advisors give is not the best lmao"
16A Course,https://www.reddit.com/r/berkeley/comments/3y8sms/16a_course/,2015-12-25 18:40:49,"How much is the courseload for ee 16A compared to something like 61a/61c/70? Would it be fine to take with 186 and 160? 

Thank You","I felt that 16a was definitely more time consuming than 61a, but some of this is due to the fact I had no lin alg experience prior to taking this course. The homeworks for the class were the time sinks for me, but I did them super thoroughly. I would routinely spend 5 or more hours working through the homework with my buddies for 16a compared with breezing through cs hw in 30 minutes. The difference is that for EE, the tests are a step below the difficulty of hw, but for CS, the exams were about the same if not harder than the homework.



I just took it along with 186 and 16a was extremely easy, material-wise.  This is coming from having taken Math 54,110.  The only difficult thing really is the weekly homeworks--think kind of like 70 level so I'd say around/easier than 70.

186 is really manageable as you basically just need to do a few simple projects and have an approximate knowledge of the overall concepts.  However, the exams are rather tricky and easy to mess up on--like 61c at least for me. But shouldn't take a lot of time.

160 really depends on your group and those three courses combined seem very doable.
Much less, and yes. 
This will necessarily depend on what you already know. Have you taken Lin alg (e.g. Math 54) or circuits (e.g. Physics 7B) before? If you answered yes to both of those, you'll find 85% of the 16A content very easy, mostly review or extension of known concepts. The class is roughly 30-40% circuits and 60-70% Lin alg, so if you've only taken one of those listed courses, adjust accordingly. 

As someone who took 16a as a sophomore and therefore already knew what Berkeley level studying/understanding looked like, I found the exams to be really easy. 

The course takes up quite a bit of class time - 3 hours of lecture, 2 hours of discussion, 3 hours of lab every week. 

The big time sink is the homeworks. However, I found them to almost all be considerably shorter than the cs70 (vazirani) homeworks. There is homework every week, it will on average take 3-8 hours to complete to a point I would call satisfactory. 

Tldr it will take up a good amount of your time but is not too bad. I found 61c to be far more trying than 16a, although part of that was likely that 16a distributed the workload better. 

Disclaimer: I took 16a with Sahai. However, iirc Elad Alon is reprising his role as 16a professor. His 16a, from what I've heard, was far more difficult, but that could also be because he taught the course the first time it was offered, as a pilot course to ~50 students. So he may be easier now. "
Is this schedule manageable? I will be a sophomore intending CogSci and Media Studies and will be my first time taking upper divs,https://i.redd.it/4xhy4un4khwa1.jpg,2023-04-27 08:21:38,,"Definitely manageable! You might just feel tired though on Tuesdays having an 8am and the last class being at 5pm (that's just me though). 

I will say, SOCIOL 167 is by far my fav class I've taken at Cal with Professor Edwin Lin! An incredible professor and I'm sure you'll enjoy his class, if you decide to attend the lectures LOL
Edwin Lin is a good and easy prof 👍🏼👍🏼👍🏼
Second all the comments about Edwin Lin! He’s amazing"
