title,link,post_time,post_text,comments
Congrats to AEW's new Women's Champion Thunder Rosa (a.k.a. Melissa Cervantes UC Berkeley Sociology c/o 2010),https://v.redd.it/m2py8ooowvn81,2022-03-16 23:03:33,,"did not expect this but go bears
AMAZING!!
wtf
They must have removed this lesson from the sociology curriculum.
Doing great things for ucb
Amazing. Love this. Go bears!
hahahahah go bears baby!!
AEWxUCB is the collab I definitely needed, but never realized I wanted. Until now.
That's awesome, I really wish AEW had shows on the west coast. Probably should go check out APW or some other indies here in the mean time
What a joke.
Thumbtacks? Are thumbtacks back?
Now that’s how you finesse a degree from Cal
It’s graduate level work. “Dealing with difficult cases - lab Soc 241Bl
GET THE TABLES
cages*
I stand corrected."
More BerkeleyBots,https://i.redd.it/gbf2trsuhema1.jpg,2023-03-07 10:22:11,,"The history of these terrible bots is slowly being forgotten. Great go to market strategy tbh but I'd never use these.
Aren’t these driven by low wage workers in third world countries?
Just what I want, cold food at even slower speeds.
saw those today and lowkey they feel like tripping hazards 💀💀 Those flags should be made more visible and the bots themselves need to be painted in a color that’s more reflective than their current look
The k on them stands for karma because karma whores love posting them
I am just a bit curious about this question: With all those crimes going around Berkeley, those Kiwibots could be easily stolen right????
At least they’re working, not just posting on reddit like they usually do!
I found them pretty cute, didn't wanna mess up the system by blocking it. Really wanna see how robust this by doing that
How do we order from them
Hello, I am a reporter for The Daily Californian writing a feature on the return of the KiwiBots. If there is anyone interested and available to talk about them, please feel free to message me at any time. My deadline is at 4 pm today. Thank you!
WTF?
Oh wow Kiwibot but rebranded?
I'm actually pleasantly surprised how many people keep pointing it out. I feel like the last time these were here a lot of people didn't know and many kind of didn't want to think about it if you told them.
Yes-- they are piloted by Colombian-based operators who get paid [$2/hr.](https://www.dailycal.org/2019/10/15/kiwi-hires-colombian-students-to-supervise-kiwibots)
Yes, it’s also run by a business based in that low wage country…
Brighter than orange with a light? The end of the flag is a light
through everyday app or grubhub according to the kiwibot site.
No idea, I want to know though
Half the robot is painted black and it blends in with the road color"
America's Top College,https://www.reddit.com/r/berkeley/comments/pkonaq/americas_top_college/,2021-09-08 19:20:17,✋✋✋✋HOLD UP✋✋HOLD✋✋✋UP👀DID I JUST READ👀👀👀 U C 🎓🎓B E R K E L E Y🏫🏫NUMBER ONE🏆🏆🏆🏆💯💯💯💯PUBLIC UNIVERSITY📚📚📖🔖 EVER??? 😲😲😲 IN EXISTENCE????🔥🤯💥🤯💥WE STAY 😤😤 ON TOP👌💯🥊🐻🐻🐻🐻 GO 🥊 BEARS 🐻🐻🐻 SIT DOWN ⬇💺🔴STANFORD🔴🌲🌲🌲🔫🔥🌲 MOVE OVER 🔵🟡UCLA 💣🏫🏥💣 MIGHT AS WELL GIVE UP 👎👎👎 CAUSE WE HAVE OSKI 🐻🟨👖THE TALLEST 🕰😲😲😲 TOWER 🏛 EVER MADE 🤯🤯🤯🔥🤯🔥 AND VERY 🩹 RELIABLE WIFI 📶📶 👏🤑👏👏👏👏💯💯💯😤😤,"Any rankings are horseshit unless berkeley numero uno.

Then it's science based rating.
so disappointed top didn't come with eggplant emoji
BERKELEY BEST WW 🙏🙏😤😤
heck yessss!
🐻💙💛4ever!
Amen. Don’t forget we also have the best homeless encampments. Number 1 school for access to their public bathrooms.
this mistake will force berkeley to #2"
Sproul Piano 😢,https://i.imgur.com/3RVCuzO.jpg,2023-05-31 12:46:16,,"Why? Why would someone have done this? Heartless
This is at least piano #4. I'm not surprised at all. It tends to happen over summer or winter.

No, mankind cannot have nice things. 

Give it a few weeks, someone will add a new piano.
Why can’t the world have nice things? 😵‍💫
Mann whoever did this can suck their mums I swear. Loved hearing ppl play on this piano after a hard finals ![gif](emote|free_emotes_pack|sob)
shame
Least vandalized Berkeley public property
It's wild how there are always a few people out there who just want to destroy stuff for no reason. They make having a truly free society impossible.
Damn, that's frustrating
I'm over fucking People's Park. Somebody needs to get those people the help they deserve as human beings because right now students fear for their lives going back and forth to class. I grew up around Berkeley and People's Park is just not what it once was. It is full of violent people with mental health problems who need help!!! I hate that people are still clinging onto this old idea of a hippie park where peaceful protests would happen/people would gather. That shit doesn't happen anymore! Now people just get assaulted! Wake up fr get these people into treatment centers and build housing there. I'm SO over it.
Man. I liked hearing that when walking through Sproul.

Whoever did this is a genuine asshole.
Sad :(
![gif](giphy|fGOjgWRzQkC2sHHnq7)
Dang this is what Fox News always complain about us for
Pave People’s Park
☹️☹️☹️
Canadians leaving their mark!
That hand has an extra finger.
AH YES FINALLY A PIANO I CAN PLAY
chaos.
From counterculture to crackhead.
Sorry but this took some time to vandalise, what was security/UCPD doing? You also got to think that there was CCTV covering this and it is not as if UCPD had to go far....
Have that same cup
This has happened basically every year for the last 5 years. It always sucks. Freecycle and Trashnothing may have some pianos available if someone can transport one.  


Side note: Why are y'all making this a People's Park issue?
Kudos to those of you who actually think someone from peoples Park did this.
This is reality lol
Let’s be real here.  I love playing that piano at night or between classes, and last time I went to play it it looked good to go but was functionally useless, probably due to people playing it like a damn drum set.  A piano out in the public will lose a key here or there but it was already basically useless with whole octaves no longer functioning by finals week, while looking like maybe one or two keys would probably not work.  That it looks like this now is just a visualization of its already existing subsurface uselessness.  It’s ultimately good that this broken piano is visibly useless so the people who graciously take it upon themselves to install pianos on Sproul are more likely to know that it needs replacing.
So sad!! That piano has been there and enjoyed by all for several years. 😢😔
This is sad
At UCSB, by Sands Beach, someone put a piano. I played it several times, was so lovely. Within two weeks it’s keyboard looked like this. 

I figured it wouldn’t last long, being in the weather and all. But somebody just decided to destroy it.
what brand is it anyone?
A couple of the local meth heads got bored.
I hope so! 😢
Well, you can, just not there..
They’re likely mentally unwell. They need social services.
Same kids who ripped up erasers for no reason in class
they hate to hear it
Build us another basketball court and community garden open 24/7 to the public in the same neighborhood then. 🤷🏽‍♂️
We literally had a whole series of concerts these last year but pop off sis you know best. You know folks from the neighborhood use the park tho right?
Build housing on it
Pave peoples park!!
what does that have to do with the piano
so brave 👏
It’ll be back. We’re on like the 5th piano now. He gets destroyed every final season, TBH.
just not in the most educated and socially conscious city in the world
Which Reagan and the GOP took away over 40 years ago and no one has ever restored.
Y’all are like vegans. That’s all we hear from the vocal anti-park minority.
Ur delusional 😂
For what? Shooting up?
does it really need to be said? most of us are capable of putting 2 and 2 together lol.
Peoples Park activists brought the second piano to campus 🤷🏽‍♂️
Great example of the Paradox of Tolerance in action. We are so tolerant and socially conscious that we welcome people who are hopelessly antisocial and intolerant...and now we’re paying the price.
And humble too
You forgot to say that they revere the arts as well but that’s cool. I guess in a sense this lowly piano is art too and says something as well when your statement is taken into context.
How does lived experience make me delusional. Don’t you think the ones sucking UC’s Oski, brown nosing the blue and gold and not having actual experience are the delusional ones 😮‍💨
Dude your dorm mates probably snort adderall and your frats are assaulting people nonstop. Students are just as fucked up if not worse cause you know better and can do better but you just complain on Reddit. Like… get off the high horse already.
the piano has old paint on it mentioning peoples park so the implication is that it’s peoples parks fault that the piano is missing some keys?
I like that. In my own personal experience I’ve found that absolute tolerance has led to enabling and disastrous choices for some friends of mine who dropped me because I would draw a line for what I believed was their own personal well-being. I’m not sure where that line is in society and honestly I’m glad Berkeley exists as it does to show us whatever it is we want to take away from it. To me, no place is perfect of course, but some do certainly have issues that aren’t as prevalent in other areas. It’s always a give and take though and one has to find the place they enjoy in my book.
Thanks for the ad hominem. I'm actually a woman and don't live in the dorms. If students are just as bad as the people in People's Park, maybe you should try your luck staying there? If it's just as safe as a dorm? Let me know how it goes!
lol there's no point in arguing with someone so blatantly blind to the truth. I think we all know that there's a pretty high chance that whoever vandalized the piano was a mentally-ill and/or drug addicted individual that places like peoples park attract from all over.
What is your major so I can judge you.
What is your major so I can judge you.
Compassion is nice but too much turns into enablement
I’m literally always there. And the fact you think “shooting up” is anything except pain relief is shameful. Please if you don’t like it you shouldn’t be at Berkeley. You are suppose to have a good education to get in. That means BASIC understanding of social issues including drug addiction. Students like you are bad and lack empathy. Still makes you a frat bro cause you’re no different.
Usually it’s people who are angry about finals. Not everyone at People’s Park are ill. Folks from People’s Park always play on that piano hence the graffiti 🙄
how do we know that a mentally ill person who lives in peoples park vandalized the piano? what is this based off of? vibes? how do you know random hooligans didn’t do it?
You are totally delusional if you think the perpetrator was a UC Berkeley student"
UC Berkeley finally removed their trash from peoples park! Power to the people! ✊,https://i.redd.it/rkivpf2xmcba1.jpg,2023-01-10 16:21:31,,"Fuck that. Pave people’s park!
They’ll be back. Pave people’s park. Pave it. Pave it. Pave it.
If you support people’s park i better see you lighting up a pipe there next time I walk by it
Move all student protestors into people's park tents. Sign me up! STOP THE RAID! STUDENT AMBASSADORS BY 2024!!!!
You fell for the propaganda when common sense is right in front of you
lol lets just hope that the uc continues to remove their trash including the trashy park
will you volunteer to help me safely cross around peoples park at night so that i can avoid being assaulted, you’ll need to be available monday-friday around 9pm! thank you for your sacrifice 🙌
L + ratio
🍿
Hey OP fuck you and fuck peoples park. Power to UC berkeley to pave that disgusting homeless encampment. Build that student housing for members of our society that are actually positively benefiting it in some way.
people's park ☕️
I think it’s funny how people think of the homeless in Berkeley as though they are Native Americans, and People’s Park is like “their land.” Even UCB feels morally obligated to build affordable housing units in place of People’s Park as some kind of weird parasocial reconciliation with the homeless who once lived there. I say, “fuck that,” just pave the fuckin park, make a bunch of regular-priced housing cuz they own the damn land and can do whatever the fuck they want with it. Then, do something that actually matters to bring down rent costs for all UCB students such that all housing becomes affordable, not just the small
subsection built over People’s Park.
They cleaned out all the homeless?
[deleted]
Maybe they will get to use tear gas now
A huge failure to all the students here.
That looks like Webcor's valuable construction equipment, just checked and the vagrants are still there.
Power to an extremist criminal tiny minority that cares more about being an “activist” than actually solving the homeless and housing crisis in Berkeley.
[deleted]
What was wrong with the telehandlers that they could not be driven?
Human beings are not trash.
Amazing
The park is a great green space with historical value but often times its not a park I would consider utilizing for anything that a park is generally used for. Its obvious the unhoused need a place to stay but the park is not the answer. I thought the construction was going to include low income apartments for individuals. Now they will go back to sleeping in their tents? What about the crime and other activity that is often associated with that park? I know at times its a great place to find drugs, that's not something I believe in protecting. The custodians at the UC cant even service the restrooms at the park due to safety concerns. If the park remains an open green area where typical park activates occur then I support it, but if it returns into another encampment for individuals who have often refused legitimate housing and/or services for addiction or mental health issues then I cant support that place. Guarantee we will get an advisory text stating some sort of crime was committed in or around that park shortly after it reopens and individuals occupy it again. I am not against them, I just know the trends.
SQUATTERS RIGHTS ARE STILL A THING.... THAT STILL APPLIES TO PEOPLES PARK. FUCK UC BERKELEY AND FUCK ALL YOU HATEFUL AND DISGUSTING STUDENTS ... YOU WERE QUICK TO HAND OUT TENTS... FREE METH PIPES AND NEEDLES WHICH U BOUGHT WITH CAL STUDENT AID...U HANDED OUT SHITTY VEGAN MEALS ...AND WATCHED THE HOMELESS SLOWLY DIE...U DESTROYED THE PARK AND KILLED WILDLIFE ON TOP OF TAKING PEOPLE FROM THEIR HOMES. FUCK YOU UC BERKELEY.... U ARE THE ULTIMATE ANTI CHRISTS. .. I HOPE U ENJOY LAUGHING AND SPITTING AT THE HOMELESS... HEARTLESS AND GODLESS DESPICABLE HUMAN BEINGS. FUCK YOU PEOPLE. YOU WERE NOT RAISED RIGHT.
How do you feel now lol
Cry never gonna happen haha
Not happening
I support human rights
You don’t even go here anymore go cry
You don’t even go here go cry
Not gonna happen us protestors here to fight back
That’s too early I would walk around midnight unharmed yall just a bunch of sussies
Thanks for supporting
Never gonna happen
I love it
Price will never be affordable
Nope they thriving there
Don’t keep your hopes up
Not happening lol
Students can go cry
The people will never leave
There’s nothing the city of Berkeley wants to do
Nah yall mad 🤣
They were completely destroyed by protestors
They are not
Yup so happy ucb removed their disgusting trash off the beautiful land
These people need to find a stable life first
You’re delusional bud, pave it on god
No you don’t. You care about being an “activist” instead of creating desperately needed housing.
Probably spent more time in Berkeley than you have in your whole life though lmao
And let me guess “us protestors” are the ones who also carry pepper sprays while walking by the park at 2am in the morning. Keep in mind UC Berkeley is a university, NOT a homeless encampment shelter service whatsoever. The “homeless encampment in disguised of a park” is owned by the UC and their job is to prioritize safety for the students by shutting that crime-infested place down.
nice so ur down to walk us all home, however i dont think the person who got assaulted via toilet seat last semester needs ur assistance first😍
Because you keep blocking any developments. Way to be a tool of the Berkeley oldsters that are actually deeply conservative
By thriving you mean trespassing private property (the park is owned by the UC regents SO NO IT IS NOT PUBLIC, so is the entire Berkeley campus fyi), infesting it with crime and needles, harassing students and making it a heaven for drug dealers?
you mean like permanent housing for 100 homeless people?

[https://peoplesparkhousing.berkeley.edu/supportive-housing](https://peoplesparkhousing.berkeley.edu/supportive-housing)

your protests have had a measurably negative impact on the lives of so many people and no positive impact except for your own sense of self.
By protestors you mean rioters and criminals. I hope you people get arrested and expelled from school.
[deleted]
Nobody except people who smoke crack would ever call this crime-infested homeless encampment beautiful lol
So your think it’s more stable for the homeless to live in tents rather than supportive housing?
Y’all delusional thinking it will be paved 🤣
Everyone needs activism
Nope uc doesnt care about the students, another year with the park’🎉
Not walking anyone home 🤣y’all old enough to walk home by yourself scaredy cats
There’s other places they can build on silly
Nope they are the residents of the park and deserve to be on that land
can someone explain this to me? i recently stumbled on this story, knowing nothing of california or UC Berkeley but i've been reading obsessively because i feel completely at a loss to understand whats going on here. The housing crisis in the California colleges was pretty shocking to me (everything I learned about california was shocking to me actually, really always thought people were exaggerating but man the state is a disaster!), and while I understand the initial concern about not wanting to proceed with development without securing a plan for what it'll mean for the people living there, once berkeley offered supportive housing, I really cannot possibly understand what the opposition is here. 

I understand that most of the people involved in the protests are students, but I used to work in social services in a city much bigger than berkeley, and not a day went by that I didn't meet with someone dreaming of a program just like this. There are so few programs that offer this kind of stability and support, that I'm curious if people don't really understand the gravity of what 100 spaces can really do. It's truly nothing to scoff at or dismiss and I understand it's not enough, but something like this will be changing lives for decades to come. Many of the programs like this we relied on were from the 70s and typically had 15-40 spaces at most, housing resources for the homeless, no matter how small, and particularly something like this which is regarded as a gold standard by many, always has an impact. and with 100 available spaces in a city as small as berkeley, I have to say as far as PR strategy concessions go, this offers long term impact in a way that impressed me. I get the sense that the housing situation in california is far more difficult and on tenderhooks than it is where I was (I can't seem to gauge if there are any real adults involved in the homeless outreach of this student movement, or any organized professional assistance or advocacy) but i guess I just feel like if the goal is to advocate for the homeless population, mission accomplished. this matters. 

if thats not the goal though, and its all about preserving the historical legacy of the park then thats fine I'll just never understand it i guess
Never gonna happen go cry
We dismantled all fences and destroyed equipment we are powerful
Drugs aren’t bad
not when it's anti-democratic. you're a vocal minority suppressing the will of the general public with the effect of harming a lot of people.
Weak argument
the university doesn't care about me and i dont care about the university. i also dont care about the mentally insane rapists who live in the park either. I dont care about the residence of berkeley.  I dont care about the protestors also. all i care about is myself and i want more student housing so i dont have to pay nearly as much in rent. how do you fix a housing problem? build more houses. FUCK THE PARK
ya bc statistically all the violent crimes in berkeley happened to children right, as if adults aren’t the one’s getting assaulted?
that's what they say about every proposed development.

that's literally what NIMBY means.
Nope honey. It is a privately owned land so no they are neither ReSiDeNtS of the park nor deserve to be on that land whatsoever. The correct word that you’re looking for is unlawful SQUATTERS.
A lot of people don't understand it. Students who protested it; they don't really care about the city of Berkeley. After graduating, they'll leave the place. And I've heard countless complaints from the UCB Alumni claiming that the city being unsafe and such. I just don't understand it either.
Oh but it will. Eventually you will lose.
Yeah crackhead
Nope just facts
The rapists are your frat bros and houses can be built in other areas
Y’all can go cry all you want the park is staying ✊
Nope they will stay there forever
Hey how about this. If you are okay with homeless people occupying privately owned land, why don’t you let them use your house and your parents’ house for housing first? Central heating at your parents’ place must be nice for them i think!
lol you really are a prime example of nimbyism. if you look into housing and renting anywhere in the bay area, you'll realize that sentiment of ""just build somewhere else"" doesn't work.

""just building somewhere else"" does ""work"" in places like texas but that comes at the cost of ruinously car dependent cities not to mention the environmental impact of endlessly developing previously undeveloped places.  

want to help homeless people and help people who are making minimum wage at the same time? build more homes so the cost of living wont be nearly as high. affordable housing is a matter of fixing the supply problem which people like you perpetuate.

arguably, your ""self virtue"" hurts poor people more than it helps. seriously, im not trying to be mean or anything, i seriously cant understand why  someone would not support the development of the park. why do you not support developing the parK?
Denying the eventual reality will not make it go away, but why would I be suprised that your are delusional.
The park will stay for another year, go worry about something else
And continue to be an eyesore and safety hazard yes unfortunately
Nothing y’all homeless haters can do about it
Why the fuck would you want support  the continuation of a dump/safety hazard to the community like that anyway? Do you think its good for the community to have homeless filthy drug addicted criminals living in our parks on our sidewalks etc you're literally brainless if you think this is a positive thing."
Cafe 3 Rant,https://www.reddit.com/r/berkeley/comments/xeb6hw/cafe_3_rant/,2022-09-14 12:40:22,"I’m sure those of us who frequent Cafe 3 have heard some variation of the following phrase repeated ad nauseam: “Just go to the other line; it’s shorter and it has the same thing!”

So then what compels students to stay in the first line??!! Is it because they are dumb?!?! Incapable of seeing that the other line is shorter?!!! Or do they genuinely enjoy waiting in line longer?!?!?!(“Hehe look at me! I’m waiting in line; so kewl!!!🤓🤓🤓🤪🤪🤪” *posts it to TikTok*)


NO!!!! NO!!!! NO!!!!🤬🤬🥶🤯 It is BECAUSE…BECAUSE….BECAUSE the first line gives students ACCESS 😩😤 to the ESSENCE of all life and humanity’s MAGNUM OPUS 🥸🤩👀, PIZZZZZAAAA!!!! 😧😧😧 LIFE-SUSTAINING PIZZA🥶 THAT STUDENTS🤓🤓🤓 WOULD BE DEPRIVED OF SHOULD THEU CHOOSE TO WAIT IN THE SECOND LINE 💔😔😔💔🤬

PIZZA😧PIZZA😧PIZZA😧

WHAT WOUDL WE DO WITJOIT IT?!?!?!

The Krusty Krab PIZZA🥶 is the PIZZA🥶 for you and me


The Krusty Krab PIZZA🥶 is the PIZZA🥶 free

de-li-ver-yyyyyy 🤩🤯


The Krusty Krab PIZZA🥶 is the PIZZA🥶, VERY TA-STYYYYYY 😎😎🥹🥰

THE KRUSTY KRAB PIZZA🤬🤬🤬. IS THE PIZZA🤬🤬🤬. FOR YOU AND MEEEEEE🤬🤬🤬🤬.

Not “tHe kRUstY KrAb pIzzA is ThE piZzA FoR StUDENTs wHo cHoOsE To cOnTiNUE WaiTing In tHe FIrSt LInE DEspIte PREsSuRE NOt tOoOoOo”

Checkm8 librels 🤬🤬😎😎","And this is only the third week of classes...
what 👁👄👁
Wtf is happening
[deleted]
Damn Cafe 3 didn't even have pizza last year, I got scammed fr
![gif](giphy|3og0IwkzpPcS28h572)
People who went to high school during covid.  Brains are underdeveloped bc of lack of social stimulation during formative years of life."
