title,link,post_time,post_text,comments
Is this schedule suicide,https://www.reddit.com/r/berkeley/comments/fxysz3/is_this_schedule_suicide/,2020-04-09 12:23:23,"Econ 119 (I took Acland for 100A and I really liked him), Econ 136 (I already know roughly half of the material for this course, i.e. derivatives, time value of money, bonds, etc), Econ C181 (apparently not a big time sink), and Stat 135 (this class is going to murder me). 

Can anyone comment on these classes? I am a double major in Stats/Econ, and have a pretty strong math background.","not familiar with econ classes at all, but relative to the CS classes I've taken stat 135 was a pretty straightforward tech. I didn't really like the class at all but it wasn't difficult imo.

otoh, Lucas's curve was pretty brutal lol. median grade was a B-, 10% failed, and the average gpa was 2.59. the final was also effectively 65% of your grade, because it was so much easier than the midterm that almost everyone clobbered.
That looks fine. Yun Song is a pretty good lecturer (had him for cs70). On the econ side of things, your schedule looks great.
For 136 you should be totally fine. If you already understand the concepts behind derivatives, fixed income, and equities then you’re way ahead of the curve. The only difficult part is understanding the math behind the many pricing and valuation derivations. Prof. Hawkins is a really good professor and is fairly clear about the material.

Idk who is teaching C181 but I had Roland-Holst and the class does take quite a bit of time. The material is extremely bland and getting the grade you want just depends on your understanding of all the math behind the models.
I took Stat 134 with Lucas and his final was wayyyyy harder than the midterm, but yeah....not a huge fan of Lucas

However, Lucas isn't teaching 135 next semester.....someone else is (professor Yun Song), and he has never taught 135 before and has questionable reviews on RMP!!!
I've heard similar things about C181, so I switched to taking Stat 155 instead, and am going to replace Econ 119 with an easy LD breadth class!

I'm low-key really excited for 136 because I've heard great things about it
I'm pretty sure yun song is a dude. He taught the probability half of cs70 the past two falls and I've heard great things about him.

(unless there are two yun songs lol.)
Took 135 with Song in Fall 2017. One of the best professors I've ever had in Berkeley, but extremely difficult. Song focuses on proofs/theory and his HW is similar to that. Lucas focuses much more on applications. Song is definitely the better professor and you'll get more out of the class, but be prepared to work.
Yeah 136 is by far my favorite class at Cal. Hawkins spent half his life on wall street so if you’re interested in all that stuff then he has a lot of interesting stories for you.
You're right! I must have been thinking of another prof 😅
that sounds so much better than Lucas's version. his class was essentially AP Stats 2.0."
Legalst 138 vs 107,https://www.reddit.com/r/berkeley/comments/158or5y/legalst_138_vs_107/,2023-07-24 15:07:43,"I’m considering adding either Legalst 138 (Supreme Court and Public Policy) or 107 (theories of Justice). The professor for 138 is Kyle Deland, who has no reviews ( I believe he’s a grad student, and this is his first solo instructor class). 107 is w/ Sarah Song.

138 looks very Interesting but I’m hesitant due to the workload I’ve heard it entails w/ memorizing cases, and since it might be a wild card because the professor is new. I know I’ll take 107 eventually since it’ll be for a core requirement, but I heard professor Song is really good and the seats are more competitive to get her courses.

I would appreciate any feedback, especially from students who’ve taken either/ both courses!

Thankssss","138 is pretty easy, no matter who the professor is. I lucked out and got a special guest professor for this course, none other than the Dean of Berkeley Law, Erwin Chemerinsky himself. It was magical. But, regardless of who teaches it, it's about the Supreme Court, so it is modern, relatable, and most importantly - your opinion counts as a correct answer. You will examine the history of the Supreme Court and the most famous/socially impactful decisions of (mostly) the 20th Century, and on exams you can argue for your opinion without worrying about a right or wrong answer. You just have to use the concepts/points of law correctly to argue for your point of view. If you're interested in pursuing law it's kind of an essential course. That being said, I have no idea who this other professor is. I haven't taken Theories of Justice so I can't speak to that.
is law school in your future? always take the class with a predictable professor. a wild card new professor might make your life hell or not, but it’s better to know what you’re getting into. a B/A- could actually be detrimental in the long run, sadly for prelaws
both suck. 138 sucks a little bit less.
How was your experience with Kyle Deland? I am considering taking 138 with him this semester but the average grade on Berkeleytime looks very low.."
How famous is Lil B/BasedGod among the student body?,https://www.reddit.com/r/berkeley/comments/mr5qeq/how_famous_is_lil_bbasedgod_among_the_student_body/,2021-04-14 19:29:37,I’m an incoming freshman and ive been a big BasedGod for a while and knowing that he’s from Berkeley and has made a song abt it id assume he’s pretty well known. Is Berkeley by Lil B a known hit? Does he ever perform on campus? Lol just tryna spark discussion,"Here’s the thing, my friend. People like you and I, i.e. those with IQs of 160+ who are studying EECS, MechE, nuclear engineering, etc., get it. We just do. Lil B is by and large the greatest musician of our lifetime. You see that. I see that. Others on this campus, however, do not. When your roommate tries to tell you how good that new Brockhampton album is, just nod and smile. They can’t help it. They just don’t know any better.
I use a Lil B video as a reading for CS 195.

[https://inst.eecs.berkeley.edu/\~cs195/fa20/index.html](https://inst.eecs.berkeley.edu/~cs195/fa20/index.html)
I have no idea what you’re taking about
If you haven't seen this before: https://www.youtube.com/watch?v=eU5PVFjsQG8

Haven't see many people talking about him here but I know a couple of people who've met him before and say he's a dope dude so there's that
i love you that made my day. u already know im studyin mechE cuz anyone outside of the CoE just wouldn’t understand how to live Based🤷🏻‍♂️
ohh my godddd i think im based god
Also I just realized Lil B is over 30 now. Time flies...
thank you based Hug
https://open.spotify.com/track/1BN1KycitcH264DYvwnP4k?si=4QDYetY1R62bsPBPE5GwoQ
Humanities major who loves BasedGod here, why compete when we can share our strengths? Based living is for all who choose it.
Sorry I understand what you’re asking I’m saying I’ve never heard of this person or the song
ig thats a good answer to the question then lol"
Interested in joining band,https://www.reddit.com/r/berkeley/comments/10q32yl/interested_in_joining_band/,2023-01-31 08:15:47,"Hi all! I love music and I love Berkeley’s strong connection with music and all artistic things alike on campus and off of. If any of you are in a small band or would like to start one, I’d love to join! Unfortunately I don’t really know how to play any instrument well but I’m a song writer and singer who is looking to expand their experience with other creators. Stay awesome!",You might check out Song Writers at Berkeley (SWAB). They meet on Wednesdays outside of Dwinelle from 6:30-8pm :)
An older student’s thoughts on college during the pandemic,https://www.reddit.com/r/berkeley/comments/jvrmfz/an_older_students_thoughts_on_college_during_the/,2020-11-17 03:44:35,"I started my degree at Cal in 1992 and was recently class of 2020. I didn’t make close friends until I studied abroad at Osaka University in 1994. I took a leave of absence in 1995 after the Great Hanshin Earthquake to help a friend whose family business was affected by the earthquake. Business was already hard for them before the earthquake since the bubble economy had just collapsed a few years earlier. I realize things are tough for the younger generation too now that I’ve had classes with a bunch of 22 year olds losing internships and worrying about the job market.

If there’s anything I learned from my early 20’s, it’s to look after your friends even when times are hard for everyone. You might not be able to travel halfway across the world during a pandemic to support them, but this generation has social media and video calling. I wouldn’t consider myself an anti-social media boomer, but I think young people should try using technology differently. My middle-aged friends and I rarely make social media posts or like/react to posts. DM’s and video calls are enough for us to feel connected.

Don’t worry about missing out on the so-called college experience if you’re a freshman or transfer. A memorable and fullfilling time in college doesn’t have to be a typical experience.

A song that I remember being popular when I was studying abroad was Makenaide by ZARD. It roughly translates to Don’t Give Up.","As an alumnus, I'm not going to tell you how to use technology or whether to worry or not.  That's because I am not equipped to do so. Actually no internet stranger is. Why? 1) nobody has ever gone through college sitting in their room in front of a screen during a global pandemic, 2) nobody knows exactly what you're feeling, 3) nobody knows your unique circumstances, 4) different people use technology in different ways - there's no right or wrong, better or worse, and 5) worrying isn't something you can just stop doing.

All the posts complaining about the challenges of going to college during the pandemic are valid and appropriate. I would be super stressed, anxious, depressed, angry, etc. from my inability to socialize and learn the way humans are meant to by nature and nurture, i.e. in person. This is only worse when it occurs during such formative years of life that you can't re-do every again. This is not catastrophizing - these are facts that we should accept and understand.

Use technology however you want. Worry however you want. Do college the way you want. When you have questions, feel free to turn to the subreddit for help. Or call a friend. Or text a family member. Or don't do any of that. We all cope in different ways. Do what works for you. Let's not dish out hackneyed advice.

Just know that we older Cal alumni feel for you. We'd all be struggling in your shoes.
People are angry and depressed because we feel like we CAN’T have access to a meaningful undergrad experience. For those of us who find socializing difficult, the “typical” undergrad experience made it MUCH easier to make friends. I joined clubs, I made study groups. I had a lot of fun. But now that school is online I don’t have that.

And no, I can’t just FaceTime people. That’s not how this works. My social life has essentially been reduced to my family members and my 2 best friends. My study group doesn’t want to talk anymore. My clubs barely meet anymore, and the virtual meetings are TERRIBLE.

Furthermore, I’m missing out on socializing with acquaintances and strangers. And isn’t that what college social life is all about? Parties, football games, huge lectures. I always loved the sense of camaraderie I felt with others. 

As a junior, I made the decision to continue pursuing my degree instead of withdrawing. Now I’m losing 1/2 of my college years. 

So yes. I’m angry and sad. And I’m worried. And I think that I have every right to be.
It’s good to get some perspective on this sub-reddit from time to time. I feel that as 20-something year olds we tend to lose sight of that the fact that college is at most just 4 years out of our relatively longer lives, and what happens here must not be the end-all for us.

Thanks for giving us that!!
I’m a 32yr old senior and I must say that it has been a real bummer to finally go back to school and make it this far only to have an online learning experience. However, because of my age I’m not worried about missing out on life experiences with friends. For me, the loss is in losing the engagement of the in-person learning experience. 
But for all the early 20s folks, I know this shit sucks but you still have all of your 20s left to fuck around, make mistakes, and have a blast. The plus side is that you’ll hopefully have careers and money to burn in your 20s rather than working 40-60hrs/week and having no money in your 20s like I did. Keep your heads up because your best years truly are ahead of you.
Also an older student and I think younger people should use social media exactly as it works for them. Just because you do it differently doesn't mean anyone is doing it right or wrong. They grew up with it. We didn't. It is part of how they socialize.
I don’t know man, undergrad years are pretty special. I would be pissed with online leaning as an undergrad, not to mention the lack of socializing. Losing a year or two of it is a pretty huge deal
U didn’t come back to CAL for like 20 years??
Bruh. Facetime your 2 best friends. 2 best friends are worth more than a trash study group
But on the other hand, it's because we only get 4 years of college (undergrad at least), and basically 1/3 of that is gone due to COVID, that many of us feel sad
Idk why you’re being downvoted. I agree with you and I’m pretty sure this is how most people feel.
Not that rare. I took 15 years off. One semester turns in to 30 super fast.
Same. Tbh in the beginning of this semester I spent quite a bit of time moping around about how sad my situation is, but at this point I’ve just given up and accepted it as it is.
I’m taking off as of now too. So I guess we in the same boat
Be careful not to stay away too long. Coming back is hard."
Surfing at Berkeley,https://www.reddit.com/r/berkeley/comments/nqr6sw/surfing_at_berkeley/,2021-06-02 10:26:31,"Hi guy, I’m moving to UCB in the fall from the east coast and was wondering if there are any clubs that go on surfing trips together. There’s a song by Surfer Blood that says “If you’re gonna move to the west, then you better learn how to surf” so I feel like I have to haha. I have some experience surfing, but I would like to get more into it!","I believe south of SF from about Pacifica/Half Moon Bay down to Monterey. More surfing down near LA of course.
[FYI](https://www.reddit.com/r/berkeley/comments/g29mkh/if_you_are_a_surfer_who_got_accepted_to_uc/?utm_source=share&utm_medium=ios_app&utm_name=iossmf)
Ok cool but are there any groups/clubs that go there together?
It seems that your comment contains 1 or more links that are hard to tap for mobile users. 
I will extend those so they're easier for our sausage fingers to click!


[Here is link number 1 - Previous text ""FYI""](https://www.reddit.com/r/berkeley/comments/g29mkh/if_you_are_a_surfer_who_got_accepted_to_uc/?utm_source=share&utm_medium=ios_app&utm_name=iossmf)



----
^Please ^PM ^[\/u\/eganwall](http://reddit.com/user/eganwall) ^with ^issues ^or ^feedback! ^| ^[Code](https://github.com/eganwall/FatFingerHelperBot) ^| ^[Delete](https://reddit.com/message/compose/?to=FatFingerHelperBot&subject=delete&message=delete%20h0cnjmm)
There is surf club and team on campus, they have social media pages to reach out to.
I doubt from CAL though it's possible. I'm guessing more like local Bay people. Perhaps Craigslist."
"Shannon O'Hara at the Lair of the Golden Bear family summer camp starting at age four: ""my dad in particular, a UC Davis graduate, still swore allegiance to the Golden Bears. … I learned the Cal fight song before I learned how to read. … Cal students taught me how to make s'mores, paint and dive.""",http://www.dailycal.org/2017/10/20/set-fire-red/,2017-10-21 22:10:34,,Brainwashed
To those of you who used to listen to music on the way to class,https://www.reddit.com/r/berkeley/comments/ji6mk2/to_those_of_you_who_used_to_listen_to_music_on/,2020-10-25 19:36:06,"anyone else listening to their playlist and that one song comes on and it reminds you of walking past the campanile at sunset after a long day of classes? yeah, me too...

(for me, it's love galore by sza)","YES OMG I CAN SMELL CAMPUS
Yooo that's a mood, mine is novocane by frank
idk if quarantine did this to me but i totally stopped listening to music, even when i study several hours at a time i get super absorbed and don't realize that i have my headphones on with nothing playing; and no i don't use adderall

but the music that got me thru the first half of spring 2020 was denzel curry unlocked and kanye west graduation. nothing beats getting fresh out the shower, sipping strada coffee and listening to good morning on a foggy, cold morning while walking from unit 1 to soda hall
loving is easy by rex for me
LOVE GALORE !!! I LOVE.

Mine is Hello? By Clairo
Yeah for me In Too Deep by Sum 21 reminds me of my bike :(
Make Luv by Brent Faiyaz reminds me of walking through sproul

Musty by Shoreline Mafia reminds me of RSF’s stairmaster
Post midterms I'd play Alright by Kendrick Lamar
for me its luving u by 6lack
yess hahaha for me it's Get Lucky by Daft Punk and Pharrell
I'm straight up searching up and listening to everyone's walk to class music now 

mine was another sad love song by khalid
I made a playlist called ""walking through Berkeley on a sunny day"" that I would listen to on particularly lovely days on my way to class. I just graduated and it makes me nostalgic now :')
For me, it's No Guidance. Reminds me of unlocking my bike from the racks across Wheeler and biking up towards Stanley absolutely surrounded by people.
bro, rapture by Blondie is hella dope, always listened when I was walking to class.
For me, it’s Tell me you love me by Galantis bc i remember they used it in the Bubly commerical that kept being played on YT during Fall 2019 lol
Yes for real this one hits.
Today by Mura Masa :(
You Won't Get What You Want by Daughters was the soundtrack of last year for me whenever I had to get to class. Truly a painful experience everytime
Bruh the flashbacks is damn real. Reminds me of struggles in Doe and shit lol
probably some smiths song cuz I got railed by a midterm
ribs by lorde. classic nostalgia song
Ordinary Man - Jonathan Coulton. 

Actually that whole album takes me back. Good times.
LITERALLY 😭😭😭
🗣🎶 BRAIN LIKE BERKELEY 🗣🎶
yo that's another one of mine too, also thinkin bout you
that song is absolutely amazing in every way possible
You got me fucked up
Played you Doom man you play Drake
frrr this is such a mood
Have you heard this beatbox/voice version?  It’s amazing...

https://youtu.be/R6zG6p1abZI
ahh yes that one, i still bump khalid’s american teen album regularly
oooh listened to that one a lot early march. reminds me of my gloomy drive home thinking i was going to come back when things got better in several weeks.
In My Room came out during my freshmen year and as an avid Frank fan, that was my freshmen year jam 24/7 haha
a fellow clairo fan I see ??
On Spotify there's this playlist called ""Khalid: The Complete Collection"" and I've been playing that nonstop since March lmao
ohhh yes"
"Join the official berkeley subreddit discord for meetups, school discussions, and other stuff",https://discordapp.com/invite/SYfBxKB,2018-08-20 20:39:28,,"'Watch Me Whip' is literally the worst song I have ever heard

The song ""Watch Me Whip"" is single-handedly the worst song I have ever heard. Before you get all bent out of shape, I do know that it's not to be some intellectual masterpiece of modern art; it is just factually a shitty song. Here's why:

Repetition:
This song takes repetition to a level rivaled only by songs written for 3 year-olds. The singer repeats his name a full 6 times before the third verse, just in case you were wondering who 'wrote'? No vocalised the script put in front of him. There were 980 'words' in this song. Is nae a word? Scratch that, I truly don’t care. Of those 980 words, three variations (Now watch, now watch me, watch me) represent 369 words. That’s more than ⅓ of the song for literally 3 words (and I didn’t include the single mentions of the word ‘me’). If we include ‘ooh’ (there are 84 instances) and ‘bop’ (there are 72 instances), which total 156, we have 525 out of 980 words made up of 5 words. I think we get the picture on this.

Simplicity:
The most complex word in this song is a tie between ‘Silento’, the vocalist’s (not an artist in my opinion) handle, the word ‘already’ (which appears literally once), and the word ‘superman’. Doing a quick tally, that means that 15 single word instances are 3 syllables. All the rest are 1 or 2 syllables. The vocabulary is not strong with this one. Look at that! My use of ‘vocabulary’ beat out this song by 2 whole syllables!

The culmination of the two previous points into the dumbing down of everyone who had the displeasure of hearing this song:
Pretty self-explanatory. Look, I get that the writer wasn’t going for a Pulitzer or a Grammy, but a quick hit that’ll be catchy and easy to remember. Fair enough. EXCEPT FUCK YOU YOU’RE LITERALLY RUINING MUSIC. Who am I to say what should and shouldn’t be written? An asshole, that’s who. One who is procrastinating other, important work.

Basically, by putting music out that has a grand total of about 30 unique words, you’re contributing to the lowered standard of quality of music. This is one step away from repeating one single word over and over for 5 minutes straight, which now that I think about it probably exists. Except that would have some comedic value at the very least. This shit, well it’s like a kindergartener took a crayon and drew a stickman (poorly, I might add), that was subsequently put up in an art gallery. Real, impressionable children will listen to this and think “ Wow, dad was wrong! I CAN skate in life only knowing less than the bare minimum needed to be able to read ‘See Spot Run’, which I never did because fuck books and education”. (Side note - That interaction wouldn’t have been possible outside the child’s head, since there are too many unique words used)

Now put on your tin-foil hats, because this is where I lose half of you with my bullshit. Songs like this promote the opposite of education. Like I said, it devalues a halfway competent vocabulary in the name of catchiness and a cheap ‘musical’ fix. When you see what can be presumably defined as success (ie having several hundred million views on Youtube and countless other radio plays), it sets a standard in young, impressionable minds. We’ve had many people trying to get past this dumbing down of society, like KRS-ONE, Stevie Wonder, John Lennon, and many others (No, of course not all of their songs). They were trying to create a more engaged people who reflect on the actual issues we face as a society, instead of making up a cute little dance to go along with your shitty track as your brain melts from lack of use.

Who is the target market for this song? For all the reasons I’ve brought forth, I believe the target market to be the typical vapid, vacuous consumer that doesn’t engage in critical thought related to anything more than whether the Kardashians look better in blue or teal. I realise that I’ve made a broad, fairly baseless claim, and yet I’m confident it’s pretty accurate. Songs like these placate the masses with their simplicity and safety. You don’t need to think, you don’t need to guess what it’s talking about, you just need to follow these three easy steps and you too can conform to the newest dance craze. Independent thought is the antithesis of this track. By listening to this, you are using time that could be spent thinking of ways to better the city/country/world you live in. Again, I realise that not everyone WANTS to engage with the world like this, but I will still stand by the claim that critical thought is better than being herded like a goddamn sheep by pop-music.

So what have we learned today? Well, mostly that I’m way too mad about a song. That’s a given. What I want to really stress is that this song is symptomatic of a larger issue at hand. Like the CIA funneling crack into ghettos, to me this type of music represents a concerted effort to quell independent thought. Ultimately it’s easier to listen to a catchy song with like 7 words than to actually sit back and think about why everything is kind of messed up.

I really, truly fucking despise this song.
Uh what "
Congrats fellow graduates!,https://www.reddit.com/r/berkeley/comments/nd4vxc/congrats_fellow_graduates/,2021-05-15 11:10:25,"We made it! 

To my fellow transfers especially, we moved heaven and earth to come to Berkeley only to get less than a year of the full experience. But we are resilient and more prepared for future challenges in life and work as a result. And so are the ones who came in as freshman.

My mom graduated in 1999 when this song came out. I think it's still great advice for today: https://youtu.be/sTJ7AzBIJoI

I also recommend watching *The Graduate* (1967) on HBO Max. It's about a recent college graduate who's worried about his future. Part of the film takes place at Berkeley, and some of it was actually filmed on campus. The first time I watched it was when I was in community college, but it resonates a lot more strongly as a graduate.

Good luck to everyone, and again, congratulations!",
