title,link,post_time,post_text,comments
ECON 100B with Mina Mirazimi,https://www.reddit.com/r/berkeley/comments/1co6jhy/econ_100b_with_mina_mirazimi/,2024-05-09 13:04:51,Is anyone taking ECON 100B with professor Mina Mirazimi? How is the class? Is it easier to get better grade?,Just take it anyway. How hard can 100B be
Econ 100B,https://www.reddit.com/r/berkeley/comments/1dj2jib/econ_100b/,2024-06-18 14:49:30,"Has anyone taken 100B with Mina Mirazimi? How was her class?
",
Econ 100B,https://www.reddit.com/r/berkeley/comments/1ce86zh/econ_100b/,2024-04-26 23:55:37,Does anyone know how Econ100b with Mina Mirazimi is? ,"She’s a new professor from Haas.
Do you know how her class is and how she teaches?
She taught Micro this semester and her GSI carried the class 🤣 but her exams are okay average is about 80% , offered homework that are worth 100 points each. She’s a nice person but not an effective instructor. I’m not sure how this class will go but she said it should be easier.
Thanks for the information!
taking 100b with Mirazimi too in the fall! Are her lectures mandatory, or do you suggest moreso going to the discussions and self studying?"
Has anyone taken classes with Prof Mina?,https://www.reddit.com/r/berkeley/comments/1brdc1c/has_anyone_taken_classes_with_prof_mina/,2024-03-30 01:54:53,"&#x200B;

https://preview.redd.it/ayewejf5rfrc1.png?width=2078&format=png&auto=webp&s=351ef9ab694d7ef019c7e0a4b774d449f7b93f78","currently taking 101a w her rn
how is she?"
