title,link,post_time,post_text,comments
Hit and Run,https://i.redd.it/2oqjenufqyxa1.jpg,2023-05-04 19:11:28,"To the person on the electric scooter who was hit by a truck at the Arch st/Le Conte Ave and Hearst intersection at about 6:17 today: DM me for a photo of the license plate.
Also, I know you felt ok enough to scooter off but please get a checkup in case you’re hurt!","I would report this (with the photo) to Berkeley PD (non emergency number), just so they can open a case on it. That way if the person is not on reddit, but still report it, it can be tracked.
don’t be shy, reveal the license plate of this pavement princess
I'll never understand why people are so insistent on censoring the license plates of violent and dangerous drivers. They don't give a shit about running someone over and potentially leaving them for dead, why should anyone give a shit about their ""privacy?""

Driving a car on public roads, i.e. operating potentially-deadly heavy machinery amidst other human beings, does not come with any expectation of privacy. This is literally what license plates are for — holding law-breaking drivers accountable.
Bruh bruh, I do civilian-level street intimidations for cash payouts AND amateur tort law client representation, hit me up for some $$$ or we can juke this dude out his whip.
all those country shows at the theatre
That’s illegal.
Done! Thanks for the tip, I wasn’t really sure what to do."
Thanks for another successful cleanup everyone!,https://i.redd.it/cg185c24s5j91.png,2022-08-21 17:27:17,,"Awesome, as always, and Happy Cake Day!!🎉🥳🎂🎈🥂
Woohoo
thank you for all that you do!
Disappointing
Double W
Thank you! It was great work by all 9 awesome people here!
Couldn't have done it without the help of my fellow bears!
If disappointing why don’t you come and help out??"
OCF Water Bottle Graveyard,https://www.reddit.com/r/berkeley/comments/1be47h0/ocf_water_bottle_graveyard/,2024-03-13 15:00:53,"&#x200B;

[our babies](https://preview.redd.it/fm8thtymb6oc1.png?width=4032&format=png&auto=webp&s=ae945f444f64f1df0246c3f7ec15b70f621060bb)

have you or a loved one lost your dear water bottle in the motherland (the OCF)? we have not one, not two, but 14 water bottles left unclaimed.... pick it up during open hours!! or else I will eat them  


p.s. if you have the metal Citadel water bottle, you left your tea bag in it... I am NOT going to be opening that one !!","I counted 22 in my lecture hall in Mulford yesterday! I love my water bottle so much, that I’d search high and low if I ever lost it!
Low-key could you give me one if someone doesn't come claim it?
You should see the moffitt lost and found closet. We have over 200 water bottles 🧍‍♂️
I’m gonna steal one
ok u want an award or what....!!!! this is about OUR water bottle stash !!! or we can combine them...
only if you come to the OCF and beg for it..
post them ! I need to steal a hydro flask teehee
I say we combine them! Make them the largest water bottle collection on campus!
Lk that's kinda hot"
Heads Up: Fare Integration Discussion Topics with AC Transit and BART this week!,https://www.reddit.com/r/berkeley/comments/q6nlga/heads_up_fare_integration_discussion_topics_with/,2021-10-12 07:36:32,"**Actions:**

The AC Transit and BART boards will receive updates this week on the Fare Integration study and will weigh in on their level of support. You can help by writing an email to or making a public comment at the boards ***for the agencies you use regularly*****:**

* Oct. 13, 5pm **AC Transit** [Agenda 6B](https://u1584542.ct.sendgrid.net/ss/c/P8Elou2Rvc0qoMPEUZrMXTg-hPQc2DPIb2q_hnVC0Sfz1ZgT6X5rZr2O8GRaGLrvCLMd1pEEmAOvVLiG36p0Gq5Td4k4CumJy36CVX7oUvpHSRu_TvN8xq_9Jx7Xc9KCKSb-jNTAcN7FpDjHxTxIdUk_KZAXBtVIdz85M3ycl7-dQ_C0N21MzY1Uu4LS6ml7Oyw0hwvBMIXAMhyb64v7FzyJgahMG8pmD1ZAVALx9ZCHOHVj8HGhYBmz-g6PPkClMtcfio-hR0547hdyPZwmUXRc69SIZw_fjih2_OSbjHt1dM1tKyIp_zayaD9Q-3Kh8jIgWIxyAWBCJ_TDGtJNxldm7qFMJqydNDdKOKr0gqxqnW6CibTQyisXMsSpsW_mYR_uDVseIuKE3aYZkuCQeH-aUtuMjY2EC5o9M7GuvCzs8cwzawwQeUIAFukr43tvDaepPZhUF76pePImZ3wiOezkRMvPOVhtJqUGNWOMzWINu2Th10RwFS-PmmL_Haye/3g2/S8daIensQryPPYcYcWxSPA/h2/3WlD7fEapHK74wRVC7lQe1FjNC9OWLPB22gvgh0sd0Y). [Zoom Link](https://u1584542.ct.sendgrid.net/ss/c/P8Elou2Rvc0qoMPEUZrMXcwXWxm4KHiH8_9z5ffSKuFFqNx24mMwRig5xBAwPOPogVx5--Tw3oir2cyEZ_hG5kBakUWc3XS-3jDq2lJRD3IOkb0YIHQdJH4Ror0lGR5pUq6HjXqZeA8nwWgCgAoAmPWGPJ7xjRqTVzJVCuz9tYlsYBtynwqB8OJrq-mgysgilOW-0m_JRNhS7WlAQybbODdk6YeMb8ZAMFIkDLwjb9VXp_av_44Hy05qN7yirrw7U9SuvXXLd2tN1KGRswI3YMweHulvJ5RTWN_RqNnd7TwNbeg4OUYE982BYd6J3GZPMpb_LQkTyMaAYrfKtYPXZ8V7JPtjEZbW9Mx0ZDqbG0WISt_HDezVh6xFQyFLzY6QsseKzzQJQVB8zoqirbmOHA/3g2/S8daIensQryPPYcYcWxSPA/h3/z_Tz2twsB1Rmk1u934rvTsGsVrvy40S2DYjAlbxXc4Y). Email: [myvoice@actransit.org](mailto:myvoice@actransit.org)
* Oct. 14, 9am **BART** [Agenda 6C](https://u1584542.ct.sendgrid.net/ss/c/SVVf6UGddUySPN6znLYVWpHa7ndRspnMTTZgMJRP-PmOs91EQdmdLK0ZmXIWjQwL6KFZnfA9kGmryIs0YhpIjcOBZwMtD_yW_B3xiDh3WJTFXJgkuzhon3R6enIIWdKo2TN72deGBNLvmLHyfVj2oZh80lvjKk3ED8Y5eabm3bF2i-FdK1E5WjPlzsxFljJI4Acr13-6_uBqlo3H7P9FCnmo8e_sbiTsl6fvzlK71W3KL5C2JsdM-l5s1UygYcGUniRhg5hNpO9UjOqjG7v_Hbs0bXRymF20KXgvf7ATTDpbiCCCvTuo_lHKKhz1PBkzfC7cwSmEPYOOrd4YBD7gFjcDvejzEjkm-Af4yIBbjxilnPDoWlk_KDpe9wYH2R9buRY8cUoGpJ9rn5oSqr2NmaZ2BQpJur5QtI_9oLkPk0owooq_GkpJQ2xH5g-Ev7nYNZUW-kWsrXFnigPqVMhWohWieYFExvJe9K4giiouSSdziVkP_B8yNOZGINCnqMB9/3g2/S8daIensQryPPYcYcWxSPA/h4/l-mPHrq7yUFLWYjezRow5at61nZkJeMAdi6dT8LqQtc), Log into Zoom.com and enter access code 825 1046 5255. Email: [board.meeting@bart.gov](mailto:board.meeting@bart.gov)
* [Sign up for alerts for when it's time to speak.](https://u1584542.ct.sendgrid.net/ss/c/A7GQnnr_XzUYyessq5BiRN0DWsRbYeVfXKuWklECXHleBZM920cYE4gAuBORqr3p8At5wHouaIkrE5fgpC6b_RtkYFLy19ly5q3HXysuiBvvgiKHrAEuq50bl2o08Ff6hPsSdSqY6hMmXv8oDjJ8pEDr3yNicyDDBVK-yDvtvAYOVP2kfAd4L2wABnH6gcsqMlUf3gIq6NkCNmPv1ygKX7jIReS-XVXljT9FPYShfYCN9RZwO4o27UmTBv_UZp3HT0mHOUAHf8IpaWn1M6P_R-wXeNFPrFaN6cpmOvGVXiQsg9g8XdESClzpWvXpbQUEvA5Oyz9kntMwINrND5D9iwnlBKGfRU7zOW-F2NkyZyy4g5iEGFY2ZaZDQco9BJNXNiI0RlO-A3npqVWxShcjOg/3g2/S8daIensQryPPYcYcWxSPA/h5/ID03v7I1b57ngAPMHRZpLQvOcAGryb0w_lOsuyMs1U4) at either of the above meetings this week. 

**Context:**  
This week, transit agency boards are weighing in on whether to support integrated transit fares.  [Integrated fares](https://u1584542.ct.sendgrid.net/ss/c/atcYNHk4Eh2YdGnwBh-YDPBC_2qPv7WKfzKLXVjCZKzk0-OeU4pYT66WrxEcToe294raIOxPT3BPrq4Vd7-QCMQco9EQfSoJw4LLRmBf5gLCl4jZ27J71By-cYsCmNgr8aBkRH2lhk5IBnZ6jb2e2MiaYcyxc1Bcy0bG3U7QnyWpKsSAyJ-TpWg8nKQ8hmaBA9HNQZ6Jk8GpUsYckVMvWf-I4p_GG_kJQpeSG2oA59V0o4VLI_Pq4NRZ_MTyeiq6yhq6zMEue3cqbVZM4uDpGjjZtzKLi9qwGKDFd8UoUQmt4-VRGOMxjgcssqay5JFhbzhkFSaCORIpTAsw7FrWpQfb3xwNpBcGLdWZOm7uAYi1QBlFHeWEJEE0ysE9dwPP8tFoQi1PLHUrwHKYb2BdHTc1iZedsHY2Swt_zZcob1o/3g2/S8daIensQryPPYcYcWxSPA/h0/jWPg0KLHMl2zNjWH6NmPZ-QXi4bgzVY6bQdeyK7RHUY) are not only a critical part of a rider-first, seamless transit system but also a cost-effective policy that could help to bring riders back many more riders to transit.

BART’s weekday ridership has been running below 30% and AC Transit local ridership is still less than 50% of pre-Covid levels.

Making transfers free between agencies could add over 25,000 riders, a similar scale as flagship bus routes such as the AC Transit 51 lines; or both downtown Oakland stations together. And standardizing regional fares (BART, Caltrain, ferry, express bus) could help add about 69,000 riders, as many riders as another pre-Covid Caltrain.

As the pandemic eases and people adapt to new travel patterns, the regional fare [study](https://u1584542.ct.sendgrid.net/ss/c/tTBUZwcBH_2q13Ow12s-jckP20jWxBj3X4ev8eQSSIy3xELxy-gwghDjaXnqwIlt1qc3-WUcQbb24tZriw_aWbyJoUJH6uXe1zg_DTjXPrYzjCxFA68r3_dgQ_4PgdWuZX-4Fv-CnxgCvpJUmCDpDOH8BsRE0mmFFIqW4x5Xa-Xr5AiHQPENnkbLTmIYNV0ncpt92PVAe6sCNVmPGFotL8Ss1VTJ0zup3Kj-uAjfGmGOTef3McbcqujAVJET3_ZbywB9I_DRIntv2b8JFwchLDeYUUroqZCfTS8QovIsKXtPZnzUpJ-RDuN7KJeDNLRO37H1NBbUETzBXDEETxDLBgtCG7tEXrh5FYO-pY3LljrheBQZVj07kMy7XtvtNZlElvV4hBeeO49UqauFVGfJKJKeLBZmpae1Os01vHgjQqPeVvgak7XLnbOf6YRAXqUnz-2HaDgBKINjVM1ZYnjTOQ/3g2/S8daIensQryPPYcYcWxSPA/h1/BtYecKJOsAwSQvloNA6OUZ_n3J6wtmqo31VeV35x8p4) shows that fare integration can be a powerful strategy to restore transit ridership by making transit more convenient, attracting new riders and new trips.

**What the hell does this mean for Cal?**   
The Campus relies on both AC Transit and BART (as well as others such as SolanoExpress, WestCAT, and MUNI) to commute to the campus. Many students and employees have asked for integrated or discount fares to get around; however, it's rather difficult since Parking & Transportation is a self-funded unit and can only provide as many programs as budgeted (P&T pays out \~$4million annually to AC Transit, the higher education discount through BART would be estimated at  $800K to $1.4 million annually)  


As the development of the campus' master plan and Long Range Development Plan takes shape, as well as a ballot measure to renew the Class Pass in 2023, the campus stands to not only lose parking spaces, [but use this as an opportunity also be partners with the Metropolitan Transportation Commission to improve the Clipper Card program](https://mtc.legistar.com/MeetingDetail.aspx?ID=878224&GUID=69137C12-A9E3-4ACD-A51A-A9BE55274CDB&link_id=1&can_id=2a9949098c82f89a28e849287240afb5&source=email-this-coming-week-support-seamless-fares-at-sfmta-samtrans-caltrain-ac-transit-bart-2&email_referrer=email_1320093&email_subject=this-week-support-seamless-fares-at-ac-transit-and-bart) by support institutional passes such as EasyPass. It would be also important as we evolve in a post-pandemic world that  the campus, along with the region and state, get serious about environmental impacts due to increased driving and congestion. For students, this means expanded access to jobs and social events in SF, Silicon Valley, and beyond.",
Looking into MS/Post Bacc IN CS?,https://www.reddit.com/r/berkeley/comments/brv3pt/looking_into_mspost_bacc_in_cs/,2019-05-22 15:19:30,"&#x200B;

Hi All,

So I recently graduated in August 2018 from UC Berkeley

My Major was in Cognitive Science with a 2.912 GPA.

Coding Classes I took

CS10 - The Beauty and Joy of Computing - SNAP/ 10% Python - Learned Recursion, If Else, Functionality of programming

CS61A - The Structure and Interpretation of Computer Programs (C+) - Python

CS61B - Data Structures (D+) - Java

Cog Sci 131 - Computational Models of Cognition (B)- Learned PCA Algorithm/K-Means - in Python

At a California Community College

COMSC 2 Assembly Language for x86 Processors (B+)

MOOCS

CS50 Harvard on EDX - Learned C - Introduction to Computer Science,

Stanford Machine Learning by Andrew Ng - in MATLAB

Work Experience:

6 MONTHS in Non-Coding Database Monitoring Job

&#x200B;

I wanted ask which way is the best route for me to get a Software Engineering Job? I am focusing on getting an Post Bacc/MS in Computer Science so I also wanted to find out which programs I should apply to? I could not do CS at Berkeley but not giving up on it. Would Bachelors or Masters be better for me?","In your situation I would probably try for a masters instead, but really you should be able to get a SWE job without either.
You don’t need more education; you need to grind prep materials for interviews and coding screens."
Anthro 3AC Questions,https://www.reddit.com/r/berkeley/comments/2bz4o3/anthro_3ac_questions/,2014-07-28 13:02:43,"After deciding that Anthro 3AC did vaguely interest me, i visited ninja courses, only to find that the ratings for this class didn't seem very high. For those of you that have taken this class with Hirschkind, C K as your instructor, how was your experience in this class and would you recommend it or not?","I really liked this class with Hirschkind. I thought he explained things fairly clearly, even if sometimes it felt like he kept repeating himself. I guess he just wanted to be sure everyone got it which isn't bad in a professor. I have noticed that people who aren't primarily interested in Anthropology can have mixed feelings about the class. Some people think its interesting while others complain that its too much reading or its boring and pointless. The reading wasn't actually bad at all and came from a lot of different sources and there were many topics discussed which kept things moving. I would recommend :)
I took anthro 3ac my freshman year with Hayden, and it was the most fun class I've ever taken. It made me want to become an anthro major. As an upperclassman, I took Anthropology of Religion with Hirschkind.  I would recommend Anthro 3AC. It is not hard, and if you get a good GSI you will do well. It is one of those classes in which  your GSI can make or break your experience. 
As for Hirschkind, he's very nice and I recommend going to his office hours, he does repeat himself but that helps understand concepts that are not clear. His religion class had an open notes midterm, two papers that were graded pass/nopass, and a final. The class itself wasn't hard but the TA's that graded our work sucked. The amount of reading he assigned was fair and he went over it in class. 
While i'm sure the readings were interesting for you, did you feel that there was a lot/too much reading at some points? How were assignments/tests for you? Any tips/advice before I take this class?
There isn't really anything you can do in advance to prepare. The readings only felt like too much if I had a lot of other work for my other classes. There was like 2 readings a week, some long some fairly short. Even if you don't finish the readings he covers them very well in class. Lecture is just him discussing the concepts in the readings. I remember the tests being pretty fair if you understood the concepts and remembered examples from the readings. I think they took attendance at section though. There was this ethnographic project you have to do where you go somewhere for like maybe 8 hours total and write an ethnographic paper (like 8 pages I think). They give you a lot of time on it and you turn things in in steps throughout the semester."
My car got towed on a game day and I got double my money back,https://www.reddit.com/r/berkeley/comments/qrdwox/my_car_got_towed_on_a_game_day_and_i_got_double/,2021-11-10 21:30:00,"If your car got towed on a game day, you might be able to get double your $220 tow fee back like I did.

I was stupid to park on a game day tow zone a couple weeks ago. In my defense, I had parked 150 feet from the sign. I'm appealing the ticket from the city for that reason. My car got towed by this company called Avenue-Berkeley tow, and I picked it up from a UC Berkeley lot on Bancroft but was required to pay a tow company $220 to release my car.

The tow company actually so sloppily filled out my itemized receipt that they didn't put down my address, location of the tow, and vehicle identification, or anything besides my name, DL number, or me paying the $220. Something wasn't right, they didn't even have business cards when I asked for one.

I looked up the California Vehicle code, and  California Vehicle Code Section 22651.07(g) states that,  


>(g) “Itemized invoice,” as used in this section, means a written document that contains the following information.  Any document that substantially complies with this subdivision shall be deemed an “itemized invoice” for purposes of this section:  
>  
>(1) The name, address, telephone number, and carrier identification number as required by subdivision (a) of Section 34507.5 of the person that is charging for towing and storage.  
(2) If ascertainable, the registered owner or operator's name, address, and telephone number.  
(3) The date service was initiated.  
(4) The location of the vehicle at the time service was initiated, including either the address or nearest intersecting roadways.  
(5) A vehicle description that includes, if ascertainable, the vehicle year, make, model, odometer reading, license plate number, or if a license plate number is unavailable, the vehicle identification number (VIN).  
(6) The service dispatch time, the service arrival time of the tow truck, and the service completion time.  
(7) A clear, itemized, and detailed explanation of any additional services that caused the total towing-related service time to exceed one hour between service dispatch time and service completion time.  
(8) The hourly rate or per item rate used to calculate the total towing and recovery-related fees.  These fees shall be listed as separate line items.  
(9) If subject to storage fees, the daily storage rate and the total number of days stored.  The storage fees shall be listed as a separate line item.  Storage rates shall comply with the requirements of subdivision (c) of Section 22524.5 ([https://codes.findlaw.com/ca/vehicle-code/veh-sect-22651-07.html](https://codes.findlaw.com/ca/vehicle-code/veh-sect-22651-07.html))

 

California Vehicle Code § 22651.07(k) states: ""A person \[business entity under  who violates this section is civilly liable to a registered or legal owner of the vehicle, or a registered owner's insurer, for up to two times the amount charged.  Liability in any action brought under this section shall not exceed five hundred dollars ($500) per vehicle."" [https://codes.findlaw.com/ca/vehicle-code/veh-sect-22651-07.html](https://codes.findlaw.com/ca/vehicle-code/veh-sect-22651-07.html)

I emailed the tow company and requested double the amount back, cited these laws, and promised to take them to small claims court if they didn't comply. They will be sending me back a check for $440.

If you've been towed on game day, CHECK YOUR RECEIPT. If it's as sloppily filled out as mine, you're entitled to compensation.","Always good to figure this stuff out to recover your money when they didnt do things correctly. But also, strict gameday parking rules have been around for a long time. To you or anyone else reading, make sure you read up on that before parking, might not be able to get out of the next one. They dont fool around on gamedays.
fuck yeah dude. fuck towing companies.
Hey! My name is Jack Hughes - I'm a writer for the Daily Californian. Is there any way I could interview you sometime tomorrow for an article? (Open offer to anybody that's had this happen to them).
You absolute legend, i love to see it 🔥🔥🔥
Well done, OP
I’m looking at Van Patten’s card and then at mine and cannot believe that Price actually likes Van Patten’s better.

Dizzy, I sip my drink then take a deep breath.

___

^(*Bot. Ask me who I can see.* |) [^(Opt out)](https://www.reddit.com/message/compose/?to=botrickbateman&subject=Opt%20out)
I looked up this company's contract with the city, the city is literally paying them $45,000 to run their business model that basically extorts car owners, and disproportionately hits lower income people. It's infuriating."
101 Things to do before you graduate (the list),https://www.reddit.com/r/berkeley/comments/177yjgl/101_things_to_do_before_you_graduate_the_list/,2023-10-14 13:40:15,"Which of the following do you think is a must or underrated? Which one is your favorite?

&#x200B;

1. Befriend a campus squirrel.
2. Learn about UC Berkeley's history at Bancroft Library
3. Convince yourself Golden Bear Cafe serves great meals
4. Create a post for [r/berkeley](https://www.reddit.com/r/berkeley/) that gets more than 100 upvotes.
5. Find the best secret napping spot on campus. It's a real skill.
6. Join a Sproul Plaza protest. Any will do.
7. Try every boba spot in Berkeley. If you don’t, did you even go here?
8. Survive a year without a mental breakdown.
9. Top Dog after 2am
10. Hike the Fire Trails in flip-flops
11. Get lost in Main Stacks
12. Make the trek from Foothill to Dwinelle in under 10 minutes
13. Go to the Big Game. Try to understand what's happening.
14. Encounter a raccoon the size of a small dog and tell everyone it was a bear.
15. Join a random dance circle in Lower Sproul. The more awkward, the better.
16. Sign up for an RSF class and never go.
17. Find an open seat at Moffitt during finals. Good luck.
18. Buy something random from a Telegraph Ave vendor.
19. Try not to get sick during flu season.
20. Declare your major before senior year. Just kidding, we know it’ll be last minute.
21. Ride BART without being harassed
22. Walk through Southside without getting a flyer on the first week
23. Find a hidden gem restaurant on Northside
24. Ride the 51B without getting dizzy.
25. Spend a day at the International House
26. Bowles Hall haunted house (this month!!)
27. Spend an hour at Moe’s without buying anything.
28. Berkeley steam tunnels. Decide you’re not that adventurous.
29. Attend an obscure film screening at BAMPFA. Pretend to get it.
30. Attend Cal Day. Act like you’ve never seen the campus before.
31. Conquer the climbing wall at the RSF.
32. Attempt to play an instrument with the Cal Band.
33. Take a DeCal on something completely out of your field.
34. Sunbathe on Memorial Glade. Forget sunscreen.
35. Complain about AC Transit like a local.
36. Attend a midnight rally. Go Bears!!
37. Figure out why it's called the ""Naked Run"" before deciding if you want to participate.
38. Form a study group where everyone brings snacks and no one studies.
39. Join a club that has nothing to do with your major, just for the free pizza.
40. Take a class because it sounds easy, and end up questioning all your life choices.
41. Advocate for a statue of Oski next to the Campanile.
42. Engage in a heated debate over which boba place is the best.
43. Sleep everywhere except your bed, including the libraries, and yes, even the glade.
44. Wear shorts during a Berkeley winter and act like you're not cold.
45. Get to a 8 am class by 8:50 am and consider it an achievement.
46. Find all the Free Tibet graffiti around campus.
47. Make friends with someone solely based on their lecture notes.
48. Create a ""safe space"" for those traumatized by midterm grades.
49. Get a selfie with Oski!!
50. Spend more time picking classes than actually attending them.
51. Attend a frat party and critique its architectural design
52. Set a record for the fastest sprint between two back-to-back classes on opposite ends of campus.
53. Learn to pronounce “Sproul” correctly, then correct everyone else.
54. Binge-watch K-Dramas in Moffitt, insisting it's for a project.
55. Label all your food “biohazard” to keep your roommates from stealing
56. Wear a Stanford hoodie for a day and count the dirty looks you get.
57. Try every single flavor at Yogurt Park.
58. Pet every dog you see on campus in a day
59. Watch a sunrise/sunset from the Big C.
60. Check out the view from the Campanile
61. Take a computer science or Data Science course, even if it's just an intro
62. Attend a performance at Zellerbach Hall
63. Explore the UC Botanical Garden
64. Visit Tilden Regional Park
65. Visit Indian Rock Park
66. Attend a noon concert at Hertz Hall
67. Attend a Cal Bears football game at California Memorial Stadium
68. farmers’ market at Downtown Berkeley
69. Visit the Berkeley Rose Garden
70. Run or walk the Berkeley Half Marathon
71. Concert at the Greek theater
72. Brunch @ La Note
73. Pizza @ cheeseboard (the line is part of the fun)
74. Visit every library
75. Try a new Fruit at Berkeley Bowl
76. Rent a canoe or kayak at the Berkeley Marina
77. Basketball Game at Haas
78. Game Day on frat row / Tailgate before a big game
79. Go to the original Peet's on Vine St. (2124 Vine St,)
80. Go to a professor's office hours
81. Lawrence Hall of Science
82. Tour of all the dinosaurs in VLSB
83. Sunset from the 9th floor of Bauer Wurster Hall
84. All-nighter at Moffit or Main Stacks
85. Get lost in Dwinelle
86. Study in the Doe Library Reading Room
87. Visit every on-campus museum
88. Take a dip at Strawberry Canyon Pool
89. Ride every Bear Transit route in one day
90. Do a midnight scream during finals week
91. Participate in Cal Hacks
92. Watch a show at the Berkeley Repertory Theatre
93. Get a slice at Pizzeria da Laura
94. Faculty Club Prime Rib Dinner
95. thrift shopping on Telegraph Avenue
96. Watch a UC Berkeley a cappella group
97. volunteering at the Berkeley Project
98. Take a pottery class at the Berkeley Art Studio
99. Attend the Homecoming events.
100. Go on a weekend retreat with a student organization
101. Throw your graduation cap in the air at the Greek Theatre!!  


Bonus: 420 at Memorial *Glade*

&#x200B;","finished 43 this week, nap during the exam
See, this list is just one more of the things that make me wish to be here for more than a year.
4 19 20 21 24 61
Some of the steam tunnel infrastructure shares a space with networking equipment; I'm not going back in there or in any other steam tunnel space unless I'm getting paid.
If anyone’s gonna do 54, lmk
no idea but ive done most of these xD
Used to be that making a UCBMFET meme was one of these, RIP
Did anyone else notice the jump from 59 to 70 in the list or is it just me?
Was this written by AI, or just a human approximation of it? “Attend a Cal Bears football game at California Memorial Stadium” lol"
